"date","fav","id","rt","text","url"
"11/12/2012 15:48:18","","278511534295101440","","@aykrmela tenemos que pillar la costumbre de hacer captura de todo lo que mole antes de compartir nuestro hallazgo, por si moscas!","twitter.com/Rocigaot/status/278511534295101440"
"11/12/2012 15:46:16","","278511020048252928","","@aykrmela mozilla, voy a probar con el Chrome, a ver...","twitter.com/Rocigaot/status/278511020048252928"
"11/12/2012 15:45:39","","278510863713972224","1","Hola, saqué #35matrículas y grabo videos caseros en un descampao. No me explico por qué la gente se toma a chufla mis soluciones a la crisis","twitter.com/Rocigaot/status/278510863713972224"
"11/12/2012 15:36:56","","278508673570054144","","@aykrmela @XoseMorais me pide contraseña para entrar. Os habéis descojonado demasiado descaradamente y ahora nos quedamos sin risas :(","twitter.com/Rocigaot/status/278508673570054144"
"11/12/2012 12:47:42","1","278466083470598144","5","@cot_julia Ana Botella intentando disuadir a la presa que se la quiere beneficiar al grito de '¡noo! ¡esto es mezclar peras con peras!'","twitter.com/Rocigaot/status/278466083470598144"
"11/12/2012 2:49:28","","278315533319933952","","@xoancastro @CaminoAna creo que foi porque é mellor retirarse no máis alto e que quede coma un clasicazo e non prolongala e que decaiga...","twitter.com/Rocigaot/status/278315533319933952"
"11/12/2012 2:39:41","","278313072257560577","","@xoancastro @CaminoAna eu a biografía de touriño mercaríaa se incluíse edición papel da touripedia, as cousas como son","twitter.com/Rocigaot/status/278313072257560577"
"11/12/2012 1:23:11","","278293819982749696","","@CaminoAna vai ser o estreno do ano, non cabe dúbida...","twitter.com/Rocigaot/status/278293819982749696"
"11/12/2012 1:13:35","","278291400993423361","","@CaminoAna ese sería grandérrimo! e seguindo a moda das memorias de políticos, unha autobiografía de Conde Roa...","twitter.com/Rocigaot/status/278291400993423361"
"11/12/2012 1:04:47","","278289187592097792","","@CaminoAna qué será o próximo? Eu voto por un libro de Cristiano Ronaldo sobre cómo saír da crise...","twitter.com/Rocigaot/status/278289187592097792"
"11/12/2012 0:55:56","","278286959749758977","","@CristianMas86 es un plan para todo 2013, dale tiempo. (Que lo veo exagerado. La ropa de Desigual es horrible, pero si quieres follas igual)","twitter.com/Rocigaot/status/278286959749758977"
"10/12/2012 23:52:56","","278271105280647169","","@Genko Sabiendo esto, la próxima vez que me hagan un mongoreply de 'vete a Cuba' voy a considerar la propuesta con mucha seriedad..","twitter.com/Rocigaot/status/278271105280647169"
"10/12/2012 21:49:31","","278240046438576128","","Leo algunos tweets que dicen que lo de Cervera parece de Mortadelo y Filemón, y disiento totalmente. Es más de Anacleto, agente secreto.","twitter.com/Rocigaot/status/278240046438576128"
"10/12/2012 21:14:29","","278231230418399232","","A Cervera no le preocupa su futuro tras dejar la política porque ha recibido un mail de un príncipe africano ofreciéndole un negocio genial.","twitter.com/Rocigaot/status/278231230418399232"
"10/12/2012 21:11:10","","278230397161197569","","Oir rumores de ERE parcial e ir a la cena de empresa navideña vestida de Desigual, a ver si tu jefe lee entre líneas y te libra de la quema","twitter.com/Rocigaot/status/278230397161197569"
"10/12/2012 17:13:11","","278170506132324352","","@RaquelMartos las primas están muy por encima de los 18. No tienen nada que temer de Berlusconi...","twitter.com/Rocigaot/status/278170506132324352"
"10/12/2012 16:17:03","","278156377921302529","","#tengounplan Pues si una tía buena, vistiéndose en Desigual, necesita un plan para todo 2013 para tirarse a alguien, como para comprar ahí..","twitter.com/Rocigaot/status/278156377921302529"
"10/12/2012 15:57:30","","278151458979987456","","@IagoFB yo desde que supe que la Obregón había publicado su autobiografía ya no me asusto de na...y lo mejor es que hay quien los compra!","twitter.com/Rocigaot/status/278151458979987456"
"10/12/2012 15:50:36","1","278149724421369856","","@IagoFB pues a mí me alivia ver que es un libro SOBRE Sergio Ramos. Había entendido que lo había escrito él, y eso sí que era apocalíptico..","twitter.com/Rocigaot/status/278149724421369856"
"10/12/2012 15:36:34","","278146191244554241","","#tengounplan para trepar vestida con prendas de @Desigual_ES . Voy así vestida, el jefe se pilla una baja por epilepsia, me quedo su puesto.","twitter.com/Rocigaot/status/278146191244554241"
"10/12/2012 15:13:53","1","278140483967012864","","Moraleja del anuncio de Desigual: 'Si estás lo bastante buena podrás enganchar al jefe incluso vestida de mamarracha con nuestros modelitos'","twitter.com/Rocigaot/status/278140483967012864"
"8/12/2012 16:28:07","","277434391066718208","","@callaquenoveo sí, hay que pararlo ya, que se empieza por Maldita Nerea con Suchard e igual acabamos con Melendi en la cabalgata de Reyes","twitter.com/Rocigaot/status/277434391066718208"
"8/12/2012 15:10:17","","277414801297244160","","@callaquenoveo lo próximo será que la canción de El Almendro la versione Pitbull: Vuelve a casa, ya tu sabeh...","twitter.com/Rocigaot/status/277414801297244160"
"8/12/2012 2:18:49","","277220655802511360","","Por culpa de @Barbijaputa estoy haciendo (otro) maratón de Friends. Sí, cualquier excusa es buena...","twitter.com/Rocigaot/status/277220655802511360"
"8/12/2012 0:41:11","","277196083980038145","","@Barbijaputa y los que lo ven vía seriesyonkis no entenderán lo que fue que empezaran a codificarlo a traición a partir de la boda de Ross..","twitter.com/Rocigaot/status/277196083980038145"
"7/12/2012 17:55:01","","277093869387141120","","Ahora, vía PGE pagarás canon digital aunque no distingas un portátil de una sandwichera. No, si nos harán echar de menos hasta a Sinde...","twitter.com/Rocigaot/status/277093869387141120"
"6/12/2012 22:21:16","","276798487188885505","","@LordoLordor que no era hijo legítimo, quería decir. Un lapsus...","twitter.com/Rocigaot/status/276798487188885505"
"6/12/2012 22:20:02","","276798174553845760","","@hematocritico podía ser peor:no quiero imaginar la masacre si el anuncio lo hicieran con Pablo Motos...","twitter.com/Rocigaot/status/276798174553845760"
"6/12/2012 22:19:11","","276797960203952128","1","@LordoLordor hombre, eso es evident... ah,que no era hijo ilegítimo, quieres decir...","twitter.com/Rocigaot/status/276797960203952128"
"6/12/2012 22:12:20","1","276796239109050368","1","@LordoLordor lo dudo bastante: los Lannister siempre pagan sus deudas...","twitter.com/Rocigaot/status/276796239109050368"
"6/12/2012 1:53:50","","276489592293699584","","A todo esto, ¿hay alguna cuenta tipo arquitecto_enfurecido haciendo el chiste de 'señor, si nos devuelves a Niemeyer te damos a Calatrava?'","twitter.com/Rocigaot/status/276489592293699584"
"6/12/2012 1:51:28","","276488999021977600","","Tanta falsa muerte en Twitter ha hecho que lea que ha muerto Niemeyer y dude si creérmelo, a pesar de sus 104 tacos...","twitter.com/Rocigaot/status/276488999021977600"
"5/12/2012 16:10:04","","276342682568245250","","Linkedin, gracias por sugerirme ofertas de empleo para ingenieros,pero mis conocimientos del sector se limitan a poner el puente en el belén","twitter.com/Rocigaot/status/276342682568245250"
"5/12/2012 15:48:46","","276337323317280769","3","Fundación Affinity donará una ración de pienso a protectoras por cada tweet con el hastag #élnuncaloharia. ¡Venga, que no nos cuesta nada!","twitter.com/Rocigaot/status/276337323317280769"
"5/12/2012 0:08:22","2","276100663040155648","1","Nos meus tempos tamén cateábamos 'por culpa del libro, mamá, que es que está en gallego,jo'. E en cambio co Xabarín,sen problema. #quécousas","twitter.com/Rocigaot/status/276100663040155648"
"4/12/2012 23:56:40","2","276097718848479232","5","#graciasalasanidadpublica si tienes que operarte o darte quimio te preocupas de recuperarte, pero no de arruinar a tu familia en el intento","twitter.com/Rocigaot/status/276097718848479232"
"4/12/2012 23:01:24","","276083809735286785","","@mort ah, pero, ¿la Esteban tenía problemas de adicciones? ¿No se supone que se le caía la nariz por la diabetes?","twitter.com/Rocigaot/status/276083809735286785"
"4/12/2012 21:05:21","","276054607275372545","","No tengo muy claro por qué, pero pierdo más followers los días que apenas twitteo a los que estoy en modo twittera compulsiva y cafre...","twitter.com/Rocigaot/status/276054607275372545"
"4/12/2012 16:06:09","","275979310836350976","","@lara_grana mi sueño es que me contraten como traductora a neolenguaje de planes políticos. Eso o bautizadora de operaciones policiales ;)","twitter.com/Rocigaot/status/275979310836350976"
"4/12/2012 15:56:11","","275976799698165760","","@lara_grana yo pechuga y ensalada: tras un crecimiento de la acumulación lípida he iniciado un plan de regularización de la ingesta calórica","twitter.com/Rocigaot/status/275976799698165760"
"3/12/2012 22:03:20","","275706811405959168","","@CaminoAna matalo non chega, temos que asegurarnos que non puxera ovos ou non paramos a plaga...","twitter.com/Rocigaot/status/275706811405959168"
"3/12/2012 19:29:34","","275668112404271104","","Que dice Díaz Ferrán que justo ayer hizo limpieza general, y que si vosotros nunca os encontráis calderilla entre los cojines del sofá...","twitter.com/Rocigaot/status/275668112404271104"
"3/12/2012 19:22:37","","275666366000926722","","Y qué le veis de raro a lo de Díaz Ferrán? Quién no tiene en casa 150.000 euros y algún lingote de oro para gastos corrientes?","twitter.com/Rocigaot/status/275666366000926722"
"3/12/2012 19:20:25","","275665808917676032","","@JuanGomezJurado Creo que Samantha la de Sexo en Nueva York tenía uno clavadito pero no tengo claro para qué #UsosDeUnLingote","twitter.com/Rocigaot/status/275665808917676032"
"3/12/2012 14:47:52","","275597222421352449","1","Pues tenía razón Díaz Ferrán en que la patronal crea empleo. En los bancos de Lietchestein tendrían menos trabajadores sin gente como él...","twitter.com/Rocigaot/status/275597222421352449"
"2/12/2012 22:30:48","","275351334394421248","","También digo que si fuera asesora política y tuviera que preparar a ciertas joyas para hablar con Évole tomaría trankimazines como lacasitos","twitter.com/Rocigaot/status/275351334394421248"
"2/12/2012 22:27:42","","275350554224508929","","Intentamos ser coherentes con todo lo que decim...jijijijiji!!  #FraudeRicoPobre","twitter.com/Rocigaot/status/275350554224508929"
"2/12/2012 22:22:13","","275349173300256768","","Hasta la portavoz de Hacienda del PP se descojona al decir que lo suyo no es amnistía fiscal sino regularización...  #FraudeRicoPobre","twitter.com/Rocigaot/status/275349173300256768"
"2/12/2012 15:54:30","","275251602355539968","","@moedetriana si en vez de colgarlo lo pones en el equipo de música también espanta a los pájaros (y a las personas, claro)","twitter.com/Rocigaot/status/275251602355539968"
"2/12/2012 14:36:14","2","275231904435933185","","Abro twitter y veo TT sobre Felipe González, la OTAN y el GAL. Cuando decían que con los recortes volvíamos a los 80,creí que era metafórico","twitter.com/Rocigaot/status/275231904435933185"
"2/12/2012 0:08:46","","275013601864056832","","¿Por qué la gente sube capítulos a seriesyonkis poniendo que están en VOS si están en VO sin subtítulos? O peor aún, doblados... #redrum","twitter.com/Rocigaot/status/275013601864056832"
"1/12/2012 19:48:32","","274948109862305792","","@sanchez_sonia @Barbijaputa A mí me quedan 3capítulos para ponerme al día con la temporada 2, y creo que caerán los 3 esta noche...","twitter.com/Rocigaot/status/274948109862305792"
"1/12/2012 19:43:11","","274946765940195328","1","En vez de seguir pidiendo que chille menos voy a pedirle a mi vecina que chille más. Así alcanzará un nivel solo audible para murciélagos...","twitter.com/Rocigaot/status/274946765940195328"