"date","fav","id","rt","text","url"
"1/5/2012 0:48:43","","197095164974596096","","Urdangarín espera librarse de la carcel declarándose culpable. ¿Se marcará un 'lo siento mucho, me he equivocado, no volverá a pasar'?","twitter.com/Rocigaot/status/197095164974596096"
"30/4/2012 10:55:54","","196885576715206657","","@Asier3D hombre, tampoco va a pagar una fortuna, si ya dice que el trabajo es muy 'censillo'... #gensanta","twitter.com/Rocigaot/status/196885576715206657"
"29/4/2012 22:29:15","","196697677327634437","","A todo esto, ¿soy la única que se fijó en las figuritas del toro y la sevillana que tiene Pujalte en el despacho? #decoracióncañí","twitter.com/Rocigaot/status/196697677327634437"
"29/4/2012 22:13:16","","196693655220793344","1","Martínez Pujalte va a acabar partiendo sus gafas en dos, con lo tenso que está mientras juguetea con ellas.. #lascuentasclaras","twitter.com/Rocigaot/status/196693655220793344"
"29/4/2012 21:37:51","","196684740982616064","","Viendo @salvadostv por internet: he visto 5 segundos de programa, y me he tragado 4veces el anuncio de kia y 4 el del sorteo de la madre..","twitter.com/Rocigaot/status/196684740982616064"
"29/4/2012 17:19:24","","196619700837421057","","@Rinze lo mejor es ese pie de foto tan Monty Python...","twitter.com/Rocigaot/status/196619700837421057"
"27/4/2012 18:44:07","","195916243507752960","1","@Guerraeterna si hacemos nueva recogida de firmas contra la subida del IVA podemos sumar las suyas de entonces?","twitter.com/Rocigaot/status/195916243507752960"
"27/4/2012 17:42:15","","195900678072315904","","Pues si me pillan con el plan antifraude currando en negro, con acogerme a la amnistía fiscal..¿No?¿Qué pasa?¿Qué decís que no he entendido?","twitter.com/Rocigaot/status/195900678072315904"
"27/4/2012 16:18:22","","195879567758594050","","@scarregal pues probaré, que tengo amigos de amigos a los que no puedo desagregar sin conflicto diplomático pero me hacen sangrar los ojos!","twitter.com/Rocigaot/status/195879567758594050"
"27/4/2012 16:03:17","","195875771015897088","","Si me 'desuscribo' de las actualizaciones de algún amigo de facebook..¿sigo figurando como su amigo?¿puede ver que me he 'desuscrito''?","twitter.com/Rocigaot/status/195875771015897088"
"27/4/2012 15:23:39","","195865796138909696","","Sí, venga, más preguntas sobre ETA, que lo del IVA, privatizaciones y paro se ve que no da más de sí...","twitter.com/Rocigaot/status/195865796138909696"
"27/4/2012 15:18:32","","195864509116710912","","Un periodista pregunta por qué evitan usar la palabra IVA para hablar de los impuestos al consumo...  zas!","twitter.com/Rocigaot/status/195864509116710912"
"27/4/2012 15:06:06","","195861377817133056","","El juego de beber de los viernes: botella de tequila, rueda de prensa de los ministros, y chupito por cada alusión a la herencia recibida.","twitter.com/Rocigaot/status/195861377817133056"
"27/4/2012 14:56:54","","195859065090478080","","Báñez: 'para que se afloren situaciones irregulares', 'cuando pasan unos cuantos de meses'...Recortemos más en educación, si vamos sobrados.","twitter.com/Rocigaot/status/195859065090478080"
"27/4/2012 14:32:39","1","195852960838848512","","Uy, me estaba perdiendo ese programa de terror que da rtve los viernes, cómo se llamaba? Ah, sí, la rueda de prensa de Soraya...","twitter.com/Rocigaot/status/195852960838848512"
"27/4/2012 13:32:12","","195837747754303488","3","#Galicianecesita @ELPAISGalicia Porque quero pensar que facer xornalismo, en vez de copiapegas ou fotomontaxes, ten recompensa e non castigo","twitter.com/Rocigaot/status/195837747754303488"
"27/4/2012 0:38:29","","195643038272466944","","Y ahora empezarán las coñas mil sobre el Rey, y ya no me iré a dormir hasta las tantas. Ya le vale.","twitter.com/Rocigaot/status/195643038272466944"
"27/4/2012 0:37:06","","195642689792901122","1","El rey se tiene que operar de nuevo... ¿Ha cotizado? Porque más de 26 años tiene... http://politica.elpais.com/politica/2012/04/27/actualidad/1335478736_099505.html …","twitter.com/Rocigaot/status/195642689792901122"
"26/4/2012 0:10:48","","195273681444937728","","@Ika80Bcn viste el del aeropuerto de Castellón que retwitteé antes? XD","twitter.com/Rocigaot/status/195273681444937728"
"26/4/2012 0:08:15","","195273040463015936","","Del fútbol paso cuatro pueblos, pero luego me quedo una hora leyendo chistes en twitter sobre el penalty de Ramos #yamevale","twitter.com/Rocigaot/status/195273040463015936"
"1/5/2012 1:20:10","","197103077361319939","","Si Anne Germain no es un fraude, que invoque a Berlanga:con este panorama, igual quiere dictar vía ouija el guión para una peli. #españistán","twitter.com/Rocigaot/status/197103077361319939"
"29/4/2012 15:18:09","","196589186537627648","","Señoría http://menea.me/y7n8  vía @meneame_net","twitter.com/Rocigaot/status/196589186537627648"
"25/4/2012 23:59:28","","195270829750235137","","@DePunteirolo cunha Eurocopa e unhas olimpiadas? para este ano non contes con ela...","twitter.com/Rocigaot/status/195270829750235137"
"25/4/2012 23:36:12","","195264975869198336","1","Ahora entiendo por qué Rajoy hará las reformas antes del verano. Hay que aprovechar mientras la gente tenga ligas y copas a las que atender.","twitter.com/Rocigaot/status/195264975869198336"
"25/4/2012 23:29:41","","195263336412229634","","Supongo que a costa del futbol, en breve veré más TT germanófobos que si Merkel nos mandara sacrificar jubilados para ahorrar pensiones...","twitter.com/Rocigaot/status/195263336412229634"
"25/4/2012 15:11:48","","195138036730826752","","¿Por qué es TT 16 & Pregnant? ¿MTV va a aprovechar la reforma de la ley del aborto y los recortes en educación para 1versión made in spain?","twitter.com/Rocigaot/status/195138036730826752"
"25/4/2012 2:06:37","","194940439659429888","","@CaminoAna vai ser coma o spotify, que en campaña me colaba anuncios do PP mentres escoitaba Barricada...","twitter.com/Rocigaot/status/194940439659429888"
"25/4/2012 1:03:28","","194924545487024130","1","Descubrir que lo de #noslevantaremos va de fútbol, no de protestas, y quedarme como Libertad, la amiga de Mafalda:pic.twitter.com/fHOIM3CI","twitter.com/Rocigaot/status/194924545487024130"
"24/4/2012 13:01:30","","194742859461697536","","Lo de Yoigo con el bono para llamadas VoIP es querer tratar a los clientes por tontos. Tocará cambiar de compañía...","twitter.com/Rocigaot/status/194742859461697536"
"23/4/2012 21:29:01","","194508192800182272","","Yo si fuera Urdaci no daría por hecho lo de TVE: hubo muchos haciéndo méritos para un 'qué hay de lo mío' mientras él estaba con el Pocero..","twitter.com/Rocigaot/status/194508192800182272"
"23/4/2012 13:01:51","","194380557738721280","","@dodavazquez @caminoana todo sería darle un golpecito justo ahí para comprobarlo... :P","twitter.com/Rocigaot/status/194380557738721280"
"23/4/2012 12:09:54","","194367486752325633","","@CaminoAna por certo, para a biblio tiro pola tarde, que quedei sopa! despertei agora e porque timbrou o do contador da auga!","twitter.com/Rocigaot/status/194367486752325633"
"23/4/2012 12:09:03","","194367271488069633","","@CaminoAna huevazos como balóns de pilates, di que si...","twitter.com/Rocigaot/status/194367271488069633"
"22/4/2012 23:12:36","","194171873947422720","","El imitador de Mario Vaquerizo en @BuenasNochesBFN tiene las mejillas más hundidas que el auténtico: el pobre debe de estar rabiando...","twitter.com/Rocigaot/status/194171873947422720"
"22/4/2012 22:48:49","","194165885949313025","","Buenafuente recupera a los Bogbones! Se les echaba de menos!","twitter.com/Rocigaot/status/194165885949313025"
"22/4/2012 22:28:05","","194160669153697792","","Y dijo Jesús: 'como mi Iglesia será la más grande, mereceremos trato especial'. Ah, no, que fue el Arzobispado de Navarra. #quediostelopague","twitter.com/Rocigaot/status/194160669153697792"
"22/4/2012 22:25:03","","194159904741801984","","Jordi  pregunta al portavoz del arzobispado lo que yo estaba pensando: si no conoce los casos, ¿por qué hace de portavoz? #quediostelopague","twitter.com/Rocigaot/status/194159904741801984"
"22/4/2012 22:15:58","","194157619680784384","1","'Si algo lo vivo como que es mío no tengo que dar explicaciones', dicen en el arzobispado de Navarra. ¡Aprende, Camps! #Quediostelopague","twitter.com/Rocigaot/status/194157619680784384"
"22/4/2012 22:10:31","","194156249212923905","3","'Pensaba que el obispo no podia atendernos porque estaba todo el día inmatriculando cosas'. ¡Zas! #quediostelopague","twitter.com/Rocigaot/status/194156249212923905"
"22/4/2012 21:58:38","","194153259429146624","","Lo de las inmatriculaciones de la Iglesia es de traca. Y apenas se oye hablar del tema, como no son terrenos de Repsol... #quediostelopague","twitter.com/Rocigaot/status/194153259429146624"
"22/4/2012 21:27:54","","194145523240935424","","Esperando a que empiece el #QueDiostelopague de @salvadostv , el tema promete!","twitter.com/Rocigaot/status/194145523240935424"
"22/4/2012 16:16:26","","194067140951810049","","@CaminoAna certo! avisarei polo caralibro a @AlbaPio , que como o twitter o ten abandonado...","twitter.com/Rocigaot/status/194067140951810049"
"22/4/2012 15:33:28","","194056328614912000","","@CaminoAna xa che digo, ata as e e pico da mañán estiven lendo! Case teño que sacar as lentillas con espátula!","twitter.com/Rocigaot/status/194056328614912000"
"22/4/2012 15:29:13","","194055259742666753","","@perradesatan ¿no viste el El Sentido de la Vida? Camarero, tráigame un cubo!  https://www.youtube.com/watch?v=aunvBiVs1Dw …","twitter.com/Rocigaot/status/194055259742666753"
"22/4/2012 3:16:38","","193870896090460161","","Onte @CaminoAna prestoume 'Betibú', e hoxe o lin dunha tacada. Recomendadísimo, sobre todo á xornalistas!","twitter.com/Rocigaot/status/193870896090460161"
"21/4/2012 12:28:35","","193647412655562753","","Viñeta: El Roto - 21 ABR 2012  http://elpais.com/elpais/2012/04/20/vinetas/1334937835_804476.html … vía @el_pais","twitter.com/Rocigaot/status/193647412655562753"
"20/4/2012 20:31:09","","193406464889602049","","@puchoboedo @anabeldn pues por ahí van los tiros. Es triste que algo que debería ser lo usual sea un hito en una tele pública, pero así es..","twitter.com/Rocigaot/status/193406464889602049"
"20/4/2012 20:22:22","","193404256785678336","","@puchoboedo @anabeldn y el que representantes del mismo partido que hizo los cambios intentaran censurar también dice mucho...","twitter.com/Rocigaot/status/193404256785678336"
"20/4/2012 20:20:52","","193403879440916481","","@puchoboedo @anabeldn se avanzó mucho (que se pusieran en evidencia para intentar censurar si lograrlo lo demuestra) pero aún faltaba...","twitter.com/Rocigaot/status/193403879440916481"
"20/4/2012 20:13:44","","193402081422491648","","@puchoboedo @anabeldn cierto, nos llevan bastante ventaja, lástima que mi brittish accent no dé para pedirles trabajo! :P","twitter.com/Rocigaot/status/193402081422491648"
"20/4/2012 20:03:00","","193399381406396416","","@puchoboedo @anabeldn con todo, si hubo ese intento de ver las escaletas fue porque no tenían el control de contenidos, y no lo consiguieron","twitter.com/Rocigaot/status/193399381406396416"
"20/4/2012 19:42:47","","193394293619175425","","@puchoboedo @anabeldn pues es lo que habrá ahora, pero en vez de pedir ver la escaleta, pondrán al frente al que ya va dispuesto a enseñarla","twitter.com/Rocigaot/status/193394293619175425"
"20/4/2012 19:33:56","","193392068364730368","","@puchoboedo @anabeldn cierto,y se paró por el plante de los trabajadores, ahora ni eso. Quedaba mucho por avanzar, y ahora retrocederemos...","twitter.com/Rocigaot/status/193392068364730368"
"20/4/2012 17:06:03","","193354849943945216","","Pues si las opciones que nos quedan a los periodistas son hacer periodismo de portada del ABC o irnos al McDonalds.. ¿mc menú o happy meal?","twitter.com/Rocigaot/status/193354849943945216"
"20/4/2012 16:31:07","","193346060301770752","","De verdade, qué ganas dan ás veces de prenderlle lume a todo...","twitter.com/Rocigaot/status/193346060301770752"
"20/4/2012 0:43:00","","193107459735420931","2","Nos acusaban de provocar la crisis endeudándonos demasiado, pero nos obligarán a endeudarnos para estudiar. Qué ironías...  #noaltasazo","twitter.com/Rocigaot/status/193107459735420931"
"20/4/2012 0:14:53","","193100384217202689","","@CaminoAna haberá que botarlle unha ollada, entón, a ver se o acabo antes de reiniciar a #acampadauned...","twitter.com/Rocigaot/status/193100384217202689"
"20/4/2012 0:11:16","","193099473927421954","","@CaminoAna con cal estabas?eu agora teño que empezar cos de lite americana outra vez...","twitter.com/Rocigaot/status/193099473927421954"
"19/4/2012 23:52:03","","193094638293352449","","Los diputados andaluces de risitas en la toma de posesión de Sánchez Gordillo. De patio de cole. #Ascopena http://youtu.be/MgMcGABlhkY ","twitter.com/Rocigaot/status/193094638293352449"
"19/4/2012 23:41:30","","193091982481047553","","@DavidLombao Vaya novedad, si en Intereconomía lo hacen mucho! Aunque igual en la nube no se refieren a ZP, claro.. :P","twitter.com/Rocigaot/status/193091982481047553"
"19/4/2012 22:57:39","","193080946071846912","","@puchoboedo aunque vosotros no podéis ascender morreándoos con un futbolista en público, ventaja pa mi gremio :P (ya lo tomo con humor)","twitter.com/Rocigaot/status/193080946071846912"
"19/4/2012 22:49:27","","193078883338297344","","@puchoboedo lo nuestro es de traca. A vosotros al menos no os pueden sustituir por un chaval sin título 'pero q le gusta dibujar y los lego'","twitter.com/Rocigaot/status/193078883338297344"
"19/4/2012 22:15:47","","193070410403819521","","@CaminoAna con sorte podemos estar poñendo cubatas nun hotel de Eurovegas, que non se diga que non se aposta pola competitividade...","twitter.com/Rocigaot/status/193070410403819521"
"19/4/2012 22:12:54","","193069685523218432","","@puchoboedo sí, lo vuestro ahora mismo tampoco está para echar cohetes. Aunque nosotros estamos más entrenaos pa la precariedad :P","twitter.com/Rocigaot/status/193069685523218432"
"19/4/2012 22:07:59","","193068447918325761","","@CaminoAna eu seguirei por non perder o tempo de diñeiro que levo investido, pero pensaba pillarme un curso entero, e vai ser que non...","twitter.com/Rocigaot/status/193068447918325761"
"19/4/2012 21:40:08","","193061440054247426","","@puchoboedo ya lo vi, ya... entre los que cierran, los que están en ERE y los que solo pillan becarios, me estoy ahorrando una de papel...","twitter.com/Rocigaot/status/193061440054247426"
"19/4/2012 19:23:57","","193027164768178176","","@CaminoAna certo, moito máis efectivo, onde vai parar... E así se vai preparando un para ser 'competitivo'...","twitter.com/Rocigaot/status/193027164768178176"
"19/4/2012 18:58:42","","193020812880642048","","A este paso, quien tenga dos hijos les hará jugarse quién estudia al 'piedra, papel, tijera'. Digo, al 'piedra, papel, ajustes necesarios'.","twitter.com/Rocigaot/status/193020812880642048"
"19/4/2012 18:56:03","1","193020147475283969","5","Subir las matrículas un 50% y recortar en becas:no sea que la gente se forme demasiado y Gran Hermano quede sin cantera http://sociedad.elpais.com/sociedad/2012/04/19/actualidad/1334839235_884063.html …","twitter.com/Rocigaot/status/193020147475283969"
"19/4/2012 18:50:24","","193018724826087424","","http://www.eljueves.es/2012/04/17/buen_patriota_defiende_repsol_adora_los_recortes.html …","twitter.com/Rocigaot/status/193018724826087424"
"19/4/2012 18:37:44","","193015536446210048","","Otro cierre en prensa: @lavozdeasturias . Ánimo a sus trabajadores!","twitter.com/Rocigaot/status/193015536446210048"
"19/4/2012 18:27:47","","193013033830850560","","Vi en FB a algunos afiliados del PP anunciando 1manifa en mayo contra 'los privilegios de los sindicatos'.¿También serán banda organizada?","twitter.com/Rocigaot/status/193013033830850560"
"19/4/2012 14:15:39","","192949582274109441","","@DavidLombao home, serán frapuccinos do Starbucks en tamaño grande, o clásico almorzo dos xubilados de toda a vida...","twitter.com/Rocigaot/status/192949582274109441"
"19/4/2012 12:53:18","","192928855344955393","","¿Del Starbucks? El secretario de Sanidad del PP dice que el copago son 'cuatro cafés al mes' para jubilados http://www.rtve.es/n/517204/  vía @rtve","twitter.com/Rocigaot/status/192928855344955393"
"18/4/2012 20:48:20","","192686015863996416","","Lo del blog de @EspeonzaAguirre será un puntazo. A ver cuántos atontaos llaman fachas a los de @eldiarioes por hacerle un blog a Esperanza!","twitter.com/Rocigaot/status/192686015863996416"
"18/4/2012 19:37:45","","192668250075701248","1","El de las políticas de improvisación era ZP: si el PP cambia de opinión en un mes sobre el copago es fresca espontaneidad #faltaríamás","twitter.com/Rocigaot/status/192668250075701248"
"18/4/2012 18:21:35","","192649084635582465","","#LoSientoMuchoNoVolveraAocurrir En el próximo viaje, dejaré a Juanjo Puigcorbé haciendo de mi doble, para que no notéis mi ausencia...","twitter.com/Rocigaot/status/192649084635582465"
"18/4/2012 13:50:15","","192580799764250624","2","#SiVienenLosExtraterrestres es que invierten lo bastante en I+D para haber descubierto cómo viajar a otros planetas. Yo me voy con ellos...","twitter.com/Rocigaot/status/192580799764250624"
"18/4/2012 13:32:03","","192576219009662976","","La libertad de mercado de Repsol es atacada, y algunos preocupándonos por si nos quitan la sanidad pública. Egoístas que somos, de verdad...","twitter.com/Rocigaot/status/192576219009662976"
"18/4/2012 13:14:10","","192571720467619840","1","#Sivienenlosextraterrestres en son de paz, será 1 éxito diplomático de Rajoy. Si vienen de malas,será por la herencia recibida #modoabcon","twitter.com/Rocigaot/status/192571720467619840"
"18/4/2012 12:30:47","","192560802325213185","","Xabarín Club cumple 18 anos! Creo que cando botaban estes temazos, nas teles privadas estaban con Xuxa ou algo así :)  http://www.youtube.com/watch?v=T_kYXW2boq8&feature=relmfu …","twitter.com/Rocigaot/status/192560802325213185"
"18/4/2012 11:50:05","","192550561206382592","","@badaladak Mientras no me tenga que montar yo también la tele... :D","twitter.com/Rocigaot/status/192550561206382592"
"17/4/2012 21:08:30","","192328703534055425","","Y con qué van a sustituir el #Españolesalafuga de Patagonia? Hay algún 'Españoles en Botswana' que podamos reponer?","twitter.com/Rocigaot/status/192328703534055425"
"17/4/2012 21:06:15","","192328137470771200","","Los neoliberales son como adolescentes. Quieren perder de vista a Papá Estado, menos cuando necesitan que les compren o resuelvan algo...","twitter.com/Rocigaot/status/192328137470771200"
"17/4/2012 18:42:46","","192292028422426624","","Después de lo de TVE, ¿el siguiente paso es que Oysho deje de vender pijamas y bragas de Mafalda, por si algún patriota se siente ofendido?","twitter.com/Rocigaot/status/192292028422426624"
"17/4/2012 18:36:01","","192290326252224512","1","TVE no emitirá hoy el 'Españoles por el Mundo' de la Patagonia. La prensa cavernaria ya nos avisó de que Mariano pondría firme a Kirchner...","twitter.com/Rocigaot/status/192290326252224512"
"17/4/2012 3:25:41","","192061233741049857","4","Pancartas de 'No soy anti nacionalización, la nacionalización es anti yo' o 'Violencia es usar paneles solares' en la  #AcampadaYPF","twitter.com/Rocigaot/status/192061233741049857"
"16/4/2012 23:51:11","","192007253807734784","","@lara_grana @huyelobo WTF? Yo creo que así y todo hoy gana el toque 'Familia Addams' de La Razón, pero esto también se las trae...","twitter.com/Rocigaot/status/192007253807734784"
"16/4/2012 23:31:35","","192002321243308033","","Hoy, en #portadastróspidas, Morticia Kirchner en La Razón...vía @lara_granapic.twitter.com/TafKCcZS","twitter.com/Rocigaot/status/192002321243308033"
"16/4/2012 23:28:38","","192001578595651586","","Estoy en un sinvivir con lo de YPF. Ahora que deja de ser un patrimonio de los españoles, ¿tendremos que pagarnos la gasol...?no, nada...","twitter.com/Rocigaot/status/192001578595651586"
"16/4/2012 18:07:11","","191920685231243264","","Becas para estudiar o investigar, no. Becas Fraga para que tu partido capte afiliados, sí ¿Que no somos competitivos?No me explico por qué..","twitter.com/Rocigaot/status/191920685231243264"
"16/4/2012 17:55:13","","191917674379481088","","Estou por presentarme ás becas Fraga. A proba teórica a teño controlada, pero preocúpame a proba física de natación en Palomares...","twitter.com/Rocigaot/status/191917674379481088"
"15/4/2012 13:27:49","","191487993243115520","","@beblas ¿dices lo de la quedada?De momento está bastante parado lo de organizarlo, que no hay forma de cuadrar agendas!","twitter.com/Rocigaot/status/191487993243115520"
"14/4/2012 20:29:15","","191231658962325505","","Me siento fatal por lo del Rey. El pobre pierde el sueño por nuestro paro, se va de caza por ocupar sus horas de insomnio y le pasa esto...","twitter.com/Rocigaot/status/191231658962325505"
"14/4/2012 12:28:59","","191110796984590336","","No puedo esperar a mañana para ver con qué fotomontaje de manadas de elefantes comunistas nos sorprende el ABC...","twitter.com/Rocigaot/status/191110796984590336"
"14/4/2012 1:10:44","","190940110672510976","","Cada vez que La Razón o ABC hacen una portada con fotomontaje, Dios mata a un diseñador gráfico... #gensanta #misojos http://www.abc.es/gestordocumental/uploads/Otras/14(1).pdf …","twitter.com/Rocigaot/status/190940110672510976"
"13/4/2012 11:52:06","","190739128504160256","","Y ya que Repsol es 'patrimonio de los españoles', ¿cómo les indico un nº de cuenta para que me ingresen mi porcentaje de los beneficios?","twitter.com/Rocigaot/status/190739128504160256"
"13/4/2012 0:08:37","","190562090480697344","","Que Argentina nacionalice YPF es un gravísimo atentado contra la soberanía española. Cristina, a nuestra jefa Merkel que vas...","twitter.com/Rocigaot/status/190562090480697344"
"12/4/2012 23:17:00","","190549098972192768","","De 0 a anuncio de Loewe, ¿cuánta vergüenza ajena os da lo de Sara Carbonero a vueltas con la Roja para presentar una prueba de Gran Hermano?","twitter.com/Rocigaot/status/190549098972192768"
"12/4/2012 21:37:16","","190524000290603009","1","De Guindos diciendo 'como vengan otros va a ser peor' es como la típica mamá que amenaza al crío con un '¡ya verás cuando venga tu padre!'","twitter.com/Rocigaot/status/190524000290603009"
"11/4/2012 16:54:12","","190090378249117696","","A ver, que si no os empeñárais en vivir tantos años, El FMI no querría bajar las pensiones, pero es que no ponéis nada de vuestra parte...","twitter.com/Rocigaot/status/190090378249117696"
"11/4/2012 16:52:28","","190089942909722629","","Ea,a morirse prontito!El FMI pide bajar pensiones por 'el riesgo de que la gente viva más de lo esperado'  http://economia.elpais.com/economia/2012/04/11/actualidad/1334133453_457282.html … vía @el_pais","twitter.com/Rocigaot/status/190089942909722629"
"11/4/2012 15:21:43","","190067102663712768","","Hacer un lipdub en un sitio público #seconsideraráatentadoalaautoridad a no ser que se use una canción de Russian Red o Nena Daconte","twitter.com/Rocigaot/status/190067102663712768"
"11/4/2012 15:19:41","","190066590421749761","1","Anunciar las rebajas del Corte Inglés #seconsideraráatentadoalaautoridad si luego se producen peleas de señoras por alguna ganga.","twitter.com/Rocigaot/status/190066590421749761"
"11/4/2012 15:07:51","","190063614303014913","","El 28 de marzo, al responder a la diputada Patricia Hernández, Gallardón citó a M. Luther King, ese genio criminal de la resistencia pasiva","twitter.com/Rocigaot/status/190063614303014913"
"11/4/2012 14:44:59","","190057858086346755","","#Soycriminal por recordar aquí que este domingo habrá manifestaciones en  defensa de la sanidad pública? Y por animar a la gente a ir?","twitter.com/Rocigaot/status/190057858086346755"
"11/4/2012 14:14:11","","190050110271520768","","Si cada Gobierno puede decidir a su antojo qué se considera banda armada,cuando yo sea presidenta incluiré a los vecinos con Singstar...","twitter.com/Rocigaot/status/190050110271520768"
"11/4/2012 13:24:42","","190037657164853249","","Al menos cuando en el extrajero nos pregunten cómo nos va en España con este Gobierno, ya podremos decir lo de 'Bueno, no podemos quejarnos'","twitter.com/Rocigaot/status/190037657164853249"
"11/4/2012 13:10:00","","190033955079200768","","Antes los pijos presumían de pasta en la discoteca dejando a la vista el llavero de su BMW. Ahora fardarán con el bonometro. #tarifazomadrid","twitter.com/Rocigaot/status/190033955079200768"
"11/4/2012 12:12:23","","190019458398564352","","'Organización criminal', por la nueva reforma, equivaldrá a 'movimiento crítico con el Gobierno'? #Holadictadura  http://www.europapress.es/nacional/noticia-alterar-orden-publico-hacer-convocatorias-ello-internet-sera-delito-integracion-organizacion-criminal-20120411103059.html …","twitter.com/Rocigaot/status/190019458398564352"
"11/4/2012 0:09:17","","189837480453881856","","@CaminoAna creo que é máis de probas orais...","twitter.com/Rocigaot/status/189837480453881856"
"11/4/2012 0:05:36","","189836554829701120","","@CaminoAna muller, pra acabar de stripper en Eurovegas, que é a opción de emprego que nos ofertan, tampouco é importante estar alfabetizados","twitter.com/Rocigaot/status/189836554829701120"
"10/4/2012 21:34:36","","189798556981399552","3","Un periodista consiguió abordar a Rajoy en el garaje y consiguió una declaración en exclusiva: '¡Si me quereis, irse!' #CorreMarianoCorre","twitter.com/Rocigaot/status/189798556981399552"
