"date","fav","id","rt","text","url"
"31/10/2014 16:38:09","","528209315690463232","","@Hominidio para residentes en Madrid que non sexan madrileños tamén vale a miña proposta.","twitter.com/Rocigaot/status/528209315690463232"
"31/10/2014 15:56:09","2","528198747726295040","1","Madrileños de mi TL, ¿alguno va a pasarse hoy por la Moncloa a pedirle #chuchesh a Rajoy?","twitter.com/Rocigaot/status/528198747726295040"
"31/10/2014 15:00:48","2","528184816240701440","","@Marmota_Maligna @laMascota otra idea de disfraz en grupo: una de aborto casero self-made, otro de feto abortado y otro de Gallardón,","twitter.com/Rocigaot/status/528184816240701440"
"31/10/2014 14:38:47","","528179277603553281","","@undivaga no vale que usen el champú para caballos que habían puesto de moda las bloggers?","twitter.com/Rocigaot/status/528179277603553281"
"31/10/2014 14:37:42","","528179004151721984","2","@bola9_ @Marmota_Maligna yo cuando paso cerca de la sede del PP agarro más fuerte el bolso, por si acaso.","twitter.com/Rocigaot/status/528179004151721984"
"31/10/2014 14:32:37","","528177723739738112","","Creo que tendría hijos (o me ofrecería a cuidar a hijos ajenos) sólo para hacerles disfraces como el de la niña alien que acabo de RT.","twitter.com/Rocigaot/status/528177723739738112"
"31/10/2014 12:42:29","","528150011381440512","","@xoancastro @alberto_ramos esa é mítica. Se os meus amigos se deixaran convencer,aínda propoñía para hoxe disfrazarnos destes tres.","twitter.com/Rocigaot/status/528150011381440512"
"31/10/2014 12:36:30","","528148504741306368","","@xoancastro @alberto_ramos son moi fan do 'no puede seeer' de Delfín, que mesmo serve para un gol que para o 11-S.","twitter.com/Rocigaot/status/528148504741306368"
"31/10/2014 12:20:12","","528144402485497856","","@alberto_ramos o mesmo agora @xoancastro pon unha canción da Tigresa del Oriente ao día até que entres de novo,ou algo así.","twitter.com/Rocigaot/status/528144402485497856"
"31/10/2014 12:07:46","","528141272918130688","","@xoancastro @alberto_ramos pois aínda tardou pouco!","twitter.com/Rocigaot/status/528141272918130688"
"30/10/2014 22:18:18","","527932531224875010","","@alitecarlito y que haya gente que renuncie a eso por disfrazarse y salir de juerga. ..","twitter.com/Rocigaot/status/527932531224875010"
"30/10/2014 16:40:34","","527847539316633601","","@RafaelCalvoG hombre, algo hay. Lo justito para coordinar movimientos, habla, supongo que control de esfínteres... pero poco más.","twitter.com/Rocigaot/status/527847539316633601"
"30/10/2014 16:32:45","1","527845569151385600","","Para un zombi, ir a comerle el cerebro a Mariló es como cuando nosotros compramos bolsitas de matutano: Abres y ves que la mitad es aire.","twitter.com/Rocigaot/status/527845569151385600"
"30/10/2014 16:26:09","","527843907997270016","","@xoancastro e cando chegan os de urxencias te din que está a finxir os desmaios. E claro, se coinciden varias veces seguidas...","twitter.com/Rocigaot/status/527843907997270016"
"30/10/2014 16:25:22","","527843714094604289","","@xoancastro esta monta uns números que pra qué. O malo é que como está a xente diante, tes que chamar a urxencias ou parece que pasas dela","twitter.com/Rocigaot/status/527843714094604289"
"30/10/2014 16:19:12","","527842161149358080","","@xoancastro e na miña familia o máis divertido que temos co das mortes é a miña avoa a que finxe lipotimias nos enterros.E á 5ºvez xa cansa","twitter.com/Rocigaot/status/527842161149358080"
"30/10/2014 16:17:48","","527841806931996672","","@xoancastro non, se eu contra o de matar ao veciño non teño nada. A min é a parte misa+reunión familiar a que me tira pa atrás.","twitter.com/Rocigaot/status/527841806931996672"
"30/10/2014 16:17:02","","527841613952090113","","@xoancastro ai, non, eu paso. Que toca pack completo de limpar lápida+misa+fregar toda a louza da comida familiar mentras os homes xogan.","twitter.com/Rocigaot/status/527841613952090113"
"30/10/2014 16:07:48","","527839290450251776","","@xoancastro na miña familia ese día é limpar lápidas, ir a misas e soportar comidas familiares. Pásome a Halloween, a Samaín ou ao que sexa","twitter.com/Rocigaot/status/527839290450251776"
"30/10/2014 15:56:15","15","527836386515513344","14","Ir al cementerio a llevar flores. No me explico que una costumbre extranjera consistente en beber y disfrazarse le coma terreno a esa juerga","twitter.com/Rocigaot/status/527836386515513344"
"31/10/2014 14:58:11","","528184160301903872","","@Marmota_Maligna @laMascota o ve por ahí con una percha y vas de aborto casero self-made.","twitter.com/Rocigaot/status/528184160301903872"
"30/10/2014 15:52:40","1","527835483330871296","2","Si la gente se ha pasado a lo de Halloween es porque Todos los Santos como fiesta es un coñazo, las cosas como son.","twitter.com/Rocigaot/status/527835483330871296"
"30/10/2014 15:49:48","1","527834762808131584","","@LatveriasDoom vamos, yo estoy en Canarias tomando el sol,pero tú que te has quedado en casa no oses disfrazarte,respeta las tradiciones.","twitter.com/Rocigaot/status/527834762808131584"
"30/10/2014 15:47:50","1","527834264931672064","","@LatveriasDoom y los que se van de puente pero nos dicen a los que no podemos que si celebramos Halloween no respetamos la tradición?","twitter.com/Rocigaot/status/527834264931672064"
"30/10/2014 14:53:42","","527820643379994624","","@laMascota no me queda claro si con 'buses para difuntos' se refieren a buses fantasmas o a buses para zombies.","twitter.com/Rocigaot/status/527820643379994624"
"30/10/2014 14:52:47","1","527820412907163649","1","@morganaskwlkr Disfraz de cursillo de coaching y emprendimiento sexy.","twitter.com/Rocigaot/status/527820412907163649"
"30/10/2014 13:54:39","1","527805782063321088","","@ComandanteVimes @AmorLibreSpain Les ha faltado decir que si te duchas a diario teniendo ya pareja es que estás intentando cazar a otro...","twitter.com/Rocigaot/status/527805782063321088"
"30/10/2014 11:47:31","1","527773789812445184","1","@Tabernita pan tuitstar!","twitter.com/Rocigaot/status/527773789812445184"
"30/10/2014 0:57:32","","527610216599543808","","@xoancastro @alberto_ramos oes, pois molaría. Aínda que se non sae do tullido a idea, é un pouco embarazoso suxerirllo.","twitter.com/Rocigaot/status/527610216599543808"
"30/10/2014 0:53:43","","527609252727504896","","@xoancastro @alberto_ramos o tolo da motoserra, que pouco espíritu pra perseguir aos que entraban no garaxe, oes. En plan 'mira que vou...'","twitter.com/Rocigaot/status/527609252727504896"
"30/10/2014 0:15:17","","527599583510421505","","@eleptric @kalevorroka y para tíos, el corte de pelo a la taza, rollo 'te ponen un cesto en la cabeza y recortan siguiendo el borde'.","twitter.com/Rocigaot/status/527599583510421505"
"29/10/2014 23:56:56","","527594966026289153","","@kalevorroka @eleptric y los pantalones estampados que se llevaban a mis 17 años,que te hacen un culo como una rotonda aunque peses 40kgs.","twitter.com/Rocigaot/status/527594966026289153"
"29/10/2014 23:48:07","1","527592744529956864","","@eleptric @kalevorroka es como lo de los leggins con jerseys enormes,que ya se llevaba a princpio de los 90 cuando aún se llamaban mallas.","twitter.com/Rocigaot/status/527592744529956864"
"29/10/2014 21:53:05","","527563798002286593","","@SoniniSumode en mi caso creo que fue que me pasé con el vinagre. Y eso que con la de vinagre que echo siempre ya no tendría ni que notarlo.","twitter.com/Rocigaot/status/527563798002286593"
"29/10/2014 21:50:42","","527563195456966656","","Me he tomado un yogur de chocolate por encima de la ensalada que me había sentado mal,y parece que me ha asentado el estómago.","twitter.com/Rocigaot/status/527563195456966656"
"29/10/2014 21:45:08","","527561797491228673","","@familiasunshine joder,pues aún hay gente. Yo siempre he currado en empresas pequeñas y claro,a menos gente,menos probabilidad de chulazo.","twitter.com/Rocigaot/status/527561797491228673"
"29/10/2014 21:41:36","3","527560907216683009","","Me he cenado una ensalada y me ha sentado fatal. Si lo sé me pillo una pizza, si voy a estar jodida luego al menos que valga la pena.","twitter.com/Rocigaot/status/527560907216683009"
"29/10/2014 21:40:30","","527560629138518017","","@familiasunshine yo estuve en una empresa donde éramos todo tías menos el jefe. A ese sí que no conseguí verle un viaje, ni un paseo ni na.","twitter.com/Rocigaot/status/527560629138518017"
"29/10/2014 21:37:07","","527559780047810560","","@familiasunshine ay, los típicos cuelgues porque así da menos asco que llegue el lunes...","twitter.com/Rocigaot/status/527559780047810560"
"29/10/2014 20:59:47","","527550384496467969","","@mcalpena @netmork gensanta.","twitter.com/Rocigaot/status/527550384496467969"
"29/10/2014 20:53:25","","527548781152448513","","@mcalpena @netmork pero eso existe de verdad? no es fake ni nada?","twitter.com/Rocigaot/status/527548781152448513"
"29/10/2014 15:36:39","","527469066324566017","1","Que habrá periodistas perdiendo tiempo con lo de la operación Púnica y dejando que Intereconomía les robe la exclusiva del perro patriota.","twitter.com/Rocigaot/status/527469066324566017"
"29/10/2014 15:35:15","","527468710114897920","1","¡Parad las rotativas, si queda alguna!https://twitter.com/Intereconomia/status/527459923739680770 …Un perro se cuadra ante el himno de España http://bit.ly/1wzDIF3 ","twitter.com/Rocigaot/status/527468710114897920"
"29/10/2014 12:26:17","","527421156346052609","","Que igual lo de Franco dictando por ouija ya se ha hecho antes, y de ahí lo del 'C,C, O,O' de Urdaci. Estaba leyendo el itinerario del vaso.","twitter.com/Rocigaot/status/527421156346052609"
"29/10/2014 12:18:12","1","527419121915666432","2","Si Álvarez Gundín no resulta suficientemente facha, TVE nombrará director de informativos a Franco,que dará instrucciones vía ouija.","twitter.com/Rocigaot/status/527419121915666432"
"29/10/2014 0:21:36","","527238783419547648","","'Tenía un problema, que pronunciaba mal las erres'. ¿PronunciABA? #ElReySerie","twitter.com/Rocigaot/status/527238783419547648"
"29/10/2014 0:08:35","","527235509001928704","1","@CadenaPeco habría sido un detalle patriótico, pero España les estaba tratando muy mal, y claro...","twitter.com/Rocigaot/status/527235509001928704"
"29/10/2014 0:07:49","4","527235316210741249","1","A mí siempre me ha maravillado que alguien que mata de un disparo accidental a su hermano no le coja tirria a las armas para siempre.","twitter.com/Rocigaot/status/527235316210741249"
"29/10/2014 0:06:42","","527235035716661248","","@xoancastro sí, pareceume pero estou vendo a tele dende a habitación do lado e non estaba segura!","twitter.com/Rocigaot/status/527235035716661248"
"29/10/2014 0:05:54","","527234832435539968","","Ay, que en el documental de ahora sí que explican que se desvirgó en el Volkswagen! #TeenCampechano","twitter.com/Rocigaot/status/527234832435539968"
"29/10/2014 0:03:49","1","527234311075168256","","Espera, que en el próximo capítulo Campechano alude a la legitimidad política adquirida el 18 de julio del 36.","twitter.com/Rocigaot/status/527234311075168256"
"29/10/2014 0:00:52","1","527233566829473792","","El profe de derecho de Campechano no le dejaba mirar libros de derecho. Como cuando Phoebe enseñaba a Joey a tocar la guitarra sin guitarra.","twitter.com/Rocigaot/status/527233566829473792"
"28/10/2014 23:57:47","2","527232790858055681","","Juancar se quedó sin ir a estudiar a Salamanca y tomarse sus calimochos en La Imprenta. Porque no descarto que ya estuviera abierta entonces","twitter.com/Rocigaot/status/527232790858055681"
"28/10/2014 23:51:15","","527231147714301952","","@xoancastro pero igual sae el en moto auxiliando a xente co coche averiado e loitando contra supervillanos.","twitter.com/Rocigaot/status/527231147714301952"
"28/10/2014 23:47:02","","527230087444590592","","@Ch4_13 aún nada ha superado el 'mamá, podemos jugar con la pistola?' 'Bueno, si así me dejáis tranquila un rato...'","twitter.com/Rocigaot/status/527230087444590592"
"28/10/2014 23:43:47","","527229267730763776","","La follamiga de TeenCampechano llegó a la fiesta y el segurata le dijo que es que hacía falta invitación. Lo típico. #ElReyserie","twitter.com/Rocigaot/status/527229267730763776"
"28/10/2014 23:38:58","1","527228056889753600","","Al loro con la transición de 'van a la habitación cogiditos de la mano'->Olas rompiendo. Simbolismo a tope. #TeenCampechano #ElReyserie","twitter.com/Rocigaot/status/527228056889753600"
"28/10/2014 23:37:37","1","527227715817332736","","Ya pensaba que siendo príncipe y condesa iban a echar un polvo en el coche, en plan juventud precaria. #ElReyserie #TeenCampechano","twitter.com/Rocigaot/status/527227715817332736"
"28/10/2014 23:36:05","","527227330167853056","","@zezenzuska @Pozuelen Agree.","twitter.com/Rocigaot/status/527227330167853056"
"28/10/2014 23:35:24","2","527227156355903488","","Y como el muerto al hoyo y el vivo al bollo, ya está TeenCampechano perreando. O su equivalente de los años 50. #Elreyserie","twitter.com/Rocigaot/status/527227156355903488"
"28/10/2014 23:32:07","","527226333458616321","","Al final la culpa es de la madre de Campechano,por lo típico de dejar a tus hijos jugar con un arma para tener un ratito para ti.","twitter.com/Rocigaot/status/527226333458616321"
"28/10/2014 23:20:42","","527223458577784832","","@xoancastro por eso non penso procrear. Eu sei que se me cansan moito déixolles xogar cun bazooka por ter un rato de paz.","twitter.com/Rocigaot/status/527223458577784832"
"28/10/2014 23:19:08","","527223062505463809","1","Franco le regaló el arma, Alfonso pidió cogerla, la madre se la dio...Pobre #TeenCampechano, no le dejaron elección!","twitter.com/Rocigaot/status/527223062505463809"
"28/10/2014 23:17:18","","527222603375968256","","@xoancastro agora Juancar derrocará el só o franquismo en venganza por provocar a morte de Alfonso, xa verás. XD","twitter.com/Rocigaot/status/527222603375968256"
"28/10/2014 23:16:11","","527222322886115329","","@xoancastro creo que se vai matar o irmán soíño por non facerlle de suxeitavelas coa irmá da follamiga.","twitter.com/Rocigaot/status/527222322886115329"
"28/10/2014 23:15:08","1","527222057705439232","1","Al loro, que TeenCampechano se va a pasar la Semana Santa a Estoril y Franco le regala el arma con la que le va a dar matarile al hermano.","twitter.com/Rocigaot/status/527222057705439232"
"28/10/2014 23:13:12","","527221572684492801","","España entró en la ONU para robarle protagonismo a Campechano en su jura de bandera. Eso es como ir a una boda vestida de blanco pa joder.","twitter.com/Rocigaot/status/527221572684492801"
"28/10/2014 23:10:19","","527220847212511232","","De momento, #Elreyserie es bastante coñazo, eh. El humor involuntario no está tan logrado como en la de Felipe y Leti.","twitter.com/Rocigaot/status/527220847212511232"
"28/10/2014 23:06:49","","527219966320590849","","La madre de #LittleCampechano le dice en una carta que cuide a su hermano.Queda tranquila, que está en buenas man...ohwait. #Elreyserie","twitter.com/Rocigaot/status/527219966320590849"
"28/10/2014 23:05:24","","527219608919736320","","@xoancastro de momento están coa infancia, non sei a quen teñen pra facer de Campechano adulto.","twitter.com/Rocigaot/status/527219608919736320"
"28/10/2014 22:48:35","","527215377164820480","","Al pequeño Juancar a su llegada sólo le dedica su portada el ABC. Hay cosas que nunca cambian. #LittleCampechano","twitter.com/Rocigaot/status/527215377164820480"
"28/10/2014 22:46:26","1","527214835063595008","","Me ha llamado mi madre y me he perdido el desenlace de la crisis 'un ratón en El Pardo'. #LittleCampechano","twitter.com/Rocigaot/status/527214835063595008"
"28/10/2014 22:41:05","","527213488524263425","","El pequeño Juancar está recién llegado a España y está tirste porque los otros niños le llaman Alteza y no Juanito. Campechano desde niño.","twitter.com/Rocigaot/status/527213488524263425"
"28/10/2014 22:37:57","","527212700078981120","","Está empezando la tv movie de peloteo a Campechano I. Estoy por abrirme una cerveza y quedarme a verla y twittearla.","twitter.com/Rocigaot/status/527212700078981120"
"28/10/2014 22:34:38","2","527211864569430016","","@Pozuelen @Tabernita na, déjalo estar. Que tampoco es pa tanto, fijo que se descojonaban,pero no hay que airear mis taritas. XD","twitter.com/Rocigaot/status/527211864569430016"
"28/10/2014 22:32:55","","527211434342895616","","@ComandanteVimes @Tabernita yo estuve por preguntarle a alguno de los amigos si era la de siempre,pero con lo cotillas que son... XD","twitter.com/Rocigaot/status/527211434342895616"
"28/10/2014 22:31:11","","527210998760222720","","@Tabernita lo mejor es que el novio me sigue aquí, dudo que le dé por mirar mis interacciones con otros twitteros,pero igual aún me pilla XD","twitter.com/Rocigaot/status/527210998760222720"
"28/10/2014 22:30:01","","527210705150562304","","@Tabernita he de decir en mi defensa que eran amigos de un ex de hacía como 6 años y que la vi 5 ó 6 veces en el tiempo que salimos. XD","twitter.com/Rocigaot/status/527210705150562304"
"28/10/2014 22:27:49","2","527210148960694272","","@Tabernita al final salvé porque según llegué ella me dijo 'hola, cuánto tiempo', que si no lo mismo me presento y quedo fatal. XD","twitter.com/Rocigaot/status/527210148960694272"
"28/10/2014 22:26:22","1","527209784228212737","","@Tabernita el caso es que no le pregunté porque pensé: 'cuando vaya ya veré si es la que conozco', pero mi memoria para las caras es penosa","twitter.com/Rocigaot/status/527209784228212737"
"28/10/2014 22:24:10","","527209232551403520","","@Tabernita y yo me quedé pensando si era una novia nueva,porque si fuera la que yo conocía lo suyo habría sido llamarla por su nombre(3)","twitter.com/Rocigaot/status/527209232551403520"
"28/10/2014 22:22:43","","527208864899682305","","@Tabernita me dice:'mi novia está estudiando magisterio por inglés y no se apaña con la fonética, le podrías echar una mano?' (2)","twitter.com/Rocigaot/status/527208864899682305"
"28/10/2014 22:21:45","","527208622393421824","","@Tabernita me mandó un privao en FB un amigo de mi ex al que llevaba años sin ver,y que jamás sube fotos de su vida,para pedirme un favor(1)","twitter.com/Rocigaot/status/527208622393421824"
"28/10/2014 22:20:17","","527208252598398976","","@Tabernita a mí me pasó una vez una cosa muy graciosa debido a esa costumbre y a mi nula memoria para las caras.","twitter.com/Rocigaot/status/527208252598398976"
"28/10/2014 20:45:52","","527184491945918464","","Vaya, ya que Infojobs no me va a conseguir un trabajo medio digno, que al menos me dé una opción de ocio gratuito.","twitter.com/Rocigaot/status/527184491945918464"
"28/10/2014 20:45:17","","527184348236492800","","Voy a empezar a anotarme a las ofertas de comercial de eléctricas falso autónomo para echar el día trolleándoles los 'cursos de formación'.","twitter.com/Rocigaot/status/527184348236492800"
"28/10/2014 20:39:50","1","527182973343641601","","@Marmota_Maligna cierto! y te buscaría por la foto de avatar, y claro, podría confundirte!","twitter.com/Rocigaot/status/527182973343641601"
"28/10/2014 20:36:22","1","527182104015409152","","@Marmota_Maligna cuando sea posible yo me apunto también. (A darme un sillazo a mí, no a dártelo a ti, se entiende).","twitter.com/Rocigaot/status/527182104015409152"
"28/10/2014 20:30:06","","527180526294401026","","@xoancastro ai, si, pégalle moito!","twitter.com/Rocigaot/status/527180526294401026"
"28/10/2014 20:15:15","2","527176788318105601","","De hecho,los metía a compartir gulag con los de 'yo es que soy muy sincero y todo te lo digo así a la cara y a quien le moleste que se joda'","twitter.com/Rocigaot/status/527176788318105601"
"28/10/2014 20:13:57","3","527176461233692672","","Sobra decir que yo a la gente que usa la coletilla de 'mi defecto es que soy demasiado buena' le montaba un gulag también.","twitter.com/Rocigaot/status/527176461233692672"
"28/10/2014 20:13:11","1","527176266873856000","5","Tras lo de 'disculpas por confiar en quien no lo merecía', a Espe y Mariano les faltó rematar con 'nuestro defecto es ser demasiado buenos'.","twitter.com/Rocigaot/status/527176266873856000"
"28/10/2014 19:19:57","1","527162870598221824","","@laMascota @Pozuelen de hecho,si me tiran tan para atrás las webs de búsqueda de pareja es que me recuerdan a infojobs.","twitter.com/Rocigaot/status/527162870598221824"
"28/10/2014 19:07:25","","527159718289350658","1","@Pozuelen 'estaré encantado de escribirte una buena recomendación en Tinder'.","twitter.com/Rocigaot/status/527159718289350658"
"28/10/2014 19:04:45","2","527159047976665089","1","@Pozuelen romper con: 'valoro tu implicación con este proyecto sentimental y te deseo suerte en las relaciones que emprendas en el futuro  '","twitter.com/Rocigaot/status/527159047976665089"
"28/10/2014 18:54:23","","527156437781581824","","Y al llegar a un semáforo en rojo se bajaron y fueron donde el otro. No les llega pitar y cagarse en sus muertos como hago yo?","twitter.com/Rocigaot/status/527156437781581824"
"28/10/2014 18:52:40","","527156005919281152","","Flipaos que abren el techo solar del coche para que el copiloto vaya con medio cuerpo fuera insultando a otros conductores. Fan. #No","twitter.com/Rocigaot/status/527156005919281152"
"28/10/2014 17:44:43","","527138905393758208","","@xoancastro @alberto_ramos ónde atopas estas cousas?","twitter.com/Rocigaot/status/527138905393758208"
"28/10/2014 17:42:09","","527138258221035521","","@ComandanteVimes ya ves, periodismo de nivel.","twitter.com/Rocigaot/status/527138258221035521"
"28/10/2014 17:40:10","1","527137762420723712","","@ComandanteVimes aquí va. El borrado de caras con Paint también me tiene fascinadita. http://www.elmundo.es/loc/2014/10/28/544e7ec4268e3eaf2a8b4593.html …","twitter.com/Rocigaot/status/527137762420723712"
"28/10/2014 17:38:19","1","527137294206402560","","@ComandanteVimes mi tweet era una dramatización de cómo puede seguir la cobertura del caso.","twitter.com/Rocigaot/status/527137294206402560"
"28/10/2014 17:37:50","","527137174085718016","","@ComandanteVimes tienen una noticia de 'un colega del actual novio de la pechotes nos confirma que él la ha dejado', o algo así.","twitter.com/Rocigaot/status/527137174085718016"
"28/10/2014 17:37:15","","527137025938710529","","@familiasunshine no, tiene 19.Igual si fuera menor la sanción por pasarse la ley del menor por la huevada les cortaba. Aunque no sé yo.","twitter.com/Rocigaot/status/527137025938710529"
"28/10/2014 17:34:31","12","527136339188531200","15","'Ella ha decido ocultarse y borrar su Facebook'. Igual que le estéis robando fotos para una galería para pajilleros tiene que ver, El Mundo.","twitter.com/Rocigaot/status/527136339188531200"
"28/10/2014 17:28:28","","527134816853303296","","@xoancastro todo o que traballou en xornalismo sabe que 'pechotes' trae máis visitas vía Google que 'Nicolás'.","twitter.com/Rocigaot/status/527134816853303296"
"28/10/2014 17:24:51","1","527133907360436226","1","Que yo a menos que la chavala ayudara al Nicolás a timar a la peña sigo sin entender qué pinta en esta historia.","twitter.com/Rocigaot/status/527133907360436226"
"28/10/2014 17:23:34","1","527133581173608448","3","Reunión de contenidos en El Mundo: 'Yo tengo que el ex de la Pechotes ha subido a FB un selfie agarradito a una de 1ºde Derecho'. PERIODISMO","twitter.com/Rocigaot/status/527133581173608448"
"28/10/2014 17:20:39","2","527132849603092480","","Ojo,que igual alguien pagó un máster para entrar en El Mundo y acabar investigando los rolletes de facultad de la amiga de Nicolás.","twitter.com/Rocigaot/status/527132849603092480"
"28/10/2014 17:15:00","3","527131428820365312","","Jovenzuelos madrileños de mi TL,ojo a ver si una noche os liasteis con una ex del ex de la ex del Pequeño Nicolás y os sacan en El Mundo.","twitter.com/Rocigaot/status/527131428820365312"
"28/10/2014 16:55:32","1","527126529764233216","","@Tabernita @mjdelrio es que es parte de su encanto. XD","twitter.com/Rocigaot/status/527126529764233216"
"28/10/2014 16:45:13","","527123931938189312","","@Tabernita @mjdelrio igual intentan curarles el miedo con tratamiento de shock. Aunque en mis casos más cercanos no ha funcionado mucho. XD","twitter.com/Rocigaot/status/527123931938189312"
"28/10/2014 16:34:35","2","527121257490554881","","@mjdelrio @Tabernita eso sí, me hace gracia que si hay un grupo de gente y uno les tenga miedo,los chuchos van directos a olisquear a ese XD","twitter.com/Rocigaot/status/527121257490554881"
"28/10/2014 16:30:52","","527120321208680448","","@xoancastro @bestilheiro @mvizaguirre igual xa coñecedes isto: https://www.youtube.com/watch?v=7uBZRE5mXpc …","twitter.com/Rocigaot/status/527120321208680448"
"28/10/2014 16:29:07","1","527119881758846976","","@mjdelrio @Tabernita mi amiga ya lo va llevando mejor,una vez hasta acarició a un pastor alemán. Porque el dueño estaba bueno. XD","twitter.com/Rocigaot/status/527119881758846976"
"28/10/2014 16:23:32","","527118475261927424","","@mjdelrio @Tabernita la coña fue cuando vino a verme una amiga que les tiene pánico y se cruzó a los 3 al galope por la escalera. XDD","twitter.com/Rocigaot/status/527118475261927424"
"28/10/2014 16:20:40","2","527117753506074624","","@mjdelrio @Tabernita en mi ex-piso tuve un vecino con 3perrazos,y no daban el coñazo ni la cuarta parte que mis otros vecinos.","twitter.com/Rocigaot/status/527117753506074624"
"28/10/2014 16:18:32","1","527117218589704192","","@xoancastro @bestilheiro @mvizaguirre eu se fora el apostaba polo blog, que a burbulla dos vídeos de gatos acabará por reventar algún día.","twitter.com/Rocigaot/status/527117218589704192"
