"date","fav","id","rt","text","url"
"23/10/2014 14:35:43","1","525264304057376769","1","@laMascota y es más gracioso aún cuando lo dice uno al que sólo has oído hablar del problema X para decir:'os preocupa ahora que sale en TV'","twitter.com/Rocigaot/status/525264304057376769"
"23/10/2014 12:23:43","","525231084519587840","","A todo esto twitter me actualiza y me deja publicar,pero si intento entrar en cualquier otra web mi ordenador dice que no tiene conexión. ¿?","twitter.com/Rocigaot/status/525231084519587840"
"23/10/2014 12:22:48","","525230852029317120","","Ay, que no había visto aún la gráfica de El País. WTF??","twitter.com/Rocigaot/status/525230852029317120"
"23/10/2014 1:22:07","","525064586181881856","","@Hominidio pois non, falsa alarma. Sigo castigada sen gifs. :(","twitter.com/Rocigaot/status/525064586181881856"
"23/10/2014 1:20:35","","525064202688266241","","@Hominidio a min agora apareceume un no TL que puiden ver, vou ver se é unha excepción ou se twitter xa me quere.","twitter.com/Rocigaot/status/525064202688266241"
"23/10/2014 1:12:17","","525062114314944512","","@PotiPotiInLove @Tabernita también digo que si a alguien le pone... pues oye, parafilias más raras habrá.","twitter.com/Rocigaot/status/525062114314944512"
"23/10/2014 1:06:42","2","525060707562188800","","@PotiPotiInLove @Tabernita hombre, yo no pediría la suite Totoro de un motel, pero si la cama disponible es de Totoro,mejor eso que na.","twitter.com/Rocigaot/status/525060707562188800"
"23/10/2014 0:58:56","","525058755092697088","1","@PotiPotiInLove sí, con sitios más raros me he tenido que apañar.","twitter.com/Rocigaot/status/525058755092697088"
"23/10/2014 0:41:36","","525054390382501889","","@PotiPotiInLove mierda, debería haberme leído la letra pequeña!","twitter.com/Rocigaot/status/525054390382501889"
"23/10/2014 0:39:03","","525053750411399168","","¿Por qué a todos os funcionan los gifs y a mí no? Twitter, ¿por qué me odias?","twitter.com/Rocigaot/status/525053750411399168"
"23/10/2014 0:16:58","1","525048193277374465","1","@PotiPotiInLove pues yo he estado pagando como una tonta. Me está bien por no leer la guía de usuaria que te dan al apuntarte al hembrismo.","twitter.com/Rocigaot/status/525048193277374465"
"22/10/2014 23:47:20","","525040732633985025","","@Facking_Ancho lo malo es que eso no cuela cuando intentas que te dejen pillar la jubilación anticipada a los 35 :P","twitter.com/Rocigaot/status/525040732633985025"
"22/10/2014 23:46:43","","525040579587997696","","@familiasunshine cuánto puede durar un eclipse? Porque yo llevo una racha que...","twitter.com/Rocigaot/status/525040579587997696"
"22/10/2014 23:38:51","1","525038598840909824","1","@Facking_Ancho mis fotos de bebé son en blanco y negro, y no por un filtro de instagram precisamente. :P","twitter.com/Rocigaot/status/525038598840909824"
"22/10/2014 21:50:15","","525011271377489920","","@Tabernita yo doy gracias de no ser famosa y de que no hubiera redes sociales ni móviles con cámara en mis años de vida de estudiante :P","twitter.com/Rocigaot/status/525011271377489920"
"22/10/2014 21:37:22","3","525008027985149952","","@Tabernita procura no cantar La Internacional, a ver si te van a sacar en Interlobotomía!","twitter.com/Rocigaot/status/525008027985149952"
"22/10/2014 15:31:44","1","524916013432078337","","@laMascota QUÉ ME ESTÁS CONTANDO??","twitter.com/Rocigaot/status/524916013432078337"
"22/10/2014 15:19:56","1","524913044351381505","","@delocoprimo encima en el momento en que imponen una jornada canta que es falso autónomo. Quieren un empleado sin derechos por menos del SMI","twitter.com/Rocigaot/status/524913044351381505"
"22/10/2014 14:26:07","","524899498976636929","","'Esa persona', 'La persona por la que usted se ha interesado'... Las partidas de Tabú en Génova 13 tienen que tener nivelazo.","twitter.com/Rocigaot/status/524899498976636929"
"22/10/2014 14:12:33","3","524896085425553408","","'Mujer,no será el trabajo ideal, pero no pierdes nada por probar'. Por lo pronto, la cuota de autónomos. Gasolina, teléfono...","twitter.com/Rocigaot/status/524896085425553408"
"22/10/2014 14:03:50","","524893892500787200","","Me habían llamado para una oferta de esas de comercial falso autónomo,pero me he quedado frita.Lástima,quería ir a trollear un poco.","twitter.com/Rocigaot/status/524893892500787200"
"22/10/2014 13:45:19","","524889233526648832","","@laMascota @Pozuelen normalmente la gente nota el maquillaje si ve colorines:con cara lavada y labial cantoso, te ven pintada.","twitter.com/Rocigaot/status/524889233526648832"
"22/10/2014 13:25:13","1","524884175028252672","","@laMascota @Pozuelen tíos que creen que vas sin maquillar si no llevas sombra cantosa aunque lleves prebase,base,corrector,polvos,bronzer...","twitter.com/Rocigaot/status/524884175028252672"
"21/10/2014 23:31:07","","524674263773880320","","@J_manolito y sin quitar objetos arrojadizos del escritorio. En la última entrevista que tuve así había un cenicero que me llamaba a gritos.","twitter.com/Rocigaot/status/524674263773880320"
"21/10/2014 23:30:24","","524674084811341824","","Como esas mierdas de 'hazte autónomo,vende nuestra mierda a amigos y a la calle si no llegas a objetivo'.Te lo sueltan y ni se avergüenzan.","twitter.com/Rocigaot/status/524674084811341824"
"21/10/2014 23:27:28","2","524673347150675968","","Algo que me fascina de los curros de mierda o directamente ilegales es la gente que te los explica en la entrevista sin sonrojarse siquiera.","twitter.com/Rocigaot/status/524673347150675968"
"21/10/2014 17:38:12","","524585451072815104","","Eh, @PotiPotiInLove , viste que me ha hecho FAV una cuenta de crowdfundings a lo del gulag hembrista? XDDDD","twitter.com/Rocigaot/status/524585451072815104"
"21/10/2014 17:34:54","2","524584618750914560","","@Pozuelen me recuerdas a una amiga mía a la que cuando le preguntaban si las tetas eran las suyas decía que sí,que de su bolsillo las pagó.","twitter.com/Rocigaot/status/524584618750914560"
"21/10/2014 17:23:22","3","524581717034926081","1","@PotiPotiInLove yo estoy haciendo crowdfunding para comprar un centro comercial que ha chapado y reciclarlo en gulag hembrista, no digo más","twitter.com/Rocigaot/status/524581717034926081"
"21/10/2014 15:19:04","6","524550435240439808","4","Como entrullen a Acebes monto una fiesta que las de Rato con la black card van a parecer cumpleaños de los hijos de Ned Flanders.","twitter.com/Rocigaot/status/524550435240439808"
"21/10/2014 14:52:07","7","524543654250430464","6","Hasta me da pena que hayan detenido a Francisco Nicolás antes de que le viéramos ofrecer a algún alcalde el Monorail.","twitter.com/Rocigaot/status/524543654250430464"
"21/10/2014 12:12:06","","524503386658713600","","@Marmota_Maligna ah,no, yo tenía buenas intenciones y quería ir. Otra cosa es que luego el sueño y la resaca ganasen a la buena intención.","twitter.com/Rocigaot/status/524503386658713600"
"21/10/2014 12:10:09","","524502892418719744","","@Marmota_Maligna yo le dejaba 1post-it a mi compañera para que me despertara para ir a clase,pero no siempre lo lograba.","twitter.com/Rocigaot/status/524502892418719744"
"21/10/2014 12:03:32","","524501228819324928","","@Marmota_Maligna yo en su día había hecho la 'semana fantástica', salir 7 días seguidos. Ahora no sé si llegaría viva al tercero. :P","twitter.com/Rocigaot/status/524501228819324928"
"21/10/2014 12:00:15","1","524500404445675520","","@Marmota_Maligna yo ya no tengo ni estómago ni hígado de piso de estudiantes. Qué chungo es envejecer. :P","twitter.com/Rocigaot/status/524500404445675520"
"21/10/2014 1:31:17","","524342118244835331","","@Tabernita @PotiPotiInLove @ComandanteVimes oye, pues mola! aunque jurarán que van bien aunque se caigan más que Campechano I.","twitter.com/Rocigaot/status/524342118244835331"
"21/10/2014 1:23:14","","524340090592436224","","@Tabernita @ComandanteVimes @PotiPotiInLove cuál es esa, que igual te la plagio un día?","twitter.com/Rocigaot/status/524340090592436224"
"21/10/2014 1:21:27","3","524339644402397184","","@ComandanteVimes @Tabernita @PotiPotiInLove yo voy a empezar a inventarme razonamientos científicos así para librarme de pesaos en los bares","twitter.com/Rocigaot/status/524339644402397184"
"21/10/2014 1:19:46","1","524339220060450816","","@Tabernita @PotiPotiInLove que también te digo que he dado con peluqueros que si lo sé me voy a que me cambie de look un oso. :P","twitter.com/Rocigaot/status/524339220060450816"
"21/10/2014 1:19:00","","524339028145885184","","@Tabernita @PotiPotiInLove y por tanto son poco fértiles, porque igual el oso les hizo peluquería+ligadura de trompas en un 2x1.","twitter.com/Rocigaot/status/524339028145885184"
"21/10/2014 1:18:09","","524338811686236160","","@Tabernita @PotiPotiInLove dice que a los hombres no les atraen las mujeres con pelo corto porque le hacen pensar en que tienen tarita(1)","twitter.com/Rocigaot/status/524338811686236160"
"21/10/2014 1:10:59","3","524337010027159552","1","@PotiPotiInLove y la rabia que da cuando te estás dejando crecer el pelo para una boda o algo,te metes en una pelea con un oso y te lo corta","twitter.com/Rocigaot/status/524337010027159552"
"20/10/2014 22:29:47","","524296443562303488","","@ResistenciaGZ sodes unha micropyme.","twitter.com/Rocigaot/status/524296443562303488"
"20/10/2014 14:55:27","","524182106147393536","","@Tabernita si le hubieras mandado el ramo de rosas de bacon, no las habría escondido, fijo. XD","twitter.com/Rocigaot/status/524182106147393536"
"20/10/2014 14:48:14","","524180289762115585","","@ResistenciaGZ pois esta é doada de entender, seguro que era un médico de verdade?","twitter.com/Rocigaot/status/524180289762115585"
"20/10/2014 14:36:02","","524177218600452096","","@beblas verlo por sí solo es algo coñazo, pero verlo siguiendo los comentarios por twitter mola!","twitter.com/Rocigaot/status/524177218600452096"
"20/10/2014 14:32:51","","524176417857495041","","Twitter, no sé qué has tocao, pero ahora no se me ven los gifs. :(","twitter.com/Rocigaot/status/524176417857495041"
"20/10/2014 1:11:26","","523974734560886785","","Hombre, si ya era un hombre adulto en el 36, que muera en el 80 tampoco es una cosa TAAAN sobrenatural. #CuartoMilenio","twitter.com/Rocigaot/status/523974734560886785"
"20/10/2014 1:00:01","2","523971860678320128","","@El__Yayo morirían cerca del estudio, como lo de Lorca muriendo cerca de su pueblo.","twitter.com/Rocigaot/status/523971860678320128"
"20/10/2014 0:58:52","8","523971573993451520","9","Una película de corte anarquista, rodada durante la guerra civil,¿y desapareció gente? UHHH, MISTERIO. #CuartoMilenio","twitter.com/Rocigaot/status/523971573993451520"
"20/10/2014 0:53:25","","523970200325337088","1","Pensé que la spirit box es como esas cajas de muestras de productos que enseñan las blogueras,pero con los trastos de Gaona #CuartoMilenio","twitter.com/Rocigaot/status/523970200325337088"
"20/10/2014 0:51:44","1","523969778109906944","1","'Gaona le encarga sus aparatajes a las ingenierías'. Ingenieros en paro, mirad ahí que tenéis una salida laboral. #CuartoMilenio","twitter.com/Rocigaot/status/523969778109906944"
"20/10/2014 0:50:04","1","523969358830530561","2","Faltan otros 2fantasmas diciéndile a la arrugada 'con esas pintas no nos aparecemos contigo',como en el programa de divinity #CuartoMilenio","twitter.com/Rocigaot/status/523969358830530561"
"20/10/2014 0:46:27","4","523968446506500096","2","¿Cuidaba a un hijo discapacitado y carretaba verduras y le echan en cara que no se cuidara la piel? Pobre mujer fantasma! #CuartoMilenio","twitter.com/Rocigaot/status/523968446506500096"
"20/10/2014 0:43:04","15","523967596258144256","9","'La mujer estaba estropeada, con arrugas, de no haberse cuidado...' ¿Esto es #CuartoMilenio o 'tu estilo fantasmal a juicio'?","twitter.com/Rocigaot/status/523967596258144256"
"20/10/2014 0:09:55","1","523959252113977345","","@deploreibol 'in his habit as he lived'. Imagina que palma Ágata Ruiz de la Prada y se te aparece.","twitter.com/Rocigaot/status/523959252113977345"
"20/10/2014 0:08:23","3","523958867747950592","1","Que si es un edificio nuevo y oyes voces, a veces no son fantasmas, son los mierdamuros de pladur. #CuartoMilenio","twitter.com/Rocigaot/status/523958867747950592"
"20/10/2014 0:07:36","6","523958671941058561","3","'Se oían voces, como si fueran los vecinos hablando fuerte'. ¿Y no serían los vecinos hablando fuerte? #CuartoMilenio","twitter.com/Rocigaot/status/523958671941058561"
"20/10/2014 0:05:44","1","523958202766229506","","@CristianMas86 es que a un fantasma vestido de Desigual, haga lo que haga no te lo tomas en serio.","twitter.com/Rocigaot/status/523958202766229506"
"20/10/2014 0:04:12","5","523957817049628672","2","Si os dan miedo los payasos es porque no habéis visto los monólogos de 'humor' de los anuncios de Ligeresa. #CuartoMilenio","twitter.com/Rocigaot/status/523957817049628672"
"20/10/2014 0:03:23","2","523957611520339969","7","La mujer de gris,figuras negras... ¿por qué no hay fantasmas que vistan de fucsia?¿O con estampados? #outfitfantasma #CuartoMilenio","twitter.com/Rocigaot/status/523957611520339969"
"20/10/2014 0:00:51","3","523956972413284352","1","Una tía con abrigo en agosto en Badajoz es raro, pero no tiene que ser un fantasma: podría ser una amiga mía tranquilamente. #CuartoMilenio","twitter.com/Rocigaot/status/523956972413284352"
"19/10/2014 23:42:28","1","523952346108542977","1","@Pozuelen #notallPUAs ya está dicho?","twitter.com/Rocigaot/status/523952346108542977"
"19/10/2014 23:39:32","","523951607197999104","","@Marmota_Maligna la de la experiencia mística? Por el jejejé de la respuesta, yo diría que sí.","twitter.com/Rocigaot/status/523951607197999104"
"19/10/2014 23:10:13","","523944228809093120","","En el cónclave de mentes maravillosas ese se habrá colado también Francisco Nicolás? #CuartoMilenio","twitter.com/Rocigaot/status/523944228809093120"
"19/10/2014 13:30:20","","523798296901742594","","@chselles ¿'reflexiva y muy borbón' no es un oxímoron?","twitter.com/Rocigaot/status/523798296901742594"
"18/10/2014 21:24:17","","523555182144417792","","@mcalpena @Tildom igual se han confundido y la explicación corresponde al 'estilo japonés feliz' que sale arriba de todo.","twitter.com/Rocigaot/status/523555182144417792"
"18/10/2014 18:07:23","7","523505629668081664","5","He visto por FB una ruta del vino 'para seguir los pasos de Santa Teresa de Jesús'. No digo que sea imposible,pero con LSD lo logras antes.","twitter.com/Rocigaot/status/523505629668081664"
"18/10/2014 15:40:19","2","523468622245941248","","@laMascota @Facking_Ancho intentan tirar mis camisetas por el tubo para que vista 'conforme a mi edad' y corre la sangre.","twitter.com/Rocigaot/status/523468622245941248"
"18/10/2014 15:35:38","2","523467441364811776","1","@Facking_Ancho @laMascota 'Esta noche salimos, y no como antes que me daba vergüenza que me vieran contigo en público'.","twitter.com/Rocigaot/status/523467441364811776"
"18/10/2014 14:23:51","4","523449376551993344","","@Lena_Prado @PotiPotiInLove 'casta'=chupito. 'régimen'=chupito. Comparación de Coletas con pesonaje histórico=3chupitos del tirón. #cirrosis","twitter.com/Rocigaot/status/523449376551993344"
"18/10/2014 14:03:59","","523444378770362368","","@callaquenoveo ya le has pasado la idea a la HBO para una serie sobre Francisco Nicolás?  @morganaskwlkr","twitter.com/Rocigaot/status/523444378770362368"
"17/10/2014 22:18:02","1","523206320846274561","","@ComandanteVimes juas! Igual deberías quitarte a Vimes del avatar y poner a Flanders! XD","twitter.com/Rocigaot/status/523206320846274561"
"17/10/2014 22:15:41","","523205730212790272","","@ComandanteVimes yo la última vez que vi a alguien usarlo fue por error, para referirse a un 'cachi', o litro de calimocho.","twitter.com/Rocigaot/status/523205730212790272"
"17/10/2014 22:12:35","1","523204948319010816","2","@PotiPotiInLove mi mayor trauma, de todos los que la RAE me ha provocado, es 'cederrón'.","twitter.com/Rocigaot/status/523204948319010816"
"17/10/2014 22:10:22","","523204392053645312","","@ComandanteVimes yo creo que ni eso. Es que creo que ni 'chachi' se usa ya ni en el barrio de Salamanca...","twitter.com/Rocigaot/status/523204392053645312"
"17/10/2014 22:09:05","1","523204068614107136","","@ComandanteVimes por cierto, acabo de mirar que admite 'chachi' pero te remite a 'chanchi'. ¿Quién dice 'chanchi'? http://lema.rae.es/drae/?val=chachi …","twitter.com/Rocigaot/status/523204068614107136"
"17/10/2014 22:07:43","","523203724823764994","","@editora @El__Yayo  pero no parece que use mucho la cuenta. @Ojiplatica , vuelve a twitter!","twitter.com/Rocigaot/status/523203724823764994"
"17/10/2014 21:43:54","1","523197732123848705","2","Si alguien en Mediaset tiene media neurona, a estas horas ya tienen a algún guionista trabajando en la tv-movie de Francisco Nicolás.","twitter.com/Rocigaot/status/523197732123848705"
"17/10/2014 21:30:26","2","523194343835045890","","¿La RAE ya ha admitido 'finstro'?","twitter.com/Rocigaot/status/523194343835045890"
"17/10/2014 21:07:50","","523188656442732545","","@roberttomelitto que oye, ya han admitido botellón, que sólo tendrá un par de décadas!","twitter.com/Rocigaot/status/523188656442732545"
"17/10/2014 21:01:10","8","523186978091962368","6","'Amigovio', 'Papichulo'... igual los académicos usan la RAE para mandar indirectas a alguien, como los que os ponéis 'es complicado' en FB.","twitter.com/Rocigaot/status/523186978091962368"
"17/10/2014 20:59:55","5","523186664576131072","4","Además de 'chupi', la RAE debería admitir otras expresiones en argot de candente actualidad como 'chachi piruli' o 'alucino en tecnicolor'.","twitter.com/Rocigaot/status/523186664576131072"
"17/10/2014 15:16:18","1","523100188534382593","","@laMascota @Pozuelen cuánta crueldad. XDDDD","twitter.com/Rocigaot/status/523100188534382593"
"17/10/2014 15:13:53","","523099580297396225","","@laMascota @Pozuelen pues a este nunca le he oído llamar Cocoliso,pero todo puede ser!","twitter.com/Rocigaot/status/523099580297396225"
"17/10/2014 15:10:07","","523098633491984384","","@laMascota @Pozuelen Debe de tener un ejército de clones, el chaval. XDD","twitter.com/Rocigaot/status/523098633491984384"
"17/10/2014 15:07:41","1","523098018917392384","","@laMascota @Pozuelen callad, que el de la derecha me había parecido uno que conozco que es un personaje. No era, pero...","twitter.com/Rocigaot/status/523098018917392384"
"17/10/2014 13:51:03","1","523078736825290752","","Intento recordar la última vez que tuve una entrevista de trabajo que no empezara por: 'Tendrías que darte de alta como autónoma, y...'","twitter.com/Rocigaot/status/523078736825290752"
"16/10/2014 23:24:50","","522860743721357312","","@zezenzuska yo usaba las típicas: meapilas, cristofreaks...pero desde que me dijeron la de 'los alabarés' me la quedé, es genial.","twitter.com/Rocigaot/status/522860743721357312"
"16/10/2014 23:14:24","12","522858120021041152","7","Cuando las JMJ,una amiga acuñó el término 'los alabarés' para la invasión de católicos,y sigo esperando que la RAE lo admita.","twitter.com/Rocigaot/status/522858120021041152"
"16/10/2014 23:10:20","2","522857094132006912","1","@zezenzuska na, si tienes un día chungo recuerda que NO es verdad que hayas salido con Reverte o Ansón. Eso fijo que anima. @LumpenPerro","twitter.com/Rocigaot/status/522857094132006912"
"16/10/2014 23:08:13","","522856565066330112","","@zezenzuska @LumpenPerro se ha pasado más que yo aún!","twitter.com/Rocigaot/status/522856565066330112"
"16/10/2014 23:01:41","2","522854919431553026","","@zezenzuska @suripantarosa si además un follamigo es lo que te echas para ahorrarte las partes coñazo de tener novio. No tiene sentido.","twitter.com/Rocigaot/status/522854919431553026"
"16/10/2014 22:53:03","1","522852745674776576","","@suripantarosa @zezenzuska yo argentinos conozco unos cuantos y no se lo oí en la vida. Voy a hacer sondeo en FB.","twitter.com/Rocigaot/status/522852745674776576"
"16/10/2014 22:51:37","","522852385430204417","","@suripantarosa @zezenzuska estoy leyendo por ahí que se usa en América, aunque no sé en qué país. Yo jamás se lo oí a nadie.","twitter.com/Rocigaot/status/522852385430204417"
"16/10/2014 22:49:05","3","522851747124215808","","@zezenzuska tu ex está en la RAE? No será Pérez Reverte! #mehepasao","twitter.com/Rocigaot/status/522851747124215808"
"16/10/2014 22:40:57","1","522849702493315073","","@zezenzuska no le recuerdo una cagada así a la RAE desde el cederrón. :P","twitter.com/Rocigaot/status/522849702493315073"
"16/10/2014 22:37:28","","522848823677550592","","@zezenzuska ah, que lo ha aceptado la RAE? Llevo unos días conectándome poco y estoy desconectada. Y follamigo no?","twitter.com/Rocigaot/status/522848823677550592"
"16/10/2014 22:34:08","","522847983881043968","","@zezenzuska de dónde ha salido ese palabro, que se lo he leído a medio TL en un ratito?","twitter.com/Rocigaot/status/522847983881043968"
"15/10/2014 15:10:07","1","522373857815298048","","@Cascarelo eu o de ISI non sei o que é, pero estou viciada ao programa das vodas en plan hipocondríaco enganchado a House.","twitter.com/Rocigaot/status/522373857815298048"
"14/10/2014 22:13:25","","522117997386027009","","Últimamente veo el aviso de 'Esta página web no está disponible' unas 50 veces al día. No sé si es mi conexión, mi ordenador o el Chrome. :P","twitter.com/Rocigaot/status/522117997386027009"
"14/10/2014 15:50:57","","522021744149008384","","@Tabernita @SoniniSumode o café normal/descafeinado.Yo a veces he pensado '¿creerán que estoy preñada y por eso me niegan alcohol y cafeína?","twitter.com/Rocigaot/status/522021744149008384"
"14/10/2014 12:30:12","1","521971226533572608","","Empresas que ponen 1oferta semanal buscando comerciales 'con posibilidad de contrato indefinido'.O eso es trola, o ya curra ahí media ciudad","twitter.com/Rocigaot/status/521971226533572608"
"13/10/2014 13:37:29","1","521625768720596993","1","@laMascota luego lo piden cuando están en otras ciudades, les ponen un chupito de calimocho y se extrañan.","twitter.com/Rocigaot/status/521625768720596993"
"13/10/2014 2:49:07","1","521462603726745601","","¿Por qué para hablar en nombre de la Virgen la señora esa pone voz de Darth Vader? #CuartoMilenio","twitter.com/Rocigaot/status/521462603726745601"
"13/10/2014 2:17:36","2","521454671303811073","","'La mayoría del mundo nos pide que durmamos'. Tus monólogos, sin ir más lejos, Friker. #CuartoMilenio","twitter.com/Rocigaot/status/521454671303811073"
"13/10/2014 2:03:29","2","521451119298744320","","Si tú eres una empresa seria de venta de órganos robados tienes que tener personal competente. #CuartoMilenio","twitter.com/Rocigaot/status/521451119298744320"
"13/10/2014 1:12:06","3","521438186153967617","1","Aunque @SnowFey coincidió conmigo en la hipótesis Mario Vaquerizo, la chica dice que el aparecido era Abraham Lincoln #CuartoMilenio","twitter.com/Rocigaot/status/521438186153967617"
"13/10/2014 1:07:23","","521436998905909248","","@MtroYupa @SnowFey se ve que estaba a huevo. :D","twitter.com/Rocigaot/status/521436998905909248"
"13/10/2014 1:06:47","","521436849043419136","","@SnowFey acabo de poner lo mismo y juro que no te he he plagiao XD","twitter.com/Rocigaot/status/521436849043419136"
"13/10/2014 1:06:26","9","521436763165040641","2","'Un hombre alto, con los pómulos muy salidos, iba muy oscuro'. A esta se le coló en casa Mario Vaquerizo. #CuartoMilenio","twitter.com/Rocigaot/status/521436763165040641"
"13/10/2014 1:04:19","","521436230601699328","","Por lo que están hablando, deduzco que el palabro inglés pretendía ser 'nightmare',pero pronunciado a lo 'estonejengue'.","twitter.com/Rocigaot/status/521436230601699328"
"13/10/2014 1:02:26","","521435757148647425","","¿Qué palabra inglesa se supone que es la que han dicho? #CuartoMilenio","twitter.com/Rocigaot/status/521435757148647425"
"13/10/2014 0:25:38","","521426494816813056","","@Marmota_Maligna si te consuela, de momento no está muy entretenido que digamos.Y para eso nos hacen esperar a esta hora...","twitter.com/Rocigaot/status/521426494816813056"
"12/10/2014 23:59:09","","521419828490665985","","Pues empieza Friker. Nosequé de una civilización perdida entre Albacete y Murcia y de un perro que ladraba.","twitter.com/Rocigaot/status/521419828490665985"
"12/10/2014 23:10:46","","521407655081156609","","@Marmota_Maligna ya les vale. Encima tienen que poner justo antes el programa del fulano ese, que me cae gordísimo. :P","twitter.com/Rocigaot/status/521407655081156609"
"12/10/2014 23:05:17","","521406271699046400","","Hoy no hay Friker o qué pasa? Que sigue el pesado del Mejode con la del PP vasco.","twitter.com/Rocigaot/status/521406271699046400"
"12/10/2014 21:15:54","","521378747896057858","","@Srta_Angus por un momento he entendido que Evaristo el de La Polla Records le estaba metiendo ficha a la del PP vasco. #estoyfataldelomío","twitter.com/Rocigaot/status/521378747896057858"
"12/10/2014 15:06:23","","521285753301905410","","@eleptricpic.twitter.com/ySEeDfNjTp","twitter.com/Rocigaot/status/521285753301905410"
"12/10/2014 14:36:56","","521278340955910144","1","@errejoners ahora que parece que va a salir con vida vamos a hacerle la pelota, por si las denuncias.","twitter.com/Rocigaot/status/521278340955910144"
"12/10/2014 14:33:03","","521277366199664640","","@gmit3 encima lo estoy leyendo en periodistas de los medios que sacaron esa foto. Lo dicen para salvarle el culo a la empresa.","twitter.com/Rocigaot/status/521277366199664640"
"12/10/2014 14:22:07","1","521274612861374464","","@kalevorroka eu no FB teño a un neoliberal ao que as veces animaría a abrirse un twitter por compartir as risas con todos vós.","twitter.com/Rocigaot/status/521274612861374464"
