"date","fav","id","rt","text","url"
"22/12/2014 1:53:34","2","546830872906047488","1","@robciria siempre digo que si alguien no llora con el capítulo del perro de Fry está muerto por dentro.","twitter.com/Rocigaot/status/546830872906047488"
"22/12/2014 1:51:21","1","546830315835363329","","Ves Friker con la idea de reírte y te meten a traición algo para pillarte una llorera. Es como cuando ves por 1ªvez lo del perro de Fry.","twitter.com/Rocigaot/status/546830315835363329"
"22/12/2014 1:14:27","1","546821031173054465","1","Les está dando clases para sacarse el First de lenguaje lobuno. #CuartoMilenio","twitter.com/Rocigaot/status/546821031173054465"
"22/12/2014 1:12:52","1","546820632202448896","","@Srta_Angus no soy yo muy miedosa con los animales,pero creo que no le quitaría comida a un lobezno en las narices de su madre, pa porsi.","twitter.com/Rocigaot/status/546820632202448896"
"22/12/2014 0:47:08","","546814153185579009","","@zezenzuska la hostia, qué yuyu da.","twitter.com/Rocigaot/status/546814153185579009"
"22/12/2014 0:43:18","1","546813188487270400","","@zezenzuska deja de poner fotos que al final se me va a antojar comprar una y vete a saber dónde la encuentras a estas alturas. XD","twitter.com/Rocigaot/status/546813188487270400"
"22/12/2014 0:41:54","1","546812837364908032","","@Chinobi_Ninja supongo que porque desde que le dijeron que se lo ponían estábamos con la coña de 'qué puteo te va a caer con la canción'","twitter.com/Rocigaot/status/546812837364908032"
"22/12/2014 0:41:02","1","546812620058415104","","@Chinobi_Ninja tengo una amiga que se llama Marta a la que pusieron un marcapasos. Despertó cantando la canción de Hombres G.","twitter.com/Rocigaot/status/546812620058415104"
"22/12/2014 0:38:28","","546811974982836225","","@Chinobi_Ninja también te digo que con lo que me dijo que esperaba un colocón guay y qué va, fundido a negro hasta que desperté.","twitter.com/Rocigaot/status/546811974982836225"
"22/12/2014 0:37:05","2","546811626545225729","","La ex suegra se le vuelve a aparecer hoy para decirle 'Begoña, tía, mi hijo pasa de ti. Supéralo ya, que van diez años'. #CuartoMilenio","twitter.com/Rocigaot/status/546811626545225729"
"22/12/2014 0:35:59","2","546811349511462912","","@Chinobi_Ninja mi anestesista me dijo 'ya verás qué viaje,esto se lo chutaba Michael Jackson'.No fue muy tranquilizador,sabiendo cómo palmó","twitter.com/Rocigaot/status/546811349511462912"
"22/12/2014 0:32:59","2","546810595061030912","","@El__Yayo @zezenzuska a Mario Vaquerizo se la colocas por 600 euracos mínimo. Aunque yo tampoco se la vendería, que mola un puñao.","twitter.com/Rocigaot/status/546810595061030912"
"22/12/2014 0:31:46","1","546810289698930688","","@Chinobi_Ninja espérate, que aún va a pensar que te puede anestesiar sólo con hablarte y va a hacer lo mismo en quirófano :P","twitter.com/Rocigaot/status/546810289698930688"
"22/12/2014 0:30:24","1","546809943433957377","","@Tawil igual é un truco deses de sedución científica pra reconquistar a un ex.","twitter.com/Rocigaot/status/546809943433957377"
"22/12/2014 0:29:09","1","546809630320779264","1","@Tawil eu non sei cómo me tomaría que un ex meu fora falar do enterro da miña nai onda Friker, con dramatización incluida.","twitter.com/Rocigaot/status/546809630320779264"
"22/12/2014 0:26:34","","546808977963884545","","@zezenzuska @SnowFey he de decir que la lámpara-perro de tu madre es tan chunga que hasta me gusta. XD","twitter.com/Rocigaot/status/546808977963884545"
"22/12/2014 0:23:59","1","546808328324923393","","@zezenzuska @SnowFey ahora que recuerdo,yo de pequeña tenía una lámpara de esas, era una niña cabezona y la cabeza se iluminaba. XD","twitter.com/Rocigaot/status/546808328324923393"
"22/12/2014 0:20:23","","546807421998751746","","@Marmota_Maligna @Srta_Angus porque claro, que un muñeco poseído mate a tu hijo es tener una buena suerte de la hostia.","twitter.com/Rocigaot/status/546807421998751746"
"22/12/2014 0:13:56","4","546805799843287040","2","Estos muñecos son lo que regalas cuando en el amigo invisible de la empresa te toca el compañero que te cae gordo. #CuartoMilenio","twitter.com/Rocigaot/status/546805799843287040"
"22/12/2014 0:11:59","1","546805309550100480","","@Tawil @Srta_Angus mira que me pareció oír que le llamaban 'el Coletas' y pensé que había entendido mal. XD","twitter.com/Rocigaot/status/546805309550100480"
"22/12/2014 0:10:35","2","546804957765443584","","@Marmota_Maligna @SoniniSumode @Tabernita pero si voy a por ropa,que uso la 38/40, es 'no queda na, al ser una talla tan común...'","twitter.com/Rocigaot/status/546804957765443584"
"22/12/2014 0:10:11","1","546804855235678208","","@Marmota_Maligna @SoniniSumode @Tabernita la coña es que en rebajas, si voy a por zapatos me dicen 'no queda na, al ser un nºtan raro...'(1)","twitter.com/Rocigaot/status/546804855235678208"
"22/12/2014 0:08:34","","546804447972958209","","@Tabernita @SoniniSumode @Marmota_Maligna y en invierno apaño comprando un 36 y metiendo plantilla y calcetín gordo,para las bodas es peor.","twitter.com/Rocigaot/status/546804447972958209"
"22/12/2014 0:07:49","1","546804259170578432","","@SoniniSumode @Marmota_Maligna aquí suele llover una sola vez en invierno: empieza en octubre o noviembre y para por junio o así.","twitter.com/Rocigaot/status/546804259170578432"
"22/12/2014 0:06:15","1","546803867569364992","","@SoniniSumode @Marmota_Maligna yo aquí en días de lluvia con los acampanaos creo que he llegado con un litro de agua en cada pernera XD","twitter.com/Rocigaot/status/546803867569364992"
"22/12/2014 0:05:03","","546803564753199106","","@SoniniSumode @Marmota_Maligna y ya si encima calzas un 35 imagínate el plan. :P","twitter.com/Rocigaot/status/546803564753199106"
"22/12/2014 0:04:31","","546803429981827072","","@SoniniSumode @Marmota_Maligna los pitillos aquí son prácticos para poner dentro de las botas cuando llueve,pero quedar quedan fatal.","twitter.com/Rocigaot/status/546803429981827072"
"22/12/2014 0:03:38","","546803205691424768","","@SoniniSumode @Marmota_Maligna que luego veía en la discoteca a tías dos veces más grandes que yo con las botas que no me valían. Misterios","twitter.com/Rocigaot/status/546803205691424768"
"22/12/2014 0:03:09","","546803087332376577","","@SoniniSumode @Marmota_Maligna yo ahora ya encuentro más,pero en la época en la que no podía usar las de Mustang apañaba con esas.","twitter.com/Rocigaot/status/546803087332376577"
"21/12/2014 23:54:41","","546800954449076224","","@Marmota_Maligna me recuerda al de un amigo de la universidad,que su compañero de piso le pintó orejas y rabo con pintura fluorescente. :P","twitter.com/Rocigaot/status/546800954449076224"
"21/12/2014 23:49:41","1","546799698389237760","","@Tawil @shakesphobic de aquí ás eleccións xa serán o PSOE de ZP. E se as atrasan un pouco, UPyD.","twitter.com/Rocigaot/status/546799698389237760"
"21/12/2014 23:41:25","1","546797615292370945","","@Tawil eso no perfil de Linkedin ten que quedar como dios.","twitter.com/Rocigaot/status/546797615292370945"
"21/12/2014 23:40:03","1","546797271908909056","1","'Pactando con lobos'. #badumtssss #CuartoMilenio","twitter.com/Rocigaot/status/546797271908909056"
"21/12/2014 23:38:47","3","546796954001620993","2","Ay, hacía tiempo que no decían 'psicopompo'. #CuartoMilenio","twitter.com/Rocigaot/status/546796954001620993"
"21/12/2014 23:35:38","","546796162465144832","","Por fin empieza Friker. A ver si no está muy coñazo hoy, que encima que esperamos a estas horas...","twitter.com/Rocigaot/status/546796162465144832"
"21/12/2014 23:32:29","","546795366923132928","","@Marmota_Maligna @Chinobi_Ninja y aquel de ir a ligar,que tenías 3 candidatos a los que no veías y les hacías preguntas.","twitter.com/Rocigaot/status/546795366923132928"
"21/12/2014 23:30:28","1","546794859634642944","","@Chinobi_Ninja @Marmota_Maligna os acordáis de 'Su media naranja'? Mis padres me amenazaban con ir para hacer que me avergonzara de ellos.","twitter.com/Rocigaot/status/546794859634642944"
"21/12/2014 23:25:23","1","546793579856035840","","@Marmota_Maligna yo estoy intentando volver a mi peso de antes del paro. El de mis 16años ni me lo planteo,es luchar contra mi metabolismo","twitter.com/Rocigaot/status/546793579856035840"
"21/12/2014 23:22:44","","546792915771875328","","@Marmota_Maligna aclaro que no sé si los di o aún los tengo, que no entro lo sé fijísimo,que entonces pesaba 6 o 7kgs menos...","twitter.com/Rocigaot/status/546792915771875328"
"21/12/2014 23:21:37","","546792632291426304","","@Marmota_Maligna yo no lo sé, igual ya los di, igual se tiraron,igual están por algún lado,que con el Diógenes que tengo...","twitter.com/Rocigaot/status/546792632291426304"
"21/12/2014 23:20:20","","546792311834038272","","@Marmota_Maligna yo también tenía unos de esos, los rescataría ahora que ha vuelto la moda pero creo que no entro ni untada en vaselina.","twitter.com/Rocigaot/status/546792311834038272"
"21/12/2014 23:19:05","","546791995570946048","","@Marmota_Maligna @SoniniSumode que están volviendo también! Estuve el otro día mirando zapaterías y pensé que había viajado en el tiempo. XD","twitter.com/Rocigaot/status/546791995570946048"
"21/12/2014 23:17:00","","546791472188895233","","@Marmota_Maligna @SoniniSumode segunda mitad de la década. A mí no me valían por mis gemelacos,ni cuando llevaba la 36. :(","twitter.com/Rocigaot/status/546791472188895233"
"21/12/2014 23:15:30","","546791092600188928","","@Marmota_Maligna @SoniniSumode y las botas aquellas de Mustang de puntera redondeada y tacón cuadrado,que este año se llevan otra vez.","twitter.com/Rocigaot/status/546791092600188928"
"21/12/2014 23:13:20","","546790550230560770","","@Marmota_Maligna @SoniniSumode yo eso no,pero los pantalones acampanados con camisetas repegás de licra sí. :P","twitter.com/Rocigaot/status/546790550230560770"
"21/12/2014 23:09:06","","546789481987448832","","@Marmota_Maligna @SoniniSumode aún volverá a llevarse lo de los dos mechones delanteros en rubio oxigenao, a lo Valle de 'Compañeros'.","twitter.com/Rocigaot/status/546789481987448832"
"21/12/2014 23:03:37","","546788102640238592","","@SoniniSumode @Marmota_Maligna pues ahora parece que están volviendo,que tengo cada dejá vù de la adolescencia en las tiendas de ropa...","twitter.com/Rocigaot/status/546788102640238592"
"21/12/2014 22:55:27","","546786049314541569","","@SoniniSumode los 80 se llevan la fama, pero no han dado horteradas los 90 ni ná...","twitter.com/Rocigaot/status/546786049314541569"
"21/12/2014 22:45:30","","546783545919016960","","Molotov, Serrat y Juan Luis Gerra. Aquí hay mezclas más raras que en los mixes en casette que hacíamos para los botellones en mi juventud.","twitter.com/Rocigaot/status/546783545919016960"
"21/12/2014 22:44:17","","546783236652027905","","De qué se supone que va hoy lo de Cachitos, que acabo de cambiar y han puesto Molotov y Serrat?","twitter.com/Rocigaot/status/546783236652027905"
"21/12/2014 22:38:46","","546781849633452032","","@Srta_Angus @Tawil e antes tiña outro, amigo doutra amiga,e bloqueoume, aínda que sempre era el o que entraba ao meu muro a comentar.","twitter.com/Rocigaot/status/546781849633452032"
"21/12/2014 22:37:23","1","546781500990324737","","@Srta_Angus @Tawil fai algún tempo configurei pra que non me saíran as súas publicacións no muro, pra evitar movidas.","twitter.com/Rocigaot/status/546781500990324737"
"21/12/2014 22:33:35","1","546780545624322048","","@Srta_Angus @Tawil xente á que aceptas porque son familia/amigos/parella de alguén que aprecias e non queres conflicto diplomático.","twitter.com/Rocigaot/status/546780545624322048"
"21/12/2014 22:18:11","2","546776671836459010","","@Tawil @Srta_Angus este gif xa cho roubara,agardo que FB permita usalos algún día pra contestar as parrafadas dun de NNGG que teño agregado","twitter.com/Rocigaot/status/546776671836459010"
"21/12/2014 22:13:17","","546775436223864832","","@DavidLombao até que levaran a Arias Cañete,que sería a primeira vez que unha avoa descubrise que FIXO COMIDA DE MENOS.","twitter.com/Rocigaot/status/546775436223864832"
"21/12/2014 22:09:06","","546774385177407489","","@DavidLombao poderían facer un reality con ese concepto, levando a un cada semana. Rollo 'me cambio de familia'.","twitter.com/Rocigaot/status/546774385177407489"
"21/12/2014 22:06:43","2","546773786448920576","","@Tawil @Srta_Angus teño que baixarme algún programa de edición de vídeo e facer movidas destas,que vai ser para o que me sirva a carreira XD","twitter.com/Rocigaot/status/546773786448920576"
"21/12/2014 22:00:59","2","546772341196587009","","Estoy a un tris de poner lo de PDRO a ver si da tanta vergüencita ajena como se intuye por vuestros tuits.","twitter.com/Rocigaot/status/546772341196587009"
"21/12/2014 21:59:49","1","546772048945905664","","@Tawil cada vez empeza máis tarde. E o peor é que se poñes a tele antes de tempo atopas a Mejode. :(","twitter.com/Rocigaot/status/546772048945905664"
"21/12/2014 21:53:54","1","546770560018300929","","@_Quimi_ @Tabernita ya, seguro que a la mayoría le han puesto DENUNCIAS FALSAS.","twitter.com/Rocigaot/status/546770560018300929"
"21/12/2014 21:52:49","","546770287724089344","","@laMascota yo no lo estoy viendo, pero tengo el mando cerca, así que si veis que le van a hostiar avisad que lo pongo en un plis.","twitter.com/Rocigaot/status/546770287724089344"
"21/12/2014 21:49:17","1","546769398523232256","","@Tabernita no,bajé sola a andar por el paseo marítimo y las vi desde ahí,y parar a desconocidos para hablar de focas violadoras queda raro.","twitter.com/Rocigaot/status/546769398523232256"
"21/12/2014 21:44:03","","546768080362545152","","@errejoners unfollow por la imagen mental :P","twitter.com/Rocigaot/status/546768080362545152"
"21/12/2014 21:40:40","2","546767227517947905","","@Tabernita justo esta tarde vi a lo lejos las focas de la Casa de los Peces y me acordé de estas chunguedades. :(","twitter.com/Rocigaot/status/546767227517947905"
"21/12/2014 21:36:26","","546766165423702016","","@Tabernita con lo achuchables que me parecían a mí los pingus y las focas y ya me lo has arruinado pa siempre. :(","twitter.com/Rocigaot/status/546766165423702016"
"21/12/2014 21:25:09","1","546763322058899457","","@Tabernita @El__Yayo porque mi gafe desafía toda ley estadística,y si compro un número para otro y para mí no, cae el Gordo fijo. XD","twitter.com/Rocigaot/status/546763322058899457"
"21/12/2014 21:24:43","","546763215393542145","","@Tabernita @El__Yayo yo sólo juego el Gordo y porque siempre me encargan algún décimo mis amigos de fuera y acabo comprando pa mí también","twitter.com/Rocigaot/status/546763215393542145"
"21/12/2014 21:23:53","","546763004231319552","1","@CadenaPeco @El__Yayo mi mejor año fue 2012,que jugaba sólo un décimo que me habían regalado y me tocó el reintegro.","twitter.com/Rocigaot/status/546763004231319552"
"21/12/2014 21:18:09","1","546761563160711169","","@El__Yayo @Tabernita en la administración de mi calle tocó el segundo hace años,pero nosotros teníamos otro, así que na: :P","twitter.com/Rocigaot/status/546761563160711169"
"21/12/2014 21:13:07","","546760293800763392","","@zezenzuska @SnowFey yo tenía un par de colegas que se presentaron al casting para la segunda edición,pero no los cogieron. XD","twitter.com/Rocigaot/status/546760293800763392"
"21/12/2014 21:05:37","","546758409648087040","","@zezenzuska @SnowFey yo empecé viéndolo a regañadientes porque lo ponían mis compis de piso y al final me enganché.","twitter.com/Rocigaot/status/546758409648087040"
"21/12/2014 21:03:45","","546757938631954432","","@SnowFey @zezenzuska a mí la 1ªme pilló en Salamanca. Salieron un día por allí el Nacho y Vanessa la del jódete y casi los linchan. XD","twitter.com/Rocigaot/status/546757938631954432"
"21/12/2014 20:52:00","1","546754982159323136","","@SnowFey @zezenzuska yo me vi las primeras ediciones, allá en el pleistoceno.Creo que la última que vi fue en la que estaba la Aída.","twitter.com/Rocigaot/status/546754982159323136"
"21/12/2014 20:46:02","1","546753480439123970","","Una cosa rebonica del FB es cuando ves que alguno de los súper alternativos con los que estudiaste en los 90 digievolucionó a Antonio Recio.","twitter.com/Rocigaot/status/546753480439123970"
"21/12/2014 13:42:24","1","546646870291148800","","@chsellespic.twitter.com/i0FX9KNh0w","twitter.com/Rocigaot/status/546646870291148800"
"21/12/2014 12:40:00","2","546631167488057345","","Hoy el cielo tiene un color raro (está azul), no cae agua y hay una especie de bola brillante. ¿A que era este año lo del apocalipsis maya?","twitter.com/Rocigaot/status/546631167488057345"
"20/12/2014 12:25:23","2","546265098307010560","","@Srta_Angus @Marmota_Maligna @laMascota en esta tocó una boda de mentirijillas en un festival y otra de un tunero que lloraba todo el rato","twitter.com/Rocigaot/status/546265098307010560"
"20/12/2014 12:19:15","2","546263557776891904","","@Marmota_Maligna @laMascota lo suyo es verlo con un par de cervezas para encontrarle más gracia, pero no tan tajada para no enterarte. XD","twitter.com/Rocigaot/status/546263557776891904"
"19/12/2014 16:23:00","4","545962508918743040","","Yoani tras ser informada de por qué los huevos vienen sucios. Recreación.pic.twitter.com/z85FU8StTd","twitter.com/Rocigaot/status/545962508918743040"
"19/12/2014 15:52:30","5","545954834768494592","2","El día que Yoani descubra por dónde salen los huevos colapsa.https://twitter.com/yoanisanchez/status/533451837123592192 …#Cuba Cada vez los huevos vienen más sucios al mercado... se aprovechan de la necesidad y el desabastecimiento :-( pic.twitter.com/qNio1G7jcx","twitter.com/Rocigaot/status/545954834768494592"
"19/12/2014 15:39:21","3","545951525986902016","","Dos horas dando vueltas y ni un sitio para aparcar. A tomar por culo, aquí se queda.pic.twitter.com/nAsCkqoNV2","twitter.com/Rocigaot/status/545951525986902016"
"19/12/2014 15:36:53","1","545950906039427072","","¿Y cuánto dices que hacía que no actualizabas las rutas del tomtom?pic.twitter.com/tck4ZnUCWK","twitter.com/Rocigaot/status/545950906039427072"
"19/12/2014 15:12:55","","545944874483470336","","'El Mundo' ahora descubre que algún detenido por 'terrorismo anarquista' tiene cocina de butano en casa y ya tiene portada pa seis meses.","twitter.com/Rocigaot/status/545944874483470336"
"19/12/2014 15:10:26","2","545944246814248960","","A ver si el ataque a Génova ha pasado justo ahora porque ya no tienen al Pequeño Nicolás para gestionarles los temas de seguridad.","twitter.com/Rocigaot/status/545944246814248960"
"19/12/2014 15:07:00","","545943383479705600","","Igual mañana el ABC habla del Comando Teruel de Resistencia Galega, ojo.","twitter.com/Rocigaot/status/545943383479705600"
"19/12/2014 14:58:18","3","545941196166922240","1","Yo sigo pensando que el que se estampó en Génova igual era un nuevo afiliado intentando adaptarse a las costumbres del partido.","twitter.com/Rocigaot/status/545941196166922240"
"19/12/2014 12:40:57","1","545906630811189249","","@Multimaniaco @perradesatan hasta en el terrorismo tienes que hacerte autónomo ahora.","twitter.com/Rocigaot/status/545906630811189249"
"19/12/2014 12:26:32","","545903002369130496","3","Menos mal que en casa tengo calentador eléctrico,que con un par de chistes en twitter y una bombona igual me aplicaban ley antiterrorista.","twitter.com/Rocigaot/status/545903002369130496"
"19/12/2014 12:23:38","1","545902271968845824","","Igual el que se estampó en Génova iba a afiliarse al partido y entró así para imitar sus costumbres e integrarse.","twitter.com/Rocigaot/status/545902271968845824"
"19/12/2014 0:33:42","1","545723611894775809","","Hai alguén de producción de #Casamos ocupado en repartir aquarius pra que non se lles deshidrate ningún de tanto chorar. Sobre todo o noivo.","twitter.com/Rocigaot/status/545723611894775809"
"19/12/2014 0:29:05","","545722447375642624","","@Marmota_Maligna no me fijé, igual me pilló tuiteando o en el baño, A ver si vuelve a hablar y me fijo.","twitter.com/Rocigaot/status/545722447375642624"
"19/12/2014 0:28:22","2","545722269725913088","","Basta xa de coreografías cos colegas e fotomontaxes coas fotos dos noivos dende bebés.Rematemos con esta lacra. #CuartoMilenio","twitter.com/Rocigaot/status/545722269725913088"
"19/12/2014 0:19:30","","545720037022392320","","'Xa que che gustan as aventuras de riesgo'. Se fai un rato dicían que só saen cando hai feiras medievais! #casamos","twitter.com/Rocigaot/status/545720037022392320"
"19/12/2014 0:17:48","2","545719609803177985","1","@SoniniSumode si el presidente de la Xunta de Galicia puede hablar gallego inventao, tú también. XD","twitter.com/Rocigaot/status/545719609803177985"
"19/12/2014 0:17:01","1","545719410619846656","","@SoniniSumode perra, perro es can.","twitter.com/Rocigaot/status/545719410619846656"
"19/12/2014 0:14:22","","545718745977864195","","É coma cando Monica Geller quería facer chorar á xente máis que Ross nas bodas de ouro dos pais falando da avoa e a cadela morta.","twitter.com/Rocigaot/status/545718745977864195"
"19/12/2014 0:12:43","3","545718331115057152","1","A noiva vaille dedicar á irmá unha canción que lle lembre á avoa morta,non sexa que pasen 3minutos de voda sen que algúen chore. #Casamos","twitter.com/Rocigaot/status/545718331115057152"
"19/12/2014 0:08:51","","545717358044905474","","@Marmota_Maligna huy, no te queda ná!","twitter.com/Rocigaot/status/545717358044905474"
"18/12/2014 23:55:29","","545713992686387201","","@Marmota_Maligna ya estás con la segunda boda? Espera a llegar al momento tunning!","twitter.com/Rocigaot/status/545713992686387201"
"18/12/2014 23:42:38","1","545710757498060800","1","A todo isto, poñerse corbata pra saír por Santa Comba non é acicalarse un pouco de máis? #Casamos","twitter.com/Rocigaot/status/545710757498060800"
"18/12/2014 23:40:26","1","545710206962114560","","@mvizaguirre quero a esta tía escribindo os reportaxes de trucos pra ligar da Super Pop. Ou o que exista agora.","twitter.com/Rocigaot/status/545710206962114560"
"18/12/2014 23:39:33","2","545709985184092160","","@Cascarelo 'como el non se decidía agarreino da corbata e leveino por todo Santa Comba'. Seducción científica.","twitter.com/Rocigaot/status/545709985184092160"
"18/12/2014 23:17:32","1","545704442650443776","","@Cascarelo pois imaxina se es invitado, cada ano invitación e a soltar regalo. :P","twitter.com/Rocigaot/status/545704442650443776"
"18/12/2014 23:13:44","2","545703487108304897","","Por qué as sorpresas en 'Casamos' son sempre cousas tipo montar a cabalo, karts, puenting...nas que podes partirte a crisma antes da voda?","twitter.com/Rocigaot/status/545703487108304897"
"18/12/2014 22:53:47","","545698466476085248","","@Hominidio tamén é certo.","twitter.com/Rocigaot/status/545698466476085248"
"18/12/2014 22:51:54","","545697992859463680","","@Hominidio @Cascarelo @MillaresRoo calqueira día me replica un invitado de Friker pra dicirme que os polstergeist da súa casa son de verdade","twitter.com/Rocigaot/status/545697992859463680"
"18/12/2014 22:49:47","","545697460736520193","","@Hominidio @Cascarelo @MillaresRoo xa o contei mil veces,pero unha vez unha noiva fixo replies indignados a todos os que comentaramos.","twitter.com/Rocigaot/status/545697460736520193"
"18/12/2014 22:48:15","","545697071899348992","","@Marmota_Maligna @laMascota pues sí, lleva un poco de retraso.","twitter.com/Rocigaot/status/545697071899348992"
"18/12/2014 22:46:16","","545696573527973888","","@Cascarelo seica é algo que fan no festival Galicia Woodstock que acabo de descubrir que existe.","twitter.com/Rocigaot/status/545696573527973888"
"18/12/2014 22:45:35","","545696400785563648","","@Hominidio ptsé, a min mólanme máis cando é bodorrio pola igrexa con vals das mariposas e noiva cantando ao noivo 'hasta mi final' no altar.","twitter.com/Rocigaot/status/545696400785563648"
"18/12/2014 22:44:55","","545696234863079424","","@Marmota_Maligna @laMascota aún no empezó en la web?","twitter.com/Rocigaot/status/545696234863079424"
"18/12/2014 22:42:46","","545695692522807300","","Hoy en #bodastróspidas hay dos que estudian en Santiago y se 'casan' con una boda hippy en un festival. @Marmota_Maligna @laMascota","twitter.com/Rocigaot/status/545695692522807300"
"18/12/2014 20:38:06","1","545664320596897793","1","@PotiPotiInLove @NewIlluminatus y pedirte competencias correspondientes a tres puestos de trabajo diferentes por 600 euros.","twitter.com/Rocigaot/status/545664320596897793"
"18/12/2014 20:19:20","","545659598708154368","","@Marmota_Maligna oye, a mí me ayuda. XD","twitter.com/Rocigaot/status/545659598708154368"
"18/12/2014 15:04:36","2","545580392112472064","","@Tawil a min faime un zasca así o CM do PP e non levanto cabeza en tres meses. :P","twitter.com/Rocigaot/status/545580392112472064"
"18/12/2014 13:47:45","","545561050448683008","1","Francisco Nicolás ha acabado Derecho ya? #PorraFiscal","twitter.com/Rocigaot/status/545561050448683008"
"18/12/2014 13:16:20","3","545553147557871616","","@NewIlluminatus @Tawil a mí me pasó en un restaurante,y mi amiga esperó al postre para avisar a los camareros porque le daba palo molestar.","twitter.com/Rocigaot/status/545553147557871616"
"17/12/2014 15:07:56","1","545218843363528705","","@Tawil pero na súa casa non os vemos. Hai que facer a Conde Roa alcalde honorífico navideño.Ou poñelo a sustituir ao jesusito do Obradoiro.","twitter.com/Rocigaot/status/545218843363528705"
"17/12/2014 15:05:22","1","545218195272249344","","@Tawil o nadal compostelán non é o mesmo agora que non tedes a Conde Roa bailando con mama noel e o burro. :(","twitter.com/Rocigaot/status/545218195272249344"
