"date","fav","id","rt","text","url"
"12/10/2014 13:39:32","1","521263897828147201","","@eleptric hay algún edificio emblemático o monumento cerca?Igual se está haciendo la típica foto a lo 'sujetando la torre de Pisa'.","twitter.com/Rocigaot/status/521263897828147201"
"12/10/2014 13:31:23","1","521261845278363648","2","@morganaskwlkr 'señoría, el jaguar estaba ahí porque hice pensamiento positivo y me concentré en atraer jaguars a mi garaje'.","twitter.com/Rocigaot/status/521261845278363648"
"12/10/2014 13:24:53","1","521260212574257152","","'Lo de la foto es una preocupación primermundista'. Vamos,que mientras muera gente en África, los medios de  aquí que hagan lo que quieran.","twitter.com/Rocigaot/status/521260212574257152"
"12/10/2014 13:22:08","2","521259519608111104","","Espérate, que ahora si criticamos la publicación de fotos de Teresa también estamos despreocupándonos de los enfermos de ébola en África.","twitter.com/Rocigaot/status/521259519608111104"
"12/10/2014 13:09:10","","521256253818150912","","Niño hipster.https://twitter.com/272BookFaith/status/514079989407711233 …Book review by my 6 year old (a misunderstanding of the availability of multiple copies?) @Booktrust @7Stories #read pic.twitter.com/swYFPPEOGa","twitter.com/Rocigaot/status/521256253818150912"
"10/10/2014 21:17:29","","520654370397253632","","@Tabernita ya debe de ser difícil de encontrar, es de Primark también pero la copré hace más de un año... a que mola?","twitter.com/Rocigaot/status/520654370397253632"
"10/10/2014 21:00:00","1","520649969607651328","","@Tabernita taza de bob+taza de brian. Mi futuro ajuar.pic.twitter.com/quV3UgexiP","twitter.com/Rocigaot/status/520649969607651328"
"10/10/2014 20:56:24","","520649063243730944","","@Tabernita sííí, del Primark, creo recordar!","twitter.com/Rocigaot/status/520649063243730944"
"10/10/2014 20:54:55","1","520648689086652416","","@Tabernita sí, de hecho en mi cabeza estaba viendo a Pocoyó pero no sé por qué puse Bob Esponja (igual porque estoy usando mi taza de Bob)","twitter.com/Rocigaot/status/520648689086652416"
"10/10/2014 20:53:19","1","520648286446055425","","@Tabernita Soraya le ha puesto en la tablet unos capítulos de Bob Esponja.","twitter.com/Rocigaot/status/520648286446055425"
"10/10/2014 20:48:58","4","520647192743534592","1","A Ana Mato le han dejado un bloc cuadriculado y unos plastidecores para que esté entretenida mientras pasa lo del ébola.","twitter.com/Rocigaot/status/520647192743534592"
"10/10/2014 20:15:04","","520638663248871424","","@familiasunshine @Multimaniaco yo con mis manitas de niño pequeño lo tengo chungo si no me dejan un machete o algo :(","twitter.com/Rocigaot/status/520638663248871424"
"10/10/2014 16:42:44","","520585225806811136","1","Decíamos de Mariló, pero la tipa esta de TeleCospe es para hacerle tragar todos los guantes usados del Carlos III  https://www.youtube.com/watch?v=D2UOqdXYcjs …","twitter.com/Rocigaot/status/520585225806811136"
"10/10/2014 16:25:07","","520580793039851521","","@missultrasonica ay, acabo de escupir el café en aspersor cual Rajoy diciendo Schwarzenegger!","twitter.com/Rocigaot/status/520580793039851521"
"10/10/2014 16:22:37","1","520580164837974016","","@missultrasonica La B12? Ladillas?Pelea de borrachos?","twitter.com/Rocigaot/status/520580164837974016"
"10/10/2014 15:48:20","1","520571533845348352","","@ComandanteVimes @Srta_Angus lo peor es que lo estaba leyendo y estaba teniendo cada déjà vu...","twitter.com/Rocigaot/status/520571533845348352"
"10/10/2014 15:13:39","","520562809273602049","","@mjdelrio @undivaga @El__Yayo es su gemelo malvado, como en los culebrones.","twitter.com/Rocigaot/status/520562809273602049"
"10/10/2014 14:45:58","2","520555838801715200","","Espera, que dice Soraya que cómo perdemos el tiempo pidiendo responsabilidades políticas con vidas en juego.Pues por eso, gilipollas.","twitter.com/Rocigaot/status/520555838801715200"
"10/10/2014 14:43:49","3","520555300034977792","7","No sé ha sido buena idea llevar de visita a donde el ébola a un fulano que cuando pronuncia la S ducha por aspersión a cualquiera a 10metros","twitter.com/Rocigaot/status/520555300034977792"
"10/10/2014 14:41:31","","520554722655494144","2","@ComandanteVimes y @Srta_Angus , creo que los de El Mundo Today nos leen. :P  http://www.elmundotoday.com/2014/10/el-jefe-suelta-una-charla-motivacional-pero-es-la-cocaina-la-que-habla/ …","twitter.com/Rocigaot/status/520554722655494144"
"10/10/2014 14:35:38","","520553240694624256","1","En el gabinete de crisis por lo del ébola nos han metido a un ministro que dice que se le apareció la Virgen. Yo ya.","twitter.com/Rocigaot/status/520553240694624256"
"10/10/2014 13:43:15","","520540057284128768","1","¿En el telediario de TVE han hablado ya de E.B.O.L.A.?","twitter.com/Rocigaot/status/520540057284128768"
"10/10/2014 13:16:44","","520533386256195584","","@ChacheNaguer @ComandanteVimes y la mujer que murió de neumonía en Argentina sin conseguir que la repatriaran.","twitter.com/Rocigaot/status/520533386256195584"
"10/10/2014 12:56:14","2","520528226125619200","4","Que dice el PP con todo el morro que seguirán repatriando enfermos de ébola porque 'no vamos a dejar a ningún español a su suerte'.No,apenas","twitter.com/Rocigaot/status/520528226125619200"
"10/10/2014 12:47:15","","520525962816274432","","@DeClaseBaja @Marmota_Maligna has empezado tú! :D","twitter.com/Rocigaot/status/520525962816274432"
"10/10/2014 12:46:26","3","520525759170220033","3","@DeClaseBaja @Marmota_Maligna podemos mejor escupirles?A ver si luego es gripe y tienes que vivir con lo de haber besado a Pujalte.","twitter.com/Rocigaot/status/520525759170220033"
"10/10/2014 12:44:19","","520525224899780609","","Tranquilidad, que seguro que los de El País tomaron todas las precauciones antes de colarse en el Carlos III. Vieron el tutorial de Mariló.","twitter.com/Rocigaot/status/520525224899780609"
"10/10/2014 12:28:42","2","520521295776477185","","@Srta_Angus entendiéndose 'rendir más' como echarle horas y horas aunque estés desquiciado e intratable.","twitter.com/Rocigaot/status/520521295776477185"
"10/10/2014 12:28:18","2","520521195821998080","","@Srta_Angus a mí con la coca lo que más me flipa es como está normalizado en según qué sectores usarla para 'rendir más'.","twitter.com/Rocigaot/status/520521195821998080"
"10/10/2014 12:25:19","","520520446035623936","","@Srta_Angus no sé si alguien ha hecho un estudio de cómo afectó al sector farlopa la crisis de los periódicos y de la construcción, pero...","twitter.com/Rocigaot/status/520520446035623936"
"10/10/2014 12:19:56","4","520519090503688194","7","Con el tratamiento que están dando al caso del ébola, yo las reuniones de contenidos de muchos medios las imagino asípic.twitter.com/x7SwYlrw5j","twitter.com/Rocigaot/status/520519090503688194"
"10/10/2014 12:18:05","1","520518623043915776","","@ComandanteVimes Se les va. Yo no sé en qué rapto cocaínico de la reunión de contenidos del periódico surgió esta idea de bombero.","twitter.com/Rocigaot/status/520518623043915776"
"10/10/2014 12:15:39","","520518012131364864","","@ComandanteVimes al parecer a donde está Teresa no, pero sí a la 5,la destinada a los paciente en obervación. http://politica.elpais.com/politica/2014/10/09/actualidad/1412886024_598202.html …","twitter.com/Rocigaot/status/520518012131364864"
"10/10/2014 12:10:46","1","520516781858095104","","@Tabernita igual les tocaba guardia este finde, y se lo han inventado a ver si se lo dan libre por si contagian.","twitter.com/Rocigaot/status/520516781858095104"
"10/10/2014 12:08:48","1","520516288377290753","4","Decidme que no es verdad que dos gilipollas de El País se han colado en la planta donde están Teresa y los posibles contagiados.","twitter.com/Rocigaot/status/520516288377290753"
"10/10/2014 2:26:26","1","520369731648245760","1","Mariló hace la demostración de lo fácil que es quitarse los guantes y le falta enganchar la parte de los dedos con los dientes y tirar.","twitter.com/Rocigaot/status/520369731648245760"
"10/10/2014 1:47:24","1","520359906357284865","","@Tabernita @dodavazquez eso no era una araña, era casi un centollo.","twitter.com/Rocigaot/status/520359906357284865"
"10/10/2014 1:46:16","","520359621689872384","","@dodavazquez @Tabernita ay, sí,también. Me queréis provocar pesadillas entre todos.","twitter.com/Rocigaot/status/520359621689872384"
"10/10/2014 1:40:54","","520358272789118976","","@Tabernita que en lo de Marhuendis no me mencionaron ni nada,pero salió en mi TL cuando me planteaba ir a dormir,y cualquiera pega ojo ahora","twitter.com/Rocigaot/status/520358272789118976"
"10/10/2014 1:39:23","3","520357891455582208","1","'El consejero de Sanidad es una distracción para olvidéis a Ana Mato'. ¿Ahora en lo de odiar también hay que ser monógamo?","twitter.com/Rocigaot/status/520357891455582208"
"10/10/2014 1:34:50","","520356745978576896","","Hace dos noches tocó multimención de cucarachas,ayer @Tabernita me puso la foto de una escalopendra y hoy veo estohttps://twitter.com/gerardotc/status/520356225926840320 …Buenas noches. Que soñéis con los angelitos: pic.twitter.com/fLqS99AOqb","twitter.com/Rocigaot/status/520356745978576896"
"10/10/2014 0:49:36","","520345363572854784","","@ResistenciaGZ podían mandar á lexión tamén, que igual a cabra tiña algo de sentido.","twitter.com/Rocigaot/status/520345363572854784"
"10/10/2014 0:20:08","2","520337945531011073","","@Sunamitatheone @Lasti_ no tiene por qué estar relacionado.Mucha gente (con o sin VPH) tiene abortos espontáneos,pero como se habla poco...","twitter.com/Rocigaot/status/520337945531011073"
"10/10/2014 0:12:57","","520336138775830528","","@Lasti_ a una amiga le pasó con un aborto espontáneo. Desde que le pasó y lo contó, todo era 'sí, yo tuve uno antes de tener al niño'.","twitter.com/Rocigaot/status/520336138775830528"
"10/10/2014 0:09:17","1","520335216125431808","1","@Lasti_ a mí me pasó,a mí me hicieron conización y cuando lo dije resultó que conocía como a 5personas más que se habían operado.","twitter.com/Rocigaot/status/520335216125431808"
"10/10/2014 0:08:17","","520334964936937472","","@PotiPotiInLove yo diría juntarlo el mismo día, que hay gente que tiene que viajar y si no es un lío.","twitter.com/Rocigaot/status/520334964936937472"
"9/10/2014 23:36:10","1","520326883469430784","","A según qué directores de medios de comunicación no los podríamos eutanasiar también porsiaca, que se ve que no podemos gestionar su mierda?","twitter.com/Rocigaot/status/520326883469430784"
"9/10/2014 23:27:59","","520324822363275265","","@dejamehablarr @PotiPotiInLove '¿gordi?' 'churri?'¿pocholín?''¿cuqui?'","twitter.com/Rocigaot/status/520324822363275265"
"9/10/2014 23:27:06","","520324599985098752","","@PotiPotiInLove te juro que hasta que encontró al novio en la puerta yo pensé que había perdido al perro por la tienda.","twitter.com/Rocigaot/status/520324599985098752"
"9/10/2014 23:26:02","4","520324330585346048","3","@PotiPotiInLove yo una vez vi a una pija buscando a su novio por una tienda al grito de '¿Ositooo? ¿Dónde estás, osito?'. En serio.","twitter.com/Rocigaot/status/520324330585346048"
"9/10/2014 23:21:55","","520323294583468032","1","@PotiPotiInLove Y si además de usarlo entre vosotros lo usáis para hablar de vuestra pareja a la gente,rollo 'mi cari y yo de cañitas', peor","twitter.com/Rocigaot/status/520323294583468032"
"9/10/2014 22:54:43","9","520316451157446656","4","@MargaretCastor estamos diciendo tantos que nos vamos a disfrazar de Ana Mato que para maquillarnos vamos a agotar el stock de riskettos.","twitter.com/Rocigaot/status/520316451157446656"
"9/10/2014 21:47:38","","520299570048557057","","@morganaskwlkr ...seguía en caché, y un rato después ha aparecido publicada de nuevo. La enlacé, no sé si aún sigue.","twitter.com/Rocigaot/status/520299570048557057"
"9/10/2014 21:47:13","","520299464473726976","","@morganaskwlkr subieron 1noticia diciendo que había  muerto la enfermera, la borraron y dijeron que es falso que se había subido, aunque...","twitter.com/Rocigaot/status/520299464473726976"
"9/10/2014 21:38:23","8","520297242117545985","10","El CM de la COPE tiene un plan para arreglar la cagada de la noticia que nunca subieron pero se ha publicado otra vezpic.twitter.com/zKF17mz0gK","twitter.com/Rocigaot/status/520297242117545985"
"9/10/2014 21:33:44","","520296071424376833","","Le vi lo de la COPE a @soydelbierzo, hace 10 segundos lo he compartido en un comentario de FB y aún va. Pero aún volverán a negarlo.","twitter.com/Rocigaot/status/520296071424376833"
"9/10/2014 21:28:37","1","520294781193580545","","@dejamehablarr y espérate, que aún volverán a decir que ellos no publicaron nada. Esto es un caso para Friker.","twitter.com/Rocigaot/status/520294781193580545"
"9/10/2014 21:28:09","1","520294667435671552","","¿Estarán intentando borrar el rastro a base de pulsar botones al azar y le habrán dado a 'publicar de nuevo'? ¿Lo negarán otra vez?","twitter.com/Rocigaot/status/520294667435671552"
"9/10/2014 21:25:11","1","520293919914205184","4","Pues ha vuelto a no publicarse ninguna noticia sobre la muerte de la enfermera en la web de la COPE, qué cosas. http://www.cope.es/detalle/muere-la-auxiliar-de-enfermeria-afectada-por-el-ebola.html …","twitter.com/Rocigaot/status/520293919914205184"
"9/10/2014 20:10:02","","520275008409829376","","Igual la Cope necesitaba casito, que con ZP eran los líderes de la mongocaverna mediática y ahora las TDT, La Razón y ABC le hacen sombra.","twitter.com/Rocigaot/status/520275008409829376"
"9/10/2014 20:03:46","","520273429401206786","","@Ptraci @Multimaniaco yo creo que sí.Podemos probar también una traqueotomía,que como vi hacerlas en Anatomía de Grey, malo será.","twitter.com/Rocigaot/status/520273429401206786"
"9/10/2014 20:01:13","1","520272789316849664","","Escriben la noticia de la muerte de Teresa para ser los primeros si pasa, la publican por error, borran y lo niegan. A tope con la COPE.","twitter.com/Rocigaot/status/520272789316849664"
"9/10/2014 19:37:49","2","520266898328780800","","@Multimaniaco me ofrezco a meterle yo el tubo. No soy médica ni enfermera,pero como tampoco hará falta un master,pruebo a ver.","twitter.com/Rocigaot/status/520266898328780800"
"9/10/2014 16:38:12","1","520221696457195520","","Yo a Mariló también iría a toserle un poquito si tuviera ébola. Y por qué será que me da a mí que buena parte de su equipo también lo haría.","twitter.com/Rocigaot/status/520221696457195520"
"9/10/2014 15:58:50","","520211790601670656","","Que igual es una opción que luego no funciona, pero oye, como aquí las cosas se hacen porsiaca e improvisando,yo aporto al brainstorming.","twitter.com/Rocigaot/status/520211790601670656"
"9/10/2014 15:58:04","2","520211598301233152","","Yo vuelvo a recordar que aún no hemos probado sacrificando carguitos de Sanidad a los dioses a ver si no nos mandan ébola,y oye, es 1opción","twitter.com/Rocigaot/status/520211598301233152"
"9/10/2014 15:52:10","","520210110464163840","","A algún centro de salud le va a llegar el kit contra el ébola en una bolsa del Lidl junto a unos yogures y un hueso para hacer caldo.","twitter.com/Rocigaot/status/520210110464163840"
"9/10/2014 15:12:58","","520200248061595648","","@PotiPotiInLove igual piensan que Roquefort es catalán y lo castellanizan para que se joda, como con Arturo Más.","twitter.com/Rocigaot/status/520200248061595648"
"9/10/2014 14:59:05","","520196751513628672","","@PotiPotiInLove escribieron un alegato el otro día de que si siempre escribe lo mismo y que no puede ser que no tengan Nobel Roth y Pynchon","twitter.com/Rocigaot/status/520196751513628672"
"9/10/2014 14:52:31","1","520195100887220226","","@PotiPotiInLove yo quería que se lo dieran para que llorasen los de la Jodaun.","twitter.com/Rocigaot/status/520195100887220226"
"9/10/2014 14:41:50","","520192413202411520","","@crow_ley @zezenzuska tú al nascithummus le echas cominos o pimentón?","twitter.com/Rocigaot/status/520192413202411520"
"9/10/2014 14:22:06","","520187447544922112","","@ComandanteVimes lo malo es que no creo que la UNED acepte costearme el vodka como gasto de investigación.","twitter.com/Rocigaot/status/520187447544922112"
"9/10/2014 13:56:33","","520181017140011008","","@ComandanteVimes con el TFG es más improbable que con el 'chupito por cada negritos', pero tal vez no imposible. Veré cuando lo empiece. :P","twitter.com/Rocigaot/status/520181017140011008"
"9/10/2014 13:47:57","","520178850865897473","","@ComandanteVimes estoy entre eso y un chupito por cada 'preocuparos de los negritos', y el TFG es más improbable que acabe en cirrosis.","twitter.com/Rocigaot/status/520178850865897473"
"9/10/2014 13:43:50","1","520177814990233600","","Si al final me dan la línea de TFG en postcoloniales, creo que con todos los 'salvad a los negritos' que estoy leyendo lo tengo resuelto.","twitter.com/Rocigaot/status/520177814990233600"
"9/10/2014 13:43:03","","520177619271417856","","Pues gracias a lo del perro algunos se están acordando HOY de que existe MSF y están explicándonos dónde donar 'para los negritos'.","twitter.com/Rocigaot/status/520177619271417856"
"9/10/2014 13:31:08","3","520174618838315008","3","'África os la suda', pero a los curas había que sacarlos porque no se puede morir dignamente si estás rodeado de negros. Ajá.","twitter.com/Rocigaot/status/520174618838315008"
"9/10/2014 13:07:23","1","520168644735938561","","Yo lo mandaba a limpiar diarreas de los infectados. Y que aprendiera a quitarse el traje en un tutorial de Youtube. http://www.eldiario.es/sociedad/consejero-Sanidad-Madrid-insiste-informacion_0_311818927.html …","twitter.com/Rocigaot/status/520168644735938561"
"9/10/2014 2:40:03","1","520010770222825472","","'Cuentan que el primer doctor...' ¿Cuentan? ¿Quién, los ancianos del lugar?Si ni han puesto bien el nombre del médico, joder...","twitter.com/Rocigaot/status/520010770222825472"
"9/10/2014 2:24:59","","520006978043920384","","@PotiPotiInLove @arartekosa lo que sea, cualquier excusa a la desesperada antes de admitir que fue a mí a quien hicieron ese ZAS.","twitter.com/Rocigaot/status/520006978043920384"
"9/10/2014 2:23:58","2","520006724221431808","","@arartekosa @PotiPotiInLove yo si me hiciera un ZAS uno de UPyD creo que intentaría usar la excusa de 'me han hackeado la cuenta,no era yo'","twitter.com/Rocigaot/status/520006724221431808"
"9/10/2014 2:22:04","","520006244921540608","","@PotiPotiInLove puedo desactivar tus RT, como hice con masaenfurecida.","twitter.com/Rocigaot/status/520006244921540608"
"9/10/2014 2:20:50","","520005934060691457","","@PotiPotiInLove @LatveriasDoom @fred_SSC Está casi al nivel de JimmyPokemon, la energía nuclear, los rojos y el sol.","twitter.com/Rocigaot/status/520005934060691457"
"9/10/2014 2:18:11","1","520005265685749760","","@LatveriasDoom Ay la hostia, que no conocía yo ese tuit. Es ser muy tonto hasta para ser Sigfrid.","twitter.com/Rocigaot/status/520005265685749760"
"9/10/2014 2:12:34","","520003852431794176","","@PotiPotiInLove por qué lo he visto, gensanta, con lo feliz que vivo yo teniéndolo silenciado?","twitter.com/Rocigaot/status/520003852431794176"
"9/10/2014 1:40:30","","519995784990056448","","@Tabernita yo creo que quemo la casa. :P","twitter.com/Rocigaot/status/519995784990056448"
"9/10/2014 1:36:44","","519994836028772352","","@Tabernita lo sé, lo sé. Me pica todo sólo de ver la foto.","twitter.com/Rocigaot/status/519994836028772352"
"9/10/2014 1:34:45","1","519994334914281473","","@Tabernita agggg! Da casi tanto asco como Marhuenda!","twitter.com/Rocigaot/status/519994334914281473"
"9/10/2014 1:31:49","2","519993596779692032","","¿Sigue vigente lo de arrestar sólo a los twitteros con muchos followers si enaltecen la violencia? Es pa una cosa sobre Marhuenda y Rubido.","twitter.com/Rocigaot/status/519993596779692032"
"9/10/2014 1:29:47","","519993086882373633","","@Tabernita hasta la de un ciempiés prefiero, y no hay bicho que más asco me dé.","twitter.com/Rocigaot/status/519993086882373633"
"9/10/2014 1:18:31","","519990249876107264","","@gmit3 lo peor es que les sale prácticamente gratis.Como mucho una indemnización si el calumniado denuncia que suele cubrirse con las ventas","twitter.com/Rocigaot/status/519990249876107264"
"9/10/2014 1:10:00","","519988106343505920","","Que mira que a estas alturas ya debería estar acostumbrada, pero nada, que nunca deja de maravillarme lo miserables que pueden ser.","twitter.com/Rocigaot/status/519988106343505920"
"9/10/2014 1:07:26","5","519987463889387520","2","En este preciso momento valoro más la vida de un perro que la de quien decidió la portada de ABC, qué queréis.Y la vida de un ficus también.","twitter.com/Rocigaot/status/519987463889387520"
"9/10/2014 1:00:12","1","519985643104264192","","El asco que me están dando el ABC y compañía me va a matar mucho antes que el ébola.","twitter.com/Rocigaot/status/519985643104264192"
"8/10/2014 23:20:13","1","519960480375656448","","@mcalpena @LumpenPerro Cebolla Confetada #CocinaconFetos","twitter.com/Rocigaot/status/519960480375656448"
"8/10/2014 23:05:03","2","519956662098989057","1","@laMascota no digas en Madrid que en twitter eres 'la mascota', que aún te eutanasian!","twitter.com/Rocigaot/status/519956662098989057"
"8/10/2014 23:04:19","","519956477335724034","","@alitecarlito Eh, panda de odianegros locos de los perros, firmad aquí->Me han mandado a la mierda, si es que odian a la gente.","twitter.com/Rocigaot/status/519956477335724034"
"8/10/2014 22:24:25","","519946437707436032","1","@FriKitty @adiplotti CON ESTE PRECIO ES DELITO IR SIN PIERNA, SEÑORA!","twitter.com/Rocigaot/status/519946437707436032"
"8/10/2014 22:20:42","1","519945501475872768","","@laMascota lo de Vox? a mí me parecían gambas!","twitter.com/Rocigaot/status/519945501475872768"
"8/10/2014 22:10:35","","519942956120567808","","@NewIlluminatus yo cuando me encabrono MUCHO por algo llego a tener dolores de cabeza y creo que me sube algo la fiebre y todo.","twitter.com/Rocigaot/status/519942956120567808"
"8/10/2014 21:59:15","","519940104274857985","","@echeoqhai @bestilheiro @Cascarelo a miña proposta: Mexi-Llón nos de 5, Pelegrín nos de 10, Xabarín nos de 20,Seguriño nos de 50.","twitter.com/Rocigaot/status/519940104274857985"
"8/10/2014 21:57:55","1","519939766943748096","","@AinaDiazV ah, pero, ¿entiende lo que dicen?","twitter.com/Rocigaot/status/519939766943748096"
"8/10/2014 21:56:49","","519939491986161665","","@bestilheiro @Cascarelo Pelegrín vai nalgún?","twitter.com/Rocigaot/status/519939491986161665"
"8/10/2014 21:51:22","","519938122130677760","","@Anyi_anonadada @noseagili les falta decir que se contagió a propósito por joder.","twitter.com/Rocigaot/status/519938122130677760"
"8/10/2014 21:33:08","7","519933531825643520","11","Entonces, Teresa tenía más de 38.6º y llamó  ELLA por iniciativa propia a La Paz para inventarse una temperatura más baja? Muy lógico todo.","twitter.com/Rocigaot/status/519933531825643520"
"8/10/2014 20:36:31","4","519919282608959490","2","@crow_ley creo que infectada de ébola sería la única situación en que podría entrar en 1ascensor con el alcalde de Pucela y quitarme la ropa","twitter.com/Rocigaot/status/519919282608959490"
"8/10/2014 20:22:57","1","519915869447913472","","@laMascota yo ya me estaba viendo que lo sacrificaban en un matadero y acababa en albóndigas del Ikea.","twitter.com/Rocigaot/status/519915869447913472"
"8/10/2014 20:17:45","1","519914559877165057","","Como ya os habéis pedido unos cuantos ir a escupir al Congreso si os pilláis el ébola, a mí reservadme la CEOE. #organización","twitter.com/Rocigaot/status/519914559877165057"
"8/10/2014 20:09:57","","519912596955492352","","@ComandanteVimes y a ver con qué apodo pasa a la historia el futuro Froilán I si tenemos guerra sucesoria. XD","twitter.com/Rocigaot/status/519912596955492352"
"8/10/2014 20:06:43","1","519911782094503936","","@ComandanteVimes Que igual tendría que ser Preparao I, ya que al parecer ninguno antes lo estaba, pero no liemos más el protocolo.","twitter.com/Rocigaot/status/519911782094503936"
"8/10/2014 20:03:52","","519911064973369345","","Acabo de ver que un tuit de antes me olvidé el palito de Preparao VI. Menos mal que soy pocosfollowers y no ha tenido muchos RT.","twitter.com/Rocigaot/status/519911064973369345"
"8/10/2014 19:40:38","1","519905218935660544","","@Srta_Angus a mí me pasó lo mismo ayer! Estaba entre eso y un Ebola Shore.","twitter.com/Rocigaot/status/519905218935660544"
"8/10/2014 19:25:59","1","519901533253947392","","Y ahora acusan a la enfermera de mentir. Aún dirán que se transfundió sangre del cura adrede para joder a Ana Mato.","twitter.com/Rocigaot/status/519901533253947392"
"8/10/2014 18:40:06","","519889987601711104","","'Os preocupa X pero no Y', y 'X es una cortina de humo para no hablar de Y'. Los tuits plantilla del cuñao.","twitter.com/Rocigaot/status/519889987601711104"
"8/10/2014 18:34:59","","519888698310406144","","Ni creo que debamos engañar a nadie, eh. Si se escoge para gobernar a inútiles, nos merecemos que se sepa.Y es el menor de los problemas.","twitter.com/Rocigaot/status/519888698310406144"
"8/10/2014 18:33:45","","519888390393954304","1","Que tampoco tengo yo muy claro que con tener un rey alto y que se defienda en inglés fuéramos a engañar a nadie, por otra parte.","twitter.com/Rocigaot/status/519888390393954304"
"8/10/2014 18:32:41","2","519888118707544064","2","Pero ahora que hemos despejado ya toda duda de que esto está en manos de incompetentes, igual podemos dejar el paripé y república ya (2).","twitter.com/Rocigaot/status/519888118707544064"
