"date","fav","id","rt","text","url"
"15/5/2016 13:38:29","1","731810982280957952","2","huy, conozco gente que puso pasta ahí en plan 'estoy ayudando a refundar el periodismo'.pic.twitter.com/mSZupgNtaP","twitter.com/Rocigaot/status/731810982280957952"
"15/5/2016 13:33:26","2","731809712799399936","9","Gente que puso pasta para El Español: Qué dinero más bien invertido, ¿eh?https://twitter.com/elespanolcom/status/731423578365661184 …Iglesias/Garzón, siete diferencias para elegir al más guapo http://www.elespanol.com/corazon/20160513/124487779_0.html … pic.twitter.com/OGtzpjfvKv","twitter.com/Rocigaot/status/731809712799399936"
"15/5/2016 13:12:17","1","731804392010203136","","si es que no somos lo bastante emprendedores y así nos va :P","twitter.com/Rocigaot/status/731804392010203136"
"15/5/2016 1:22:24","3","731625743759872001","1","yo a PDRO lo veo con la típica balada rancier, rollo el disco aquel de 'A ti, mujer' de  Antonio Hidalgo.","twitter.com/Rocigaot/status/731625743759872001"
"15/5/2016 1:18:18","2","731624709083795456","1","y si hay coalición pueden montar un dúo o una boyband!","twitter.com/Rocigaot/status/731624709083795456"
"15/5/2016 1:11:57","","731623112043843589","","mandárona a derrotar aos ingleses, coma a Xoana de Arco, non me digas máis!","twitter.com/Rocigaot/status/731623112043843589"
"15/5/2016 1:08:51","2","731622330477203456","","ay, sí, Conchita moló también y ya ni me acordaba de ella!","twitter.com/Rocigaot/status/731622330477203456"
"15/5/2016 1:05:56","4","731621596482392068","1","También no sé de qué me sorprendo, si la única vez que me alegré con un resultado de Eurovisión fue el año de Lordi.","twitter.com/Rocigaot/status/731621596482392068"
"15/5/2016 0:44:48","1","731616280063684608","","Lo de Ucrania ha sido un poco rollo el Oscar de Marisa Tomei #TROSPIDIVISION","twitter.com/Rocigaot/status/731616280063684608"
"15/5/2016 0:39:05","2","731614839349645312","","Esto ha sido un tongo como un castillo. #TROSPIDIVISION #Eurovision","twitter.com/Rocigaot/status/731614839349645312"
"15/5/2016 0:34:22","","731613652902674433","1","No me jodas que en televoto también quedó tan arriba el truño ucraniano que no me lo creo #TROSPIDIVISION","twitter.com/Rocigaot/status/731613652902674433"
"15/5/2016 0:10:40","2","731607688153550852","2","Pues oye, mejor mil veces que gane Australia al truño ucraniano que no me explico cómo va tan arriba. #Eurovision","twitter.com/Rocigaot/status/731607688153550852"
"14/5/2016 23:59:02","","731604760151883776","","El de los puntos de Malta es como el típico que se enrolla con su discurso de aceptación  del Oscar al mejor vestuario #TROSPIDIVISION","twitter.com/Rocigaot/status/731604760151883776"
"14/5/2016 23:55:41","","731603920959766528","","Ay, San Marino! Sigue existiendo! #TROSPIDVISION","twitter.com/Rocigaot/status/731603920959766528"
"14/5/2016 23:52:22","2","731603084334497793","","en mi caso con cerveza. Pero habrá insensatos que vean Eurovisión totalmente sobrios.","twitter.com/Rocigaot/status/731603084334497793"
"14/5/2016 23:34:35","3","731598609200893952","","Ojo, que eso a lo largo une, mira los países balcánicos como se votan siempre entre ellos. https://twitter.com/azucarkane/status/731592883816566785 …","twitter.com/Rocigaot/status/731598609200893952"
"14/5/2016 23:28:10","2","731596993747947520","","Eurovisión presentado por Gayoso. Eu digo SI.","twitter.com/Rocigaot/status/731596993747947520"
"14/5/2016 23:05:34","10","731591306032648193","4","PAVA,ME ESTABAS MIRANDO MAL?? A QUE TE METO! #TROSPIDVISIONpic.twitter.com/07vksH9lQk","twitter.com/Rocigaot/status/731591306032648193"
"14/5/2016 23:02:22","5","731590500130656258","2","Lo guay de la noche de Eurovisión es que es un sábado en que no tengo a medio TL hablando de la Sexta Noche.","twitter.com/Rocigaot/status/731590500130656258"
"14/5/2016 22:58:57","2","731589642831679488","","Pues na, yo este año voy con Armenia y con Serbia, que pa algo son del gremio #gofilólogas #Eurovision","twitter.com/Rocigaot/status/731589642831679488"
"14/5/2016 22:57:27","4","731589264107053063","2","Otra filóloga en Eurovisión, como la de Serbia! #insercionlaboral #TROSPIDVISION","twitter.com/Rocigaot/status/731589264107053063"
"14/5/2016 22:56:30","","731589023358169088","","hemos pensao lo mismo! XD","twitter.com/Rocigaot/status/731589023358169088"
"14/5/2016 22:55:05","1","731588667198844932","1","The British Gemeliers #TROSPIDVISION #Eurovision","twitter.com/Rocigaot/status/731588667198844932"
"14/5/2016 22:51:55","1","731587870620852232","1","La de Austria con ese vestido y esa canción es como cuando te vas pronto de una boda y tiras pa la discoteca con tus amigos #TROSPIDVISION","twitter.com/Rocigaot/status/731587870620852232"
"14/5/2016 22:46:46","3","731586573649727489","1","Los de Georgia actúan en Eurovisión irónicamente, claro está. #TROSPIDVISION #Eurovision","twitter.com/Rocigaot/status/731586573649727489"
"14/5/2016 22:38:08","3","731584402518605825","1","Lo de este año es Bajonavisión #TROSPIDVISION","twitter.com/Rocigaot/status/731584402518605825"
"14/5/2016 22:34:52","1","731583579956891649","","Claaaaaaroooo...","twitter.com/Rocigaot/status/731583579956891649"
"14/5/2016 22:31:30","4","731582735115014144","1","NO JODÁIS QUE SE HA CAÍDO Y ME LO HE PERDIDO POR ESTAR TUITEANDO #TROSPIDVISION  #Eurovision","twitter.com/Rocigaot/status/731582735115014144"
"14/5/2016 22:30:32","1","731582489534337026","2","A Barei no la han avisado de la hora y ha llegado con la camiseta de dormir y el moño de andar por casa. Eso es a mala leche #TROSPIDVISION","twitter.com/Rocigaot/status/731582489534337026"
"14/5/2016 22:28:57","6","731582090995728384","3","La española con una camiseta deportiva brilli brilli del Bershka. #TROSPIDVISION","twitter.com/Rocigaot/status/731582090995728384"
"14/5/2016 22:25:43","3","731581279557275649","1","La coreografía de los bailarines del ruso la estuvimos haciendo justo ayer en clase de zumba. #TROSPIDVISION","twitter.com/Rocigaot/status/731581279557275649"
"14/5/2016 22:21:59","1","731580338519064577","","¡Cambio de vestuario en el escenario! ¡chupito! #TROSPIDVISION #Eurovision","twitter.com/Rocigaot/status/731580338519064577"
"14/5/2016 22:21:19","","731580172516872192","","La croata se ha puesto una especie de collar bomba sobre el plástico ese y volará a todos por los aires si no le votan.#TROSPIDVISION","twitter.com/Rocigaot/status/731580172516872192"
"14/5/2016 22:08:52","","731577037211766787","","non perdiches gran cousa!","twitter.com/Rocigaot/status/731577037211766787"
"14/5/2016 21:59:35","2","731574700942430210","","todas petándole la pestaña de menciones a @Pozuelen raitnau XD","twitter.com/Rocigaot/status/731574700942430210"
"14/5/2016 21:58:08","5","731574335329173504","1","Ay, ahora va @Pozuelen por Polonia! #Eurovision","twitter.com/Rocigaot/status/731574335329173504"
"14/5/2016 21:47:17","","731571604241666049","","Qué perecita el viejoven sueco. Next. #Eurovision","twitter.com/Rocigaot/status/731571604241666049"
"14/5/2016 21:38:41","8","731569443688595457","4","El emo de Israel lleva el tupé de Trump pero en moreno. #TROSPIDVISION #eurovision","twitter.com/Rocigaot/status/731569443688595457"
"14/5/2016 21:34:38","21","731568421691920384","16","Sentido homenaje de Italia a todos los niños a los que tocó hacer de árbol en las funciones de teatro del cole. #trospidvision #eurovision","twitter.com/Rocigaot/status/731568421691920384"
"14/5/2016 21:26:02","1","731566256957063169","","Me he abierto una Estrella para ver #trospidvision y no sé por qué estaba casi sin espuma #xulioferreirodimisión","twitter.com/Rocigaot/status/731566256957063169"
"14/5/2016 16:21:58","2","731489738952192001","","Que también os digo que seguro que amortizo los dos impermeables, que ni que viviera una en Murcia.","twitter.com/Rocigaot/status/731489738952192001"
"14/5/2016 16:20:28","5","731489360118464513","","Tras Seis Meses Buscando Su Chubasquero Por Casa Se Rindió Y Se Compró Uno Nuevo Y No Creerás Qué Pasó A Continuación.","twitter.com/Rocigaot/status/731489360118464513"
"14/5/2016 13:39:31","","731448854671953920","","lo saqué del buscador de gifs del tuiter, poniendo evil laugh","twitter.com/Rocigaot/status/731448854671953920"
"14/5/2016 13:31:32","11","731446845852033024","8","yo voto por hacer un remake con prota femenina de La Jungla de Cristal.pic.twitter.com/aHmvNeKmFR","twitter.com/Rocigaot/status/731446845852033024"
"13/5/2016 20:07:45","","731184168374292481","","ese también tiene telita.","twitter.com/Rocigaot/status/731184168374292481"
"13/5/2016 17:44:00","8","731147995299913731","11","Que le faltaba añadir: 'QUE QUEDE CLARITO QUE LO TOMÉ ENGAÑAO. QUE ESTABA EN CASA POR MI NOVIA. NOVIA. CON A'","twitter.com/Rocigaot/status/731147995299913731"
"13/5/2016 17:42:43","6","731147670224576512","12","contando por qué lo tomaba.Y salía un pavo soltando algo como 'lo tenía mi novia, un día lo probé pensando que era colacao normal y me moló'","twitter.com/Rocigaot/status/731147670224576512"
"13/5/2016 17:41:50","6","731147449759354880","10","En esto de las comidas para ellos y ellas lo más glorioso que vi fue un anuncio del colacao bajo en calorías, que era, básicamente, gente...","twitter.com/Rocigaot/status/731147449759354880"
"13/5/2016 17:32:54","1","731145200320516096","","y saco el paquete del producto anunciado, que llevo encima porque sí cuando voy a un restaurante. XD","twitter.com/Rocigaot/status/731145200320516096"
"13/5/2016 17:32:22","1","731145065704390657","","que además sería el único público con el que sería creíble lo típico de los anuncios de 'estamos comiendo por ahí (1)'","twitter.com/Rocigaot/status/731145065704390657"
"13/5/2016 17:10:38","","731139598731104256","","igual lo de colarnos el pavo a las mujeres como sea es para compensar todas las mierdas con fibra que nos intentan colocar.","twitter.com/Rocigaot/status/731139598731104256"
"13/5/2016 17:05:04","9","731138197590315012","12","para ellos los desafíos tipo 'demuestra tu hombría comiéndote a bocaos este cerdo entero sumergido en un tanque de salsa barbacoa'","twitter.com/Rocigaot/status/731138197590315012"
"13/5/2016 17:03:19","6","731137753774166016","12","a nosotras nos toca el pavo, las tortitas de arroz, yogures con fibra y la leche sin lactosa porque la de verdad 'no nos hace sentir ligera'","twitter.com/Rocigaot/status/731137753774166016"
"13/5/2016 16:59:22","19","731136759879335936","25","Pavofrío, alimentando otro modelo de mujer. Porque el pavo es claramente para mujeres, que son las que tienen que comer ligero y tal.","twitter.com/Rocigaot/status/731136759879335936"
"13/5/2016 14:25:52","1","731098131262246912","","di que sí! seguro que el cartero se lo piensa dos veces antes de meter la propaganda en el buzón :P","twitter.com/Rocigaot/status/731098131262246912"
"13/5/2016 14:21:13","2","731096962209058817","","@Beatriz_efepic.twitter.com/zrqwFZPxJj","twitter.com/Rocigaot/status/731096962209058817"
"12/5/2016 22:42:46","","730860794179665925","","yo esta temporada estoy viendo todo lo que me ponía pa salir en1ºde carrera, en 1997.","twitter.com/Rocigaot/status/730860794179665925"
"12/5/2016 22:20:10","7","730855105092816896","5","A Georgia han llegado ahora los 90,como cuando Robin decía en How I met your mother que los 80 no llegaron a Canadá hasta 1992 #Eurovision","twitter.com/Rocigaot/status/730855105092816896"
"12/5/2016 22:07:18","5","730851869287956480","1","aunque ayer en la piscina calculé mal nadando de espaldas,frené de cabeza y ahora creo que C's es el cambio sensato.","twitter.com/Rocigaot/status/730851869287956480"
"12/5/2016 22:06:14","2","730851600282079232","","yo ahora llevo meses sin caídas aparatosas, toco madera.","twitter.com/Rocigaot/status/730851600282079232"
"12/5/2016 21:55:15","1","730848834201518081","","ay, pobre! yo soy experta en caídas gloriosas también. Y en casa aún ahorro el bochorno de cuando me doy un hostión en público","twitter.com/Rocigaot/status/730848834201518081"
"12/5/2016 21:39:32","1","730844879937519617","","@posedise @kuriosopic.twitter.com/Sk5K9CANsA","twitter.com/Rocigaot/status/730844879937519617"
"12/5/2016 0:29:26","1","730525247875776514","","al final me creeré estas cosas y les votaré, y verás qué chasco cuando no hagan nada de estopic.twitter.com/Ea8XjJHB2Q","twitter.com/Rocigaot/status/730525247875776514"
"11/5/2016 17:50:55","","730424958036357120","","@_Quimi_ creo que no, pero la próxima vez que vaya a la aldea me llevo mis apuntes de Sintaxis y hago una prueba empírica!","twitter.com/Rocigaot/status/730424958036357120"
"10/5/2016 22:48:09","8","730137371300220929","15","Hola, refugiados, somos Europa. Ayudar no os ayudaremos, pero eh, ¡os dedicaremos un número de baile en una semifinal de Eurovisión!","twitter.com/Rocigaot/status/730137371300220929"
"10/5/2016 22:40:15","1","730135384764624896","","@Lasti_ creo que en el bingo de beber de Eurovisión del año pasado había una casilla al respecto, rollo 'comentarista dice una babosada'","twitter.com/Rocigaot/status/730135384764624896"
"10/5/2016 22:36:17","1","730134386243469314","","@Lasti_ a mí me parece horterísima todo, pero a ver, es la gracia de Eurovisión.","twitter.com/Rocigaot/status/730134386243469314"
"10/5/2016 22:26:13","","730131851696803842","","@Lasti_ vale, @PotiPotiInLove ha sido más rápido y eficaz que yo XD","twitter.com/Rocigaot/status/730131851696803842"
"10/5/2016 22:25:49","","730131753516605440","","@Lasti_ @PotiPotiInLove ni idea, aquí está en la 2, no sé si algún canal público(tve o de otros países) la echará en la web también.","twitter.com/Rocigaot/status/730131753516605440"
"10/5/2016 22:21:58","","730130782887481344","","@Lasti_ @PotiPotiInLove  y el año pasado invitaron a Australia, porque se ve que le parecían pocos!","twitter.com/Rocigaot/status/730130782887481344"
"10/5/2016 22:19:34","","730130179704623109","","@PotiPotiInLove es que tengo que elegir al más tróspido para apoyarle el sábado! (que imagino que es ya este sábado si están hoy con esto)","twitter.com/Rocigaot/status/730130179704623109"
"10/5/2016 22:17:37","","730129686290944000","","¿Por qué no me avisáis de que están con las semifinales de Eurovisión? ¿Me he perdido alguna trospidez importante?","twitter.com/Rocigaot/status/730129686290944000"
"10/5/2016 15:44:06","4","730030655514513409","","@MargaretCastor ¿sabemos qué cerveza era? Porque a ver si van a tomar Cruzampo y la gente ahí, votándoles.","twitter.com/Rocigaot/status/730030655514513409"
"10/5/2016 15:40:36","9","730029775117537280","4","@hematocritico MADRE MÍA EL CÉSPED DE LA MARINApic.twitter.com/hxnreNEHqD","twitter.com/Rocigaot/status/730029775117537280"
"10/5/2016 12:16:07","2","729978317844123648","","Ay, ojalá una calle arrobalovepuntocom.https://twitter.com/EveyHn/status/725686353506238464 …El momento en que te das cuenta de que la comunidad de Madrid tiene demasiadas calles... pic.twitter.com/4iQhDpheKV","twitter.com/Rocigaot/status/729978317844123648"
"10/5/2016 1:03:53","1","729809142819528705","","@NewIlluminatus invitarlo a movidas era como invitar a Jessica Fletcher: pa qué lo hacen si ya saben que alguien va a palmar.","twitter.com/Rocigaot/status/729809142819528705"
"10/5/2016 0:45:25","11","729804495010582528","4","Madre mía Joey y Chandler en el piloto de Friends.pic.twitter.com/tSkGXYiOlx","twitter.com/Rocigaot/status/729804495010582528"
"10/5/2016 0:42:28","29","729803753486946304","27","Esas nos están mirando. Tú saca la guitarra, yo atacaré con la historia de cuando estuve de mochilero por la India.pic.twitter.com/s9OmsESBui","twitter.com/Rocigaot/status/729803753486946304"
"10/5/2016 0:40:49","4","729803338552848384","","@Genko parece una escena de una fiesta en el piso de Friends.","twitter.com/Rocigaot/status/729803338552848384"
"10/5/2016 0:37:44","2","729802562673754112","2","'Hola, ¿conoces a Alberto?'pic.twitter.com/wP3W3oTc3C","twitter.com/Rocigaot/status/729802562673754112"
"9/5/2016 0:07:01","6","729432443191754752","1","Yo veo una cucaracha por casa y la dejo seca de un zapatazo, igual no amortizaban el robot espía #CuartoMilenio","twitter.com/Rocigaot/status/729432443191754752"
"7/5/2016 22:58:36","2","729052837863403522","","@ikerdobarro @MargaretCastor @mjdelrio @CamaradaBakunin @laguiri @Daurmith @obdriftwood 37, conozco la lista de los godos por Zipi y Zape","twitter.com/Rocigaot/status/729052837863403522"
"7/5/2016 17:05:53","","728964072499236864","","@PotiPotiInLovepic.twitter.com/nYeyk2FrF0","twitter.com/Rocigaot/status/728964072499236864"
"7/5/2016 16:57:08","1","728961871030718466","","@Srta_Angus @PotiPotiInLove yo vi el de Martina Klein y el de Carlos Jean. El del Ajfram aún no me ha coincidido (por suerte, imagino).","twitter.com/Rocigaot/status/728961871030718466"
"7/5/2016 16:54:08","3","728961116823498752","","@SantaSuki una peli como La Terminal pero con una persona que se tiene que vivir dentro de un Carrefour por años. Lo veo.","twitter.com/Rocigaot/status/728961116823498752"
"7/5/2016 16:16:47","14","728951716645867521","7","Como veo que ya está empezando la temporada de bodas, voy dejando esto por aquí. #denadapic.twitter.com/jUzuDbMtaf","twitter.com/Rocigaot/status/728951716645867521"
"7/5/2016 16:13:26","1","728950874064703488","","@alitecarlito @oneafter909_ sí, pero quiero pensar que con alcalde secsi no te refieres a Paco XDDDDD","twitter.com/Rocigaot/status/728950874064703488"
"7/5/2016 16:07:36","1","728949408105152515","","@alitecarlito me está recordando esta joya de nuestro ex alcalde dando una clase magistral de chinología. https://www.youtube.com/watch?v=P-DMu-N3tTE …","twitter.com/Rocigaot/status/728949408105152515"
"7/5/2016 16:02:01","","728948001889263616","","@Lasti_ @missultrasonica 'Hola, me llamo Íñigo Montoya, tú criticaste a mi Nadal, prepárate a morir'. XD","twitter.com/Rocigaot/status/728948001889263616"
"7/5/2016 15:59:11","1","728947289683861509","","@missultrasonica @Lasti_ los mismos de 'el humor no tiene límites', 'cómo sois las feminazis', 'dictadura de lo políticamente correcto'","twitter.com/Rocigaot/status/728947289683861509"
"7/5/2016 15:58:33","1","728947127364276224","","@missultrasonica @Lasti_ a mí ha habido quien me ha desagregado por hacer coñas a costa de Nadal o de la Selección Española. Casualmente (1)","twitter.com/Rocigaot/status/728947127364276224"
"7/5/2016 15:50:03","2","728944991838539776","","@ComandanteVimes @PotiPotiInLovepic.twitter.com/XCUdiaEjda","twitter.com/Rocigaot/status/728944991838539776"
"7/5/2016 12:44:43","2","728898351211614210","","@uxialopez soy muy sugestionable por la publi así que aquí estoy, picoteando unos grillitos mientras estudio para ser guardia civil. XD","twitter.com/Rocigaot/status/728898351211614210"
"7/5/2016 12:42:51","","728897880115777536","","@Tabernita ¿no sabe a pollo, que es lo que te dicen de todas las cosas que a priori te da asquito probar?","twitter.com/Rocigaot/status/728897880115777536"
"7/5/2016 12:34:02","2","728895660704010240","1","Hoy el caralibro me sugiere esto y una academia para preparar las oposiciones a Guardia Civil.pic.twitter.com/lhgB9CDpg3","twitter.com/Rocigaot/status/728895660704010240"
"7/5/2016 0:55:45","","728719931861250048","","@familiasunshine Que encima sólo se da de sí cuando practicas con muchos distintos, pero si lo haces con tu marido siempre que quiera, no.","twitter.com/Rocigaot/status/728719931861250048"
"7/5/2016 0:54:45","1","728719680383418369","","@familiasunshine mayonesa y como yo estaba con la regla se la podía cortar (Confieso que no les discutí por escaquearme de cocinar)","twitter.com/Rocigaot/status/728719680383418369"
"7/5/2016 0:54:03","","728719502964297728","","@familiasunshine otra vez alojada en casa de amigos de carrera de ciencias me hicieron salir de la cocina porque iban a preparar (1)","twitter.com/Rocigaot/status/728719502964297728"
"7/5/2016 0:51:03","2","728718750334263296","","@familiasunshine y un ex mío tenía un compañero de facultad que creía que a todas nos bajaba la regla a la vez con la luna llena.","twitter.com/Rocigaot/status/728718750334263296"
"7/5/2016 0:49:48","1","728718436470292480","","@familiasunshine conocí a uno de Biología que creía que la regla era como hacer un pis con sangre y hala, lista hasta el mes que viene.","twitter.com/Rocigaot/status/728718436470292480"
"6/5/2016 23:58:19","1","728705477425664001","","Si algo tengo claro en esta vida es que el inventor del Guitar Hero vive en una vivienda unifamiliar sin vecinos por ningún lado. #redrum","twitter.com/Rocigaot/status/728705477425664001"
"6/5/2016 22:46:46","3","728687471228243969","","Si tendré abandonao twitter estos días que no he hecho un triste meme de Rajoy con las gafas de realidad virtual.","twitter.com/Rocigaot/status/728687471228243969"
"5/5/2016 20:13:08","1","728286422424260613","","Que es que tiene gente en casa a cenar. A Felipe y Letizia, supongo, porque yo si invito a gente de confianza y falla algo no me pongo así","twitter.com/Rocigaot/status/728286422424260613"
"5/5/2016 20:04:30","","728284250286501889","","Le ha gritado a la dependienta. Le ha gritado a la chica que va con ella (su hija, deduzco) por no enfadarse lo bastante con la dependienta","twitter.com/Rocigaot/status/728284250286501889"
"5/5/2016 20:00:27","3","728283229069938688","","Gensanta el pollo que está montando una en la panadería porque le llegó una tarta rota. Hubo gente en lo de la colza que dramatizó menos.","twitter.com/Rocigaot/status/728283229069938688"
"5/5/2016 18:03:55","3","728253903637233664","","El buscador de gifs del twitter no me da ninguno del bonico del tó. Con la de uso que yo le daría.","twitter.com/Rocigaot/status/728253903637233664"
"4/5/2016 19:20:40","3","727910831904665600","","Madre mía el remake de 'Algo pasa con Mary'pic.twitter.com/Hs4qQ3ZOWK","twitter.com/Rocigaot/status/727910831904665600"
"4/5/2016 19:17:49","3","727910112954875905","","@Srta_Angus @SantaSuki @SoniniSumode sospecho que para que nunca adelgazáramos y nunca pudiéramos desmatricularnos XD","twitter.com/Rocigaot/status/727910112954875905"
"4/5/2016 19:17:26","3","727910016506793984","","@Srta_Angus @SantaSuki @SoniniSumode hace años iba a un gimnasio pequeñito de barrio y los dueños nos liaban para ir de cañas al salir(1)","twitter.com/Rocigaot/status/727910016506793984"
"2/5/2016 0:54:05","5","726907572284960768","","He vuelto tras un finde fuera y he visto que el viernes olvidé desconectar la radio despertador. Programada para las 5 a.m. #perdónvecinos","twitter.com/Rocigaot/status/726907572284960768"