"date","fav","id","rt","text","url"
"22/3/2017 22:34:28","69","844663594759401476","31","A mí nada me ha despertado tanto las ganas de opositar como el culto al emprendimiento de estos últimos años, en serio. Qué jartura.","twitter.com/Rocigaot/status/844663594759401476"
"22/3/2017 22:32:48","132","844663176264404993","82","'Cómo criar a tu hijo para que sea emprendedor'. Paso 1: ve juntando pasta para avalarle cada vez que monte un chiringo. No hay paso 2.","twitter.com/Rocigaot/status/844663176264404993"
"22/3/2017 22:16:53","1","844659168179052545","","ah, no, vale, metí su nick en el buscador y me salía el de la Gisela pero efectivamente no puedo leer el suyo.","twitter.com/Rocigaot/status/844659168179052545"
"22/3/2017 22:13:02","","844658199391326208","","ahora es público de nuevo, que pude entrar a verlo. Pero tela.","twitter.com/Rocigaot/status/844658199391326208"
"22/3/2017 22:12:00","1","844657939776397312","","tuve una amiga que se casó el día que cumplió 20 y se separó el día que cumplió 22.","twitter.com/Rocigaot/status/844657939776397312"
"22/3/2017 22:10:45","6","844657626726252547","2","Lo he ido a mirar a su TL porque he pensado 'no jodas, TIENE que ser fake, nadie puede tener tanto morro'. Y no es fake, no.https://twitter.com/Uvejeje/status/844651385669013505 …'Veo que se encuentra en una situación comprometida, ¿querría prestarme vasallaje eternamente?' pic.twitter.com/omRPHEzm1H","twitter.com/Rocigaot/status/844657626726252547"
"22/3/2017 20:31:27","2","844632636660310016","","https://twitter.com/Reductress/status/844632276432437248 …Woman Wearing Same Shirt For a Week Packs 42 Different Vacation Outfits: http://reductr.es/2mPv2KA  pic.twitter.com/u6wrN8ksFj","twitter.com/Rocigaot/status/844632636660310016"
"22/3/2017 15:03:36","","844550131533987841","","é moito máis seguro ter unha recua de coches pola neve arredor de cada cole, onde vai parar.","twitter.com/Rocigaot/status/844550131533987841"
"22/3/2017 15:01:47","","844549671171375105","","A min o que máis me matou foi o horario, poden ir ao cole pero non teñen bus de volta.pic.twitter.com/OUYgcoqJ8C","twitter.com/Rocigaot/status/844549671171375105"
"22/3/2017 14:20:54","","844539382812020737","","Naim-Thomas Chomsky. #yamevoy","twitter.com/Rocigaot/status/844539382812020737"
"22/3/2017 13:39:08","2","844528874646114305","","coma un día neve na Coruña rompemos Internet. ","twitter.com/Rocigaot/status/844528874646114305"
"22/3/2017 11:55:21","1","844502756677369856","","Cualquier día Méndez de Vigo nos avisa de que el tiempo de esplendor del fax se está acabando, que nos hagamos un 'emilio' de terra.","twitter.com/Rocigaot/status/844502756677369856"
"22/3/2017 11:49:51","4","844501370455646208","1","Lo de Méndez de Vigo es un poco la entrevista de trabajo de Jen en el primer capítulo de 'The IT Crowd'https://youtu.be/e5NANrVnqLc ","twitter.com/Rocigaot/status/844501370455646208"
"22/3/2017 11:29:55","5","844496354751610880","","Mancantao, pero nos van a llover los follows automáticos de entrepreneurs https://twitter.com/Srta_Angus/status/844494355276673024 …ODA A @Rocigaot 
La musa de Infojobs 
Llevas dentro un mindfulness entrepreneur 
Actívame las sinergias…","twitter.com/Rocigaot/status/844496354751610880"
"22/3/2017 11:05:20","","844490167746486273","","Fijo. Es como cuando doy ideas de emprendimiento. ","twitter.com/Rocigaot/status/844490167746486273"
"22/3/2017 0:30:40","89","844330449342287873","31","12. 'El top ten de drogas legales e ilegales para fingir el entusiasmo que buscan tu empresa (y dónde encontrarlas)'.","twitter.com/Rocigaot/status/844330449342287873"
"22/3/2017 0:28:29","8","844329898189705217","5","'5 tiendas virtuales y un supermercado de la droga donde revender los medicamentos de tu difunto abuelo'","twitter.com/Rocigaot/status/844329898189705217"
"22/3/2017 0:21:37","149","844328172405637122","69","11. 'Quince superalimentos para aguantar el ritmo en el trabajo si no puedes permitirte la cocaína'.","twitter.com/Rocigaot/status/844328172405637122"
"21/3/2017 23:51:46","7","844320660335869952","","Veréis como todavía me plagian las ideas de los reportajes y ni me contratan ni me las pagan ni na. Me lo monto fatal.","twitter.com/Rocigaot/status/844320660335869952"
"21/3/2017 23:27:50","1","844314636681973761","","só me queredes polos meus memes!","twitter.com/Rocigaot/status/844314636681973761"
"21/3/2017 23:24:55","82","844313900032180229","37","10. '¿Estudiante con flexibilidad horaria? Trabajar como refuerzo puntual en empresas en huelga te aportará experiencia e ingresos extra'","twitter.com/Rocigaot/status/844313900032180229"
"21/3/2017 23:08:54","143","844309869750616069","60","9. 'Jon trabaja en turno de día y Eva en turno de noche, y comparten dormitorio a turnos.Es la moda del cosleeping, y ya arrasa en Lavapiés'","twitter.com/Rocigaot/status/844309869750616069"
"21/3/2017 23:00:53","5","844307852600754176","1","voy a hacerme un bingo y vamos bebiendo chupito por cada uno que veamos de verdad en los próximos meses.","twitter.com/Rocigaot/status/844307852600754176"
"21/3/2017 22:59:53","98","844307600967655425","38","8, 'Crianza forties style. Tres mamás millenial nos cuentan cómo ahorran en la cesta de la compra prolongando la lactancia hasta los 7años'.","twitter.com/Rocigaot/status/844307600967655425"
"21/3/2017 22:55:32","62","844306508364107776","22","'Los (supremacistas) blancos sí la saben meter. Una noche de copas y ligoteo con los seguidores de Richard Spencer'.","twitter.com/Rocigaot/status/844306508364107776"
"21/3/2017 22:53:15","235","844305933694091265","138","6. '5 órganos no vitales que pueden financiar tu idea de negocio'","twitter.com/Rocigaot/status/844305933694091265"
"21/3/2017 22:49:23","82","844304958749102080","31","5. 'Tarotista a domicilio, paseador de perros... modelos de microemprendimiento que pegarán fuerte en 2017'.","twitter.com/Rocigaot/status/844304958749102080"
"21/3/2017 22:43:19","104","844303433251344384","45","4. 'Llega el  'broke chic'. Tres fashion bloggers nos proponen outfits solo con prendas del ropero de Caritas'","twitter.com/Rocigaot/status/844303433251344384"
"21/3/2017 22:40:32","57","844302734526484482","22","3. 'Respiracionismo: ¿Fake de Cuarto Milenio o el minimalist life-style definitivo? ¡La respuesta puede sorprenderte!'","twitter.com/Rocigaot/status/844302734526484482"
"21/3/2017 22:39:13","84","844302399636430851","34","2. '10 canapés para aprovechar los trozos de pan de molde en los que aún no había moho'","twitter.com/Rocigaot/status/844302399636430851"
"21/3/2017 22:34:40","92","844301255916818432","52","1. 'De pinchos con la alt-right. Miembros del HSM nos muestran sus trucos gastronómicos para triunfar, ¡siempre con españoles!'","twitter.com/Rocigaot/status/844301255916818432"
"21/3/2017 22:32:43","318","844300765707583488","369","Creo que voy a usar esto para buscar trabajo de nuevo en medios. Al loro, El País, Vice y compañía con mis ideacas para reportajes:","twitter.com/Rocigaot/status/844300765707583488"
"21/3/2017 22:28:43","10","844299759473057794","4","Ah, bueno, si los nazis escuchan la misma música que nosotros que apalicen a gusto,lo que me inquietaba era si serían fans de Malú.","twitter.com/Rocigaot/status/844299759473057794"
"21/3/2017 0:52:37","2","843973585865773061","","non descartes que un día o poña, que aínda non aprendín a medir distancias na piscina para non chegar de cabeza cando nado a espalda","twitter.com/Rocigaot/status/843973585865773061"
"21/3/2017 0:50:08","2","843972959198941185","","Se ve que el niño Jesús era carne de Hermano Mayor. https://twitter.com/georgebest_/status/843913041645355008 …Un encanto el niño Jesús.
[extractos del evangelio (apócrifo) de la infancia de Tomás] pic.twitter.com/hZXpAottUj","twitter.com/Rocigaot/status/843972959198941185"
"21/3/2017 0:47:44","","843972357446426624","","de feito me están a reutitear un montón de LETs ese tuit e agora síntome un pouco sucia.","twitter.com/Rocigaot/status/843972357446426624"
"21/3/2017 0:40:28","2","843970526368464900","","'queréis fama, pero la fama cuesta!'","twitter.com/Rocigaot/status/843970526368464900"
"21/3/2017 0:33:18","","843968722494767105","","estaba convencida de que me tiña bloqueada, pero igual me confundo con outro LET. Que xa ten delito, se Jimmy é inconfundible.","twitter.com/Rocigaot/status/843968722494767105"
"21/3/2017 0:31:32","5","843968280276733952","","Me ha retuiteao Jimmy Pokemon el tuit con la coña sobre el bebé gigante de Chabelita, ¿cómo os quedáis?","twitter.com/Rocigaot/status/843968280276733952"
"20/3/2017 22:38:51","7","843939919861075968","","Bueno, ¿qué tal el Día Internacional de la Felicidad?pic.twitter.com/WlyUclTQC0","twitter.com/Rocigaot/status/843939919861075968"
"20/3/2017 22:23:19","2","843936011356913665","","yo soy más del mouthfulness de licor café.","twitter.com/Rocigaot/status/843936011356913665"
"20/3/2017 22:22:46","","843935872437379072","","Yisus Craist.","twitter.com/Rocigaot/status/843935872437379072"
"20/3/2017 22:20:48","1","843935379099193344","","bueno, y sin la estúpida recomendación de no llevarte la petaca de vodka para darle un trago cuando estés muy hartita","twitter.com/Rocigaot/status/843935379099193344"
"20/3/2017 22:19:33","2","843935065755258882","","sería más llevadero sin la estúpida prohibición de darles jarabe de la tos con codeína para que estén tranquilitos.","twitter.com/Rocigaot/status/843935065755258882"
"20/3/2017 22:18:10","1","843934717330317312","","y tendrías que ir tu también. Bueno, quien dice al spa dice al bar.","twitter.com/Rocigaot/status/843934717330317312"
"20/3/2017 22:15:24","1","843934020387962880","","mujer, igual son bebés de esos a los que llevan a inglés y a chino a los 6 meses, tendrán que relajarse luego! :P","twitter.com/Rocigaot/status/843934020387962880"
"20/3/2017 18:56:15","189","843883902070591488","197","En la guerra de batallitas de 'mi parto fue más duro que el tuyo' no va a haber quien tosa a Chabelita.pic.twitter.com/yQjxuoWyYo","twitter.com/Rocigaot/status/843883902070591488"
"20/3/2017 0:09:52","2","843600438662512644","","Menos mal que empieza la sección 'los gayegos dan mazo miedo', que ya iba a pasar de Friker.","twitter.com/Rocigaot/status/843600438662512644"
"19/3/2017 22:47:50","1","843579794025517057","","é o modo ideal de velo! Sobrio non ten nen a metade de gracia.","twitter.com/Rocigaot/status/843579794025517057"
"19/3/2017 22:43:44","2","843578764009390080","","Mira, hoy estoy con el ánimo ideal* para comentar #CuartoMilenio!

*Algo borracha","twitter.com/Rocigaot/status/843578764009390080"
"19/3/2017 22:41:24","","843578175791730689","","xa empeza?","twitter.com/Rocigaot/status/843578175791730689"
"19/3/2017 22:00:48","20","843567958190411779","3","-Dime puta
-Puta
-Dime puerca
-Puerca
-Dime el PIN de tu tarjeta
-3,5, 9..¡eh!
-Pues con Marías coló.","twitter.com/Rocigaot/status/843567958190411779"
"18/3/2017 13:22:51","","843075224778301441","","ay, si yo creo que leí ese libro y no me acuerdo! Aunque hará 20años o así, e igual mi mente reprime el recuerdo pa evitar traumita","twitter.com/Rocigaot/status/843075224778301441"
"18/3/2017 1:22:16","5","842893884065824770","1","maldita la hora en que se me ocurrió porque ahora necesito leer ese libro. Voy a pillar una ouija, a ver si me lo dicta.","twitter.com/Rocigaot/status/842893884065824770"
"18/3/2017 1:20:48","9","842893513180241920","3","me está dando una pena tremenda saber que nunca leeremos a Pratchett describir los pisos del Airbnb de Ankh-Morpork.","twitter.com/Rocigaot/status/842893513180241920"
"18/3/2017 1:01:58","9","842888773281107968","2","la Guardia obligada a hacer un seminario de esos de coaching para equipos de trabajo.","twitter.com/Rocigaot/status/842888773281107968"
"18/3/2017 0:45:19","18","842884582315778051","9","Un Silicon Valley en Ankh-Morpork. Y-voy-a-la-ruina Escurridizo diciendo que lo suyo es una pop-up store...","twitter.com/Rocigaot/status/842884582315778051"
"18/3/2017 0:33:11","85","842881529655300096","47","Lástima que ya no esté Pratchett para escribir la versión Mundodisco de la 'economía colaborativa' y las start-ups con proyectos chulos.","twitter.com/Rocigaot/status/842881529655300096"
"18/3/2017 0:03:22","4","842874028243243010","","'coqueto, interior pero mucha luz, muchas posibilidades'.","twitter.com/Rocigaot/status/842874028243243010"
"17/3/2017 23:27:03","","842864889110695937","","hala, qué curioso, no los había visto nunca! Ya cotillearé si los veo en algún japonés de por aquí!","twitter.com/Rocigaot/status/842864889110695937"
"17/3/2017 23:25:15","","842864433596715008","","qué es lo rosa que hay en la segunda caja por la derecha de la fila de atrás?  Que en mi monitor parecen nubes! ","twitter.com/Rocigaot/status/842864433596715008"
"17/3/2017 23:20:11","1","842863158645735424","","como a mí, entonces. Y ya las de cuerpo gordo me dan ganas de prender fuego a la casa para asegurarme de que acabo con ella.","twitter.com/Rocigaot/status/842863158645735424"
"17/3/2017 23:13:33","","842861489522429956","","puntualiza: ¿la araña entera, patas incluidas, más pequeña que una moneda de céntimo, o el cuerpo de la araña?","twitter.com/Rocigaot/status/842861489522429956"
"17/3/2017 22:47:46","2","842854999667494912","","mooooola! (aunque estoy un pelín decepcionada porque pensé que de verdad lo mezclarías con porno ochentero )","twitter.com/Rocigaot/status/842854999667494912"
"17/3/2017 15:43:50","","842748315867451393","","Dios, qué imagen mental!","twitter.com/Rocigaot/status/842748315867451393"
"17/3/2017 12:31:57","4","842700026052788224","3","'Es que me preguntaba todo el rato por el sueldo'. Ojalá un método para desbloquear la conversación como, yo qué sé, contestar a la pregunta","twitter.com/Rocigaot/status/842700026052788224"
"17/3/2017 12:29:58","1","842699528952315905","1","los bichos cuquis no usan hashtags como '#galifornia' o '#fitspiration'. Y encima son cuquis. Todo ventajas.","twitter.com/Rocigaot/status/842699528952315905"
"17/3/2017 12:27:44","38","842698965955067904","21","Otro día hablamos de lo bonito que es que se critique a la vez que vivas con tus padres y que pidas sueldo digno 'si total no tienes hijos'.","twitter.com/Rocigaot/status/842698965955067904"
"17/3/2017 12:25:37","14","842698430854127617","4","'Es que hay candidatos que en la entrevista sólo preguntan por el sueldo'. Dónde se ha visto, ni que lo necesitaran para vivir, o algo.","twitter.com/Rocigaot/status/842698430854127617"
"17/3/2017 9:52:05","1","842659794993451009","","Por eso siempre, siempre votamos al Partido Popular!","twitter.com/Rocigaot/status/842659794993451009"
"17/3/2017 9:33:59","2","842655241422168064","1","claro, hay gente que ha perdido una pierna por el coletazo letal de un pincher! ","twitter.com/Rocigaot/status/842655241422168064"
"17/3/2017 9:29:52","27","842654205378793473","3","Digo yo que si te molesta que un perro te dé con el rabo una solución buenísima es no tener perro, que no es obligatorio.","twitter.com/Rocigaot/status/842654205378793473"
"17/3/2017 1:15:24","1","842529768721539072","","yo voy a optar por lo 2º directamente.","twitter.com/Rocigaot/status/842529768721539072"
"17/3/2017 1:08:55","1","842528133966368769","","sí, me habías contado! Aunque en concertados sin enchufe suele estar complicado igual!","twitter.com/Rocigaot/status/842528133966368769"
"16/3/2017 23:48:17","1","842507841424539650","","el otro día descubrí que una de mis alumnas de clases particulares no conocía Se ha escrito un crimen y me sentí viejísima.","twitter.com/Rocigaot/status/842507841424539650"
"16/3/2017 23:47:33","","842507656912953353","","yo vuelvo a proponer el collage con Lansbury y el porno de los 80. Lo peta, verás.","twitter.com/Rocigaot/status/842507656912953353"
"16/3/2017 23:44:59","1","842507013758291969","","ay, el collage acabo de verlo ahora! No sé por qué no lo vi por el TL si ya estaba yo aquí al pie del cañón ","twitter.com/Rocigaot/status/842507013758291969"
"16/3/2017 23:43:43","1","842506694051741696","","pero es que lo de Angela lo subiste en prime time de twitter, que pareces nueva!","twitter.com/Rocigaot/status/842506694051741696"
"16/3/2017 23:42:18","1","842506338273959936","","pero claro, la mayoría de salidas laborales molantes son equivalentes a morirte de hambre.","twitter.com/Rocigaot/status/842506338273959936"
"16/3/2017 23:40:57","1","842505999495892992","","a mí como carrera me gustó mucho. Y pensar que cuando acabó COU ni llegué a meterla en mis opciones para estudiar...","twitter.com/Rocigaot/status/842505999495892992"
"16/3/2017 23:35:49","2","842504707721576448","","durante todos los años de la crisis, y yo allí con mi máster como gilipollas, madre, que diría Krahe.","twitter.com/Rocigaot/status/842504707721576448"
"16/3/2017 23:35:22","1","842504591652589568","","por otro lado tendría que hacerlo en 2años, y temo gastarme 4000 euracos y que al acabar vuelva a quedar todo paralizado, como(1","twitter.com/Rocigaot/status/842504591652589568"
"16/3/2017 23:33:54","1","842504224965623808","","a mí hay áreas de mi carrera que me llaman más y por gusto haría otros, pero serían hambre pa hoy y más hambre pa mañana.","twitter.com/Rocigaot/status/842504224965623808"
"16/3/2017 23:24:54","1","842501958602821632","","aparte de que salen poquísimas plazas por especialidad. Que los que hicimos la carrera ahí tenemos puntos por eso, pero aún así.","twitter.com/Rocigaot/status/842501958602821632"
"16/3/2017 23:24:05","1","842501752238854144","","sí, miré y algo así era, o 1poco más. Lo más barato online (sin ser barato) es la UNED, pero dicen que es la muerte a pellizcos.","twitter.com/Rocigaot/status/842501752238854144"
"16/3/2017 23:21:41","1","842501149907456001","","sí, hasta donde yo sé sigue valiendo. Pero yo entonces pensaba que la enseñanza ni de coña y pasé de hacerlo.","twitter.com/Rocigaot/status/842501149907456001"
"16/3/2017 23:20:51","2","842500939697274882","","o mellor é que o CAP de 4 meses valeríame para ambas especialidades, e o máster dun ano e 4000 euracos non. Aplausos, por favor.","twitter.com/Rocigaot/status/842500939697274882"
"16/3/2017 23:19:32","6","842500606866677760","","No haber hecho el CAP cuando terminé la primera carrera es la más gloriosa de todas las decisiones gilipollas de mi vida.","twitter.com/Rocigaot/status/842500606866677760"
"16/3/2017 23:17:27","5","842500084298366976","","Estoy pensando si hacer el máster de profe y como no puedo ir presencial estoy mirando precios de las online. ¿Un riñón necesitáis alguno?","twitter.com/Rocigaot/status/842500084298366976"
"16/3/2017 22:47:22","2","842492514410094595","","está visto que hay demanda para ese collage!","twitter.com/Rocigaot/status/842492514410094595"
"16/3/2017 22:46:34","1","842492310512386049","","que se lo podían poner de slogan: De las 2 tiendas del pueblo, esta es la que no difunde tus vídeos sexuales. Tú eliges.","twitter.com/Rocigaot/status/842492310512386049"
"16/3/2017 22:45:44","1","842492100813963265","","una de mi ex-curro había trabajado en una tienda de informática de ese pueblo. Y siempre decía: En 'esa' no, en la otra que hay.","twitter.com/Rocigaot/status/842492100813963265"
"16/3/2017 22:44:14","1","842491722831683584","","así que igual otros se guardan copias para uso y disfrute pero no las difunden para que no les pillen.","twitter.com/Rocigaot/status/842491722831683584"
"16/3/2017 22:43:19","1","842491495781470208","","y les condenaron, pero pasó bastante tiempo, y la chica tuvo que irse del pueblo.","twitter.com/Rocigaot/status/842491495781470208"
"16/3/2017 22:43:01","","842491417557696512","","a formatear, había unos vídeos de ella masturbándose, los guardaron y los rularon por ahí. Años después fueron a juicio(2)","twitter.com/Rocigaot/status/842491417557696512"
"16/3/2017 22:42:33","","842491302340153349","","sí, es ilegal, pero fíate. Es como en una tienda de informática de un pueblo de aquí, que una chica había llevado un ordenador(1)","twitter.com/Rocigaot/status/842491302340153349"
"16/3/2017 22:37:59","1","842490150865309696","","las había llevado a la típica tienda de fotografía del barrio de toda la vida. No sé yo si no se guardarían copias.","twitter.com/Rocigaot/status/842490150865309696"
"16/3/2017 22:37:28","1","842490019491299330","","sí, me lo creo! hace años una amiga me enseñó unas fotos en bolas que le sacara su marido. Era la época del carrete, así que (1)","twitter.com/Rocigaot/status/842490019491299330"
"16/3/2017 22:35:45","1","842489591278043139","","en plan 'mirad qué peña peculiar me llega al trabajo'","twitter.com/Rocigaot/status/842489591278043139"
"16/3/2017 22:35:24","1","842489499816927232","","con este lo ibas a pasar bien también  Fijo que los de la tienda sacaban fotos para enseñarlo a los amigos por whatsapp","twitter.com/Rocigaot/status/842489499816927232"
"16/3/2017 22:32:18","1","842488721664630784","","la versión collage de las pinturas negras de Goya sale de ahí XD","twitter.com/Rocigaot/status/842488721664630784"
"16/3/2017 22:26:07","5","842487166961946624","","ay, haz un collage mezclando el vídeo fitness de Angela Lansbury con porno de los 80!","twitter.com/Rocigaot/status/842487166961946624"
"16/3/2017 22:24:17","1","842486703378092032","","Ay, haz un collage con eso!","twitter.com/Rocigaot/status/842486703378092032"
"16/3/2017 22:23:29","1","842486501804072960","","gulag.","twitter.com/Rocigaot/status/842486501804072960"
"16/3/2017 22:15:49","2","842484573938302976","","Creo que esto me seduce aún más que la estabilidad de lo de opositar. Mira, al final tenían razón y la pasta no lo es todo  ¯\_(ツ)_/¯https://twitter.com/Rocigaot/status/842465775403339776 …De verdad que si un día consigo sacarme una oposición voy a actualizar Linkedin pa colgar esto. pic.twitter.com/TQym0Ujh9f","twitter.com/Rocigaot/status/842484573938302976"
"16/3/2017 21:06:17","1","842467073318105094","","Y al día siguiente ganará las elecciones una coalición de Espe y Falangito y privatizarán todo, porque soy así de gafe.","twitter.com/Rocigaot/status/842467073318105094"
"16/3/2017 21:01:07","5","842465775403339776","","De verdad que si un día consigo sacarme una oposición voy a actualizar Linkedin pa colgar esto.pic.twitter.com/TQym0Ujh9f","twitter.com/Rocigaot/status/842465775403339776"
"16/3/2017 20:59:48","4","842465444002992128","","No falla: leo un hilo en que denuncian a los empresaurios que se niegan a decirte el sueldo en la entrevista, y hay replies de ofendiditos.","twitter.com/Rocigaot/status/842465444002992128"
"16/3/2017 0:18:16","","842153002349821952","","Que he visto un par de fotos que hasta parece físicamente imposible que su cuello sujete eso.https://twitter.com/Rocigaot/status/842152838281195521 …He estado desconectada de lo de Holanda, así que contadme: ¿todas las fotos se las hacen a mala leche o Wilders es de verdad tan cabezón?","twitter.com/Rocigaot/status/842153002349821952"
"16/3/2017 0:17:37","2","842152838281195521","2","He estado desconectada de lo de Holanda, así que contadme: ¿todas las fotos se las hacen a mala leche o Wilders es de verdad tan cabezón?","twitter.com/Rocigaot/status/842152838281195521"
"16/3/2017 0:14:08","1","842151960274964481","","Yo ahora a esos los troleo y les digo que los entiendo totalmente, que yo si algo lo ha escrito un pelirrojo, buah, pasando.","twitter.com/Rocigaot/status/842151960274964481"
"16/3/2017 0:13:41","","842151846454153216","","Y luego los de 'yo es que si algo ha sido best-seller no me digno leerlo' o 'yo es que sólo leo clásicos, desde el XIX solo hay mierda'.","twitter.com/Rocigaot/status/842151846454153216"
"16/3/2017 0:08:39","3","842150578834800640","1","No sé, ¿qué reacción esperáis de la gente? 'Oh, gracias por iluminarme con tu suprema sabiduría. Estaba ciego pero ahora veo'","twitter.com/Rocigaot/status/842150578834800640"
"16/3/2017 0:06:20","9","842149999219744768","2","En general, qué pereza da la gente de 'tus gustos y preferencias son una mierda, esto es lo que debería gustarte'.","twitter.com/Rocigaot/status/842149999219744768"
"15/3/2017 23:52:15","","842146454684729344","","que para que fuera suyo tendría que haber estado en el trabajo a su lado con un bombo de 40 semanas.","twitter.com/Rocigaot/status/842146454684729344"
"15/3/2017 23:51:21","","842146226724327425","","a una amiga la vio con un recién nacido y la felicitó uno con el que había estado trabajando hasta el mes anterior.","twitter.com/Rocigaot/status/842146226724327425"
"15/3/2017 23:43:45","4","842144313270247426","2","Son un poco como los de 'ahora resulta que toooodos sabíais quién era David Bowie'.","twitter.com/Rocigaot/status/842144313270247426"
"15/3/2017 23:42:46","9","842144066674540545","3","Gracias, oh, desconocido de Internet por descubrirme la existencia de un autor cuyos libros están en cualquier librería de estación.","twitter.com/Rocigaot/status/842144066674540545"
"15/3/2017 23:41:42","5","842143800541773824","2","Sobre todo si estás hablando un libro que te gusta e irrumpen para decir que eso es mierda. 'Apunta, bonita: Javier Marías. De nada'.","twitter.com/Rocigaot/status/842143800541773824"
"15/3/2017 23:31:02","","842141114555600896","1","Quienes eran 'los clásicos' en concreto a los que te recomendaba?","twitter.com/Rocigaot/status/842141114555600896"
"15/3/2017 23:29:47","6","842140800595181568","1","que te quedas como PERO VAMOS A VER, CRIATURA, SI ESTÁ EN LA COLECCIÓN QUE LE DIERON A TU PADRE CON EL PAÍS.","twitter.com/Rocigaot/status/842140800595181568"
"15/3/2017 23:29:00","5","842140601617379328","1","pero a mí lo que más me mata es el tono de 'apunta, nena: Javier Marías. Como no tienes mi vasta cultura ni te sonará, claro'.","twitter.com/Rocigaot/status/842140601617379328"
