"date","fav","id","rt","text","url"
"2/1/2018 17:50:11","17","948234981360439296","3","Es como las polémicas de Gibraltar de los veranos. Puedes programar el mismo tuit de año en año y dejar esto en piloto automático.","twitter.com/Rocigaot/status/948234981360439296"
"2/1/2018 17:49:04","","948234700283408384","","Vaia merda de magos que teñen que repostar en vez de facer gasolina para as carrozas con MAXIA!","twitter.com/Rocigaot/status/948234700283408384"
"2/1/2018 17:46:47","","948234123927277568","","Ni idea, la verdad. ¿Qué pone en su DNI?","twitter.com/Rocigaot/status/948234123927277568"
"2/1/2018 17:46:17","1","948233999536750593","2","Y es por eso por lo que en Madrid nunca elegirán a Carromero para ir disfrazado de rey mago.https://twitter.com/Rocigaot/status/948233891596423168 …Por cierto, cada vez que sale el debatito de 'cabalgatas que traumatizan a los niños' recuerdo aquella hace unos años, creo que en Soria, donde tuvieron que desorejar a Dumbo porque se quedó atascado en un callejón estrecho.","twitter.com/Rocigaot/status/948233999536750593"
"2/1/2018 17:45:51","7","948233891596423168","3","Por cierto, cada vez que sale el debatito de 'cabalgatas que traumatizan a los niños' recuerdo aquella hace unos años, creo que en Soria, donde tuvieron que desorejar a Dumbo porque se quedó atascado en un callejón estrecho.","twitter.com/Rocigaot/status/948233891596423168"
"2/1/2018 17:43:39","41","948233335544918016","3","Cthulhu, no Chtllhu. Hoy no va un solo tuit sin comerme o cambiar letras.","twitter.com/Rocigaot/status/948233335544918016"
"2/1/2018 17:42:43","119","948233101087592448","32","Probablemente si hubieran hecho una carroza de Cthllhu pero que lanzara sugus y chupachups con sus tentáculos habría ido con la misma ilusión que con el concejal random pintado con betún de los zapatos.","twitter.com/Rocigaot/status/948233101087592448"
"2/1/2018 17:40:58","66","948232662648573952","13","Como ya me estaban viendo poco respeto por la institución de la monarquía por ese agravio comparativo me enteré bastante pronto de lo de los Reyes, y seguía yendo igual a las cabalgatas porque caramelos y fiesta.","twitter.com/Rocigaot/status/948232662648573952"
"2/1/2018 17:13:19","112","948225705162235904","26","'Por qué hacen regalos con magia para Menganita y conmigo tienen un presupuesto como Hilary la de las reformas, qué mierda de magos son esos'.","twitter.com/Rocigaot/status/948225705162235904"
"2/1/2018 17:10:44","71","948225051848998912","19","En mi caso creo que me respondían a todas las incongruencias con 'son magos, aaaah, magia', hasta que tuve un caso de esos de 'por qué a menganita le dejan medio catálogo del Corte Inglés y a mí me hacen escoger solo una cosa'.","twitter.com/Rocigaot/status/948225051848998912"
"2/1/2018 17:07:28","138","948224229568368640","53","O igual que le explicas por qué él se portó bien y los reyes le dejaron un juguete y a su vecino el malcriado cuyos berrinches se oyen desde el otro piso le dejaron cinco juguetes, la bici y la Play.","twitter.com/Rocigaot/status/948224229568368640"
"2/1/2018 17:05:42","1,1K","948223786763128833","806","'Cómo le explico yo a mis hijos que los reyes magos sean reinas'. Pues igual que le explicas cómo los está viendo en Gijón a la misma hora que los ve su primo en Cartagena y que salen en la tele por el centro de Madrid, mismamente.","twitter.com/Rocigaot/status/948223786763128833"
"2/1/2018 16:59:38","2","948222259545722880","","Creo que se estableció en el Concilio de Trento. Luego ya en el Concilio Vaticano III se añadió lo de las carrozas de Disney o Bob Esponja.","twitter.com/Rocigaot/status/948222259545722880"
"2/1/2018 15:18:16","","948196748060692480","","Sí, todo es verse unos cuantos tutoriales en youtube (aunque yo las veces que lo he intentando he desistido porque me daba la impresión de que más que crear sombras me hacía unas patillas que ni pa salir en Curro Jiménez).","twitter.com/Rocigaot/status/948196748060692480"
"2/1/2018 15:14:14","","948195736792989697","","Además, Ismael Serrano no se hace el 'contouring' tan marcado.","twitter.com/Rocigaot/status/948195736792989697"
"2/1/2018 15:02:54","2","948192881742876673","","Alaska, no Alaksa. Ni un tuit sin su etarra, digo, su errata.","twitter.com/Rocigaot/status/948192881742876673"
"2/1/2018 14:43:41","2","948188047727890432","","Y Ru Paul mirando con cara de mala hostia a los adultos que se meten a rapiñar caramelos empujando a los niños.pic.twitter.com/GWhpM97BVp","twitter.com/Rocigaot/status/948188047727890432"
"2/1/2018 14:35:30","2","948185985380225024","","Sharon Needles, Alaksa y Alexis Mateo de reinas magas. Nos iba a salir por un pico, pero más gastó Paco en el Millenium y ya ves tú.","twitter.com/Rocigaot/status/948185985380225024"
"2/1/2018 14:30:49","4","948184807095316480","","Ojalá suficiente pasta en el Concello para tirar la casa por la ventana y hacer aquí cabalgata drag como la de Vallekas pero con concursantes de Ru Paul's Drag Grace.","twitter.com/Rocigaot/status/948184807095316480"
"2/1/2018 14:28:47","16","948184295738355712","8","Pues oye, igual si los adultos que se escandalizan mazo con lo de la cabalgata drag de Vallecas pasan de ir, los niños se ahorran que gente que les saca tres cabezas rapiñe todos los caramelos con paraguas puestos del revés.","twitter.com/Rocigaot/status/948184295738355712"
"2/1/2018 2:13:37","9","947999284636594176","","Yo soy más de lo contrario. Cenar una ensaladita a las 9 y recenar una vaca untada en nutella a las 12.","twitter.com/Rocigaot/status/947999284636594176"
"2/1/2018 1:37:22","4","947990161807290368","","Cuando pasa algo de esto y se había negado la suspensión del régimen de visitas, ¿hay alguna investigación de por qué se rechazó? ¿Se exigen responsabilidades? Pregunto, porque me parece demencial.","twitter.com/Rocigaot/status/947990161807290368"
"2/1/2018 1:34:50","","947989524377980930","","Según dicen lo habían expulsado de la policía, y aún así.","twitter.com/Rocigaot/status/947989524377980930"
"2/1/2018 1:33:13","6","947989119480811521","","Que ya solo con la orden de alejamiento de la madre es de cajón no dejarle acceder a los niños, que son el medio que tiene para hacer daño. Y aquí encima ni siquiera hablamos de un lobo con piel de cordero que de puertas para afuera diera el pego como persona pacífica.","twitter.com/Rocigaot/status/947989119480811521"
"2/1/2018 1:31:14","9","947988619305811969","3","Orden de alejamiento de la madre por violencia de género. Órdenes de alejamiento de personas varias del pueblo. Imputado por delitos varios. Expulsado de la policía. Vamos a dejar que se lleve a los niños un par de semanas, qué puede salir mal.","twitter.com/Rocigaot/status/947988619305811969"
"2/1/2018 1:29:32","4","947988193017810944","6","¿Pero cómo puede ser que a una persona con este historial se le permitiera tener régimen de visitas con sus hijos y sin supervisión?https://politica.elpais.com/politica/2018/01/01/actualidad/1514833171_919407.html?id_externo_rsoc=TW_CC …","twitter.com/Rocigaot/status/947988193017810944"
"1/1/2018 18:58:28","8","947889778770497536","2","Y si las órdenes vienen de arriba, veréis como la caída de visitas si compartimos captura les hace más receptivos a la sugerencia de redactar titulares informativosby no clickbait de mierda.","twitter.com/Rocigaot/status/947889778770497536"
"1/1/2018 18:56:33","13","947889293808283649","3","'Es que luego la gente nos pone a caldo por el titular e igual el texto no tiene nada que ver'. Pues igual así le dais menos al clickbait y repasáis los apuntes de Redacción de 1°.","twitter.com/Rocigaot/status/947889293808283649"
"1/1/2018 18:52:09","19","947888187405488130","9","Como siempre os recuerdo, los tuits carroñeros y los clickbaits, mejor con captura, que con link se llevan visitas.","twitter.com/Rocigaot/status/947888187405488130"
"1/1/2018 18:48:07","56","947887174497783808","34","pic.twitter.com/qDSfwvOlkJ","twitter.com/Rocigaot/status/947887174497783808"
"1/1/2018 13:48:19","26","947811725046439936","1","Radetzky. Hora de poner el volumen a tope y despertar a los vecinos que ayer teníab a Melendi a las 5 a todo trapo.","twitter.com/Rocigaot/status/947811725046439936"
"1/1/2018 13:29:39","1","947807027673403392","","Concierto de año nuevo a todo trapo. Para eso lo retransmiten, para que la gente se vengue de los vecinos fiesteros de la noche antes.","twitter.com/Rocigaot/status/947807027673403392"
"1/1/2018 13:27:49","","947806564643233793","","Eu tiña un top ciertopelo monísimo de cando estivera de moda alá a principios de século. Teño que ver se o atopo e se quepo dentro.","twitter.com/Rocigaot/status/947806564643233793"
"1/1/2018 13:25:35","4","947806002635792386","","Los trajes de ciertopelo de los bailarines os traumatizan a los no gallegos porque no estáis acostumbrados a los estilismos de los novios en 'Casamos'. #monóculos2018","twitter.com/Rocigaot/status/947806002635792386"
"1/1/2018 12:32:15","3","947792580691062785","","Product placement de Lladró.#Monoculos2018","twitter.com/Rocigaot/status/947792580691062785"
"1/1/2018 2:13:12","6","947636794425774080","","Otro año que ha terminado sin cumplir mi propósito de encontrar trabajo escribiendo los rótulos de Cachitos.","twitter.com/Rocigaot/status/947636794425774080""date","fav","id","rt","text","url"
"23/2/2018 1:17:51","244","966829422505545730","145","Plot twist: Puigdemont entra de nuevo en Cataluña y consigue tomar posesión de su escaño. Ningún policía se atreve a acercarse porque imagina el ridículo si es Joaquín Reyes otra vez.","twitter.com/Rocigaot/status/966829422505545730"
"22/2/2018 0:24:11","507","966453529324945410","300","08;30-> Uf, qué sueño
12:00-> Uf, qué sueño
16:00-> Uf, qué sueño
23:00-> Sigo con sueño, hoy sí que duermo del tirón.
00:20->pic.twitter.com/qcF7nDYaf9","twitter.com/Rocigaot/status/966453529324945410"
"19/2/2018 11:55:37","31","965540368572993537","11","Lo que no entiendo es a qué tiene que buscarle Marta Sánchez letras nuevas al himno de España cuando ya tiene una letra oficial y reconocida por todos, que es la de 'Franco, Franco, que tiene el culo blanco'.","twitter.com/Rocigaot/status/965540368572993537"
"25/2/2018 0:19:24","64","967539486354804736","21","Yo aún no tengo ni el aborto ni el perro, voy atrasadísima con mis proyectos de vida.https://twitter.com/paulidraper/status/966793226094043136 …UN ABORTO Y UN PERRO quiero sea el nombre de mi banda indie pic.twitter.com/K6wTIPRTDk","twitter.com/Rocigaot/status/967539486354804736"
"23/2/2018 1:19:33","38","966829848147693574","20","Cuando ve que alguien lo mira raro suelta un '¡zanguango!' o tararea 'Vivo con tu madre, en un castillo' y en paz.","twitter.com/Rocigaot/status/966829848147693574"
"18/2/2018 12:22:08","26","965184654457401344","6","Para ahorrar tan poco con su sueldo, esta mujer debe comprar cafés y aguacates por palés.","twitter.com/Rocigaot/status/965184654457401344"
"1/3/2018 0:38:51","5","968993933979258881","","También te digo que lo de 'amiga de los muertos' me suena a niño del sexto sentido o a la serie aquella donde Jennifer Love Hewit era recadera del más allá.","twitter.com/Rocigaot/status/968993933979258881"
"1/3/2018 0:37:24","8","968993568022061057","","Mi abuela finge lipotimias en los velatorios para ser el centro de atención, podrían ser partners in crime.https://twitter.com/lavozdegalicia/status/968992140549345290 …Una mujer se hace pasar por amiga de los muertos para robar bolsos en los velatorios de Ferrol http://lavoz.gal/qnl4c7  pic.twitter.com/bubr1BE5dN","twitter.com/Rocigaot/status/968993568022061057"
"28/2/2018 21:06:14","1","968940425565425665","","Efectivamente. Si tienes perspectivas de trabajo y sueldo digno te planteas aprender una lengua. Si no te da ni para irte bajo un puente, como que no.","twitter.com/Rocigaot/status/968940425565425665"
"28/2/2018 15:45:02","660","968859596021551104","364","En las CCAA con lenguas cooficiales no tendremos médicos si no vienen de comunidades monolingües porque, como todos saben, aquí no ha llegado la medicina moderna. Nuestros curanderos sacrifican una cabra a los dioses si alguien enferma.","twitter.com/Rocigaot/status/968859596021551104"
"28/2/2018 15:42:50","23","968859039147884544","13","pic.twitter.com/mSUNx16wBI","twitter.com/Rocigaot/status/968859039147884544"
"28/2/2018 14:11:18","8","968836005003517953","","No sé hasta qué punto esto se debe a la diferencia de frío seco y húmedo y cuánto se debe a que ya no tengo 19 años.","twitter.com/Rocigaot/status/968836005003517953"
"28/2/2018 14:08:23","27","968835272250097665","1","Yo cuando llegábamos a 5 bajo cero en Salamanca:
- Vale, hoy me pongo el abrigo gordo en vez de la cazadora.
Yo en Coruña a 3 grados (sobre cero):
- VAMOS A MORIR TODOS DE CONGELACIÓN, POR AHÍ VIENEN LOS CAMINANTES BLANCOS","twitter.com/Rocigaot/status/968835272250097665"
"28/2/2018 8:52:25","","968755755477323777","","ahora ya parece que quiere pasar a granizo","twitter.com/Rocigaot/status/968755755477323777"
"27/2/2018 23:18:23","","968611295619698691","","En Coruña city?pic.twitter.com/xyXxCSvG6o","twitter.com/Rocigaot/status/968611295619698691"
"27/2/2018 22:51:39","10","968604569466007553","1","Madre mía, mucho ha cambiado Salamanca desde que viví allí para que tengan por lo menos seis ultraizquierdas.","twitter.com/Rocigaot/status/968604569466007553"
"27/2/2018 22:49:58","1","968604144926896128","","¿Otra vez va a nevar hasta en Barcelona y para nosotros na de na?pic.twitter.com/FBqSmCPjm1","twitter.com/Rocigaot/status/968604144926896128"
"27/2/2018 22:32:07","3","968599653536198663","","Dale ánimos! A mí me hicieron la 2ª conización en diciembre de 2016,  ahora me han pasado de nuevo a revisión anual. Es una mierda ir cada poco tiempo, pero si así puedes zafar con el cono en vez de una operación más dura, bienvenido sea.","twitter.com/Rocigaot/status/968599653536198663"
"27/2/2018 22:04:49","3","968592782343499787","","El mío ahora no creo que lo quieran ni pa hacerle peluquines a Oneto, que ya debe de ser todo cana debajo del tinte, y me da rabia no haber sabido de esto hace años, cuando tenía pelazo.","twitter.com/Rocigaot/status/968592782343499787"
"27/2/2018 20:24:40","4","968567577374089216","","si le han dicho que van a esperar a que tenga cáncer que reclame y pida cambio de médico, que es una burrada. Si con CIN II ya te operan, que aún es lesión precancerosa! Le habrá tocado el opusino de turno que intenta hacerla sentir culpable?","twitter.com/Rocigaot/status/968567577374089216"
"27/2/2018 14:57:58","","968485361289777153","","yo creo que lo bloqueé yo a él, también hace siglos, cuando aún no existía el mute,pic.twitter.com/oCbZzOWDs1","twitter.com/Rocigaot/status/968485361289777153"
"27/2/2018 13:49:04","","968468024318709760","","Yo nunca he tenido mucho trato con ella porque no es una persona lo que se dice agradable, pero estas cosillas se las valoro mucho.","twitter.com/Rocigaot/status/968468024318709760"
"27/2/2018 13:44:16","2","968466813951643649","","Mi abuela lo hace con los que le bloquean el camino de casa cuando van a buscar a los críos al cole. Mira que a mi me angustia un poco envejecer, pero me consuela lo de 'a los 90 podré hacer esas cosas y alegar que se me va la olla por la edad'","twitter.com/Rocigaot/status/968466813951643649"
"27/2/2018 12:09:16","","968442905579917312","","","twitter.com/Rocigaot/status/968442905579917312"
"27/2/2018 1:17:05","16","968278780711264256","","He empezado a redactar la memoria de la propuesta de aula de las prácticas y oye, no había valorado lo suficiente la habilidad de vender humo que me dejó mi breve paso por el marketing y la innovation.","twitter.com/Rocigaot/status/968278780711264256"
"25/2/2018 0:44:44","10","967545864498577408","","La gente en Tinder miente bastante, así que tienes que considerar la posibilidad de que no sea un monete de verdad. Que luego vienen los chascos.","twitter.com/Rocigaot/status/967545864498577408"
"25/2/2018 0:43:04","2","967545445332512769","","Viendo de qué va lo de 'Un aborto y un perro', la versión de Fleibur me convence más.https://twitter.com/Dr_Fleibur/status/967412240281489408 …UN ABORTO Y UN PERRO ¡LA SERIE! pic.twitter.com/Djz278K6H2","twitter.com/Rocigaot/status/967545445332512769"
"25/2/2018 0:24:00","29","967540644704071680","3","Tomé un par de veces la píldora del día después y tuve un periquito. No es lo mismo pero mi madre y mi abuela sólo tuvieron 1hija cada una, así que igual en mi familia vamos por lo low-cost.","twitter.com/Rocigaot/status/967540644704071680"
"24/2/2018 16:05:07","4","967415094983446528","1","Madre mía, ¿qué será lo próximo? ¿Subir una foto con filtros?pic.twitter.com/o130LIDrWj","twitter.com/Rocigaot/status/967415094983446528"
"24/2/2018 15:56:20","","967412887814893568","","WHAT???pic.twitter.com/GouMBmK42I","twitter.com/Rocigaot/status/967412887814893568"
"22/2/2018 23:21:05","11","966800036540616704","2","-¿Y qué te hizo escoger el Bachillerato de Humanidades? 
-Como no soy buen estudiante me dijeron mis padres que mejor letras, que en ciencias me iba a ir fatal.
Cada año tengo mínimo uno así en clases particulares. Y frustrándose bastante porque en 'la opción fácil' van fatal.","twitter.com/Rocigaot/status/966800036540616704"
"22/2/2018 22:12:37","1","966782804863406080","","eu aínda estou esperando a que me mande a equivalencia en terróns da tarta* de panteiras rosas que lle fixemos a unha amiga polo cumple.
*'tarta'=trintaepico panteras rosas unidas con nata e cubertas de fondant rosa.","twitter.com/Rocigaot/status/966782804863406080"
"22/2/2018 22:09:44","1","966782079735300102","","¿y lo bonito que es descubrirlo por casualidad?","twitter.com/Rocigaot/status/966782079735300102"
"22/2/2018 22:05:19","1","966780970190897152","","Terroncitos está a ler o teu tuit desta guisa:pic.twitter.com/mGAiu2GQCh","twitter.com/Rocigaot/status/966780970190897152"
"22/2/2018 21:51:00","","966777366663127040","","He puesto lo de First Dates y cómo puede ser el señoro del club de los viernes 7 años más joven que yo, gensanta.","twitter.com/Rocigaot/status/966777366663127040"
"22/2/2018 20:23:10","2","966755261968015365","","Mira, pa que critiquéis los Celebrities por no parecerse a los imitados.https://twitter.com/eldiarioes/status/966716759381331968 …EXCLUSIVA | La Policía intenta detener a Joaquín Reyes caracterizado como Puigdemont http://vertele.eldiario.es/noticias/policia-Joaquin-Reyes-caracterizado-Puigdemont_0_1987901206.html … En @Vertele pic.twitter.com/pyEph5nO02","twitter.com/Rocigaot/status/966755261968015365"
"22/2/2018 14:21:53","9","966664339792031744","1","'Bricomanía con perretes' es un programa que yo vería.https://twitter.com/PunkDeLaCiencia/status/965999988600918016 …Fotos del perro de mi amigo ayudando a montar un mueble, porque si pic.twitter.com/l3iaTg28C5","twitter.com/Rocigaot/status/966664339792031744"
"22/2/2018 14:18:52","5","966663582460104704","","Una hora de retraso. Los visitadores siguen revoloteando por aquí.pic.twitter.com/RCWEbJh30t","twitter.com/Rocigaot/status/966663582460104704"
"22/2/2018 13:53:11","5","966657119134023680","2","Cuando llevan media hora de retraso en el médico y ves a un visitador posicionándose para colarse.pic.twitter.com/5w399ORRqZ","twitter.com/Rocigaot/status/966657119134023680"
"22/2/2018 8:46:08","5","966579849057001472","","Yo cuando mis amigas más jóvenes me sueltan lo de que le gustan los de mi edad porque son más maduros.pic.twitter.com/8uk6UUKjSU","twitter.com/Rocigaot/status/966579849057001472"
"22/2/2018 1:12:02","13","966465570718789633","","pic.twitter.com/iBjGoHphOk","twitter.com/Rocigaot/status/966465570718789633"
"21/2/2018 0:31:41","2","966093027151360000","","En principio en el cole me han dado bastante carta blanca en plan 'mientras cumplas el programa móntate las clases como quieras'. Ahora esperad que no entregue la memoria y los del máster me digan 'esto no es innovador ni original, Ken Robinson se mea en tu propuesta de aula'","twitter.com/Rocigaot/status/966093027151360000"
"21/2/2018 0:21:29","3","966090458450538498","","Bertín entrevistando a los del departamento de prácticas del máster que me iban a dar la orientación antes de empezar el practicum.pic.twitter.com/r11wEbOQQQ","twitter.com/Rocigaot/status/966090458450538498"
"21/2/2018 0:14:19","2","966088656187543552","","Que al final zafaré porque  una no se pasa casi 10 años currando en periodismo sin aprender a rellenar con paja.","twitter.com/Rocigaot/status/966088656187543552"
"21/2/2018 0:12:36","3","966088224262078464","","Considerando que escapé de lo del marketing digital porque se me da fatal vender motos, las memorias de las prácticas del máster no están siendo mi momento favorito de lo que va de año, no.","twitter.com/Rocigaot/status/966088224262078464"
"20/2/2018 17:47:34","10","965991326583017473","1","pic.twitter.com/ezzWGWvbAX","twitter.com/Rocigaot/status/965991326583017473"
"20/2/2018 15:17:08","","965953470963617793","","Viendo quiénes tienen más inquina al peinado de Anna Gabriel en mi FB, lo que quisieran es ese pelo para ellos pa taparse el cartón, también te digo.","twitter.com/Rocigaot/status/965953470963617793"
"19/2/2018 12:06:10","1","965543024460795904","","cierto! Llevadme tabaco a la cárcel, que lo podré usar como moneda de cambio ","twitter.com/Rocigaot/status/965543024460795904"
"19/2/2018 12:02:08","7","965542009246232576","","Eso sí, en vista del cariz que están tomando los acontecimientos, negaré haber cantado cualquiera de ambas versiones cuando hacía EGB, que no sé si habrá prescrito.","twitter.com/Rocigaot/status/965542009246232576"
"19/2/2018 11:56:50","3","965540674757152769","3","Aunque queda ahí el conflicto de las dos Españas: los de 'Y Felipe de Borbón se lo lava con jabón' vs los de 'Y Felipe de Borbón se lo lava con Colón'.","twitter.com/Rocigaot/status/965540674757152769"
"18/2/2018 12:20:41","62","965184291008376832","61","Nos tenemos que creer al mismo tiempo de Cifu con su sueldo sólo tiene 3000 euros ahorrados y que los submileuristas podemos juntar para la jubilación si nos quitamos el café.https://twitter.com/eldiarioes/status/964986507596648448 …Cifuentes, sobre Granados: '¿Van a creer al que tenía un millón en el altillo o a mí, que vivo de alquiler y tengo 3.000 euros en la cuenta?' http://www.eldiario.es/politica/Cifuentes_0_741226320.html … pic.twitter.com/eoqkpakjVE","twitter.com/Rocigaot/status/965184291008376832"
"17/2/2018 20:36:43","","964946734278422531","","los vi en el Gadis hace unas semanas y tuve un flashback ochentero: son clavaditos al bebé lagarto de 'V'.","twitter.com/Rocigaot/status/964946734278422531"
"17/2/2018 15:06:50","34","964863713210662912","10","Que desde luego, cómo sois. Que pretendéis tomar cafés, o ir a cenar con amigos, con lo gratificantes que es limitar tu vida a trabajar y dormir el mínimo imprescindible para seguir siendo medianamente productivo.","twitter.com/Rocigaot/status/964863713210662912"
"17/2/2018 14:58:39","149","964861654075891714","113","'Si no sales de cañas, no te tomas un café fuera de casa, no pones la calefacción, comes una vez al día y compartes piso con 15 personas más por el sistema de la cama caliente puedes ahorrar tu sueldo casi íntegro'. Próximamente en Antena 3.","twitter.com/Rocigaot/status/964861654075891714"
"17/2/2018 14:55:58","5","964860978654572544","5","Ese es el problema, que nos damos caprichitos como un café de 1,20 al día. Ahí, dejándonos llevar por el lujo y el oropel pudiendo colarlo en casa con un calcetín viejo.https://twitter.com/A3Noticias/status/964548973032886273 …Si evitas el gasto de un café diario, podrás ahorrar 28.000 euros durante tu vida laboral http://atres.red/cb1as1 ","twitter.com/Rocigaot/status/964860978654572544"
"17/2/2018 14:39:07","18","964856740939554816","5","A mí hace años un fulano de mi gimnasio que curraba en un banco me dijo que es que para la gente de sueldos altos es más dura la crisis porque claro, tienen que mantener otro nivel de vida (BMW en vez de Ford Fiesta, segunda residencia, cole privado pa los nenes...).pic.twitter.com/ZRarkgo5wr","twitter.com/Rocigaot/status/964856740939554816"
"17/2/2018 1:38:01","1","964660167978741760","","En el cole donde hago las prácticas tenemos una peque de padre británico que habla inglés con un acento digno de salir en Downton Abbey., Me acompleja y todo. ","twitter.com/Rocigaot/status/964660167978741760"
"17/2/2018 1:35:12","2","964659459913109504","","Yo a mis amigos con perros ya les digo que no voy a hacer lo de quedar con ellos y estar pendiente del móvil, pero si quedo y traen a sus perretes, ellos pasan a segundo plano. Lo tienen asimilado.","twitter.com/Rocigaot/status/964659459913109504"
"17/2/2018 1:30:07","105","964658182969856000","16","¿Soy la única que considera una falta grave de educación 'quedo contigo y te ignoro para estar pendiente del móvil' pero justifica totalmente 'quedo contigo y te ignoro porque hay un perrete con el que jugar'?","twitter.com/Rocigaot/status/964658182969856000"
"16/2/2018 18:23:52","","964550913317834752","","Mira el lado bueno: si al final tu cita no te gusta, igual en la fiesta conoces a uno mejor. ","twitter.com/Rocigaot/status/964550913317834752"
"14/2/2018 14:20:48","1","963764967467085824","","A esta nada, de hecho le tocó buscar ella el hostel sobre la marcha porque no tenía alojamiento, como supuestamente quedaba en la casa de la familia aquella...la gente es muy hostiable.","twitter.com/Rocigaot/status/963764967467085824"
