"date","fav","id","rt","text","url"
"20/12/2016 22:19:53","","811320239875100672","","aínda que o estou a ler e o das 1.000 calorías por persona será na casa de quen redactou eso. XD","twitter.com/Rocigaot/status/811320239875100672"
"20/12/2016 22:17:17","1","811319587614720002","","igual refírense a en comparativa co resto do ano XD","twitter.com/Rocigaot/status/811319587614720002"
"20/12/2016 21:59:31","","811315113101668352","","si, photoshop old style!","twitter.com/Rocigaot/status/811315113101668352"
"20/12/2016 21:42:47","1","811310903555715074","","Es mi programa de terror favorito!","twitter.com/Rocigaot/status/811310903555715074"
"20/12/2016 21:42:13","","811310762106953728","","https://www.youtube.com/watch?v=ki0SU13Bf5E …","twitter.com/Rocigaot/status/811310762106953728"
"20/12/2016 21:29:41","3","811307607357001731","1","Cando o compras en Aliexpress vs cando te chega.","twitter.com/Rocigaot/status/811307607357001731"
"20/12/2016 21:24:00","1","811306177212596224","","no te creas, lo peor que te puede tocar son vecinos que viven en la dinámica bronca-polvo-bronca-polvo.","twitter.com/Rocigaot/status/811306177212596224"
"20/12/2016 21:22:03","","811305684537114624","","sí, si estos son más de follar de tardes. Por la noche rara vez los oigo. Por la noche lo que oigo es a los niños berreando.","twitter.com/Rocigaot/status/811305684537114624"
"20/12/2016 21:19:58","1","811305159682850816","","Bueno, parece que ya llegó la traca final. Por suerte son de polvo escandaloso pero breve.","twitter.com/Rocigaot/status/811305159682850816"
"20/12/2016 21:15:56","","811304148125814785","","mejores vecinos EVER. Apenas hacían ruido. Y además el chaval estaba buenillo y los perros eran preciosos.","twitter.com/Rocigaot/status/811304148125814785"
"20/12/2016 21:15:12","","811303960090988548","","Ay, echo de menos la época en mi ex piso donde estaba el edificio vacío menos mi piso y otro más arriba donde vivía un chaval con sus perros","twitter.com/Rocigaot/status/811303960090988548"
"20/12/2016 21:13:49","1","811303613599547392","","Que a lo mejor si los críos se pasan todo el puto día berreando no es porque estén a monte sino para no oír el numerito.","twitter.com/Rocigaot/status/811303613599547392"
"20/12/2016 21:11:20","4","811302987004055552","","Queridos vecinos: igual si yo os estoy oyendo follar desde el edificio de al lado, vuestros hijos en el mismo piso se coscan también.","twitter.com/Rocigaot/status/811302987004055552"
"20/12/2016 21:02:54","4","811300867123068928","1","-Te quiero
-pic.twitter.com/Z5Rejscd3d","twitter.com/Rocigaot/status/811300867123068928"
"20/12/2016 19:54:58","1","811283771408416769","","sí, yo también! Qué loco mundo, ya no sabes si hablan de raza aria o de bizcochos de tienda ecológica!","twitter.com/Rocigaot/status/811283771408416769"
"20/12/2016 18:28:38","","811262044443963392","","todavía no he reunido valor para verlo entero, pero por lo que estoy viendo y leyendo por aquí, WTF.","twitter.com/Rocigaot/status/811262044443963392"
"20/12/2016 18:06:54","3","811256575398735874","","Lo de poner los ojos en blanco hasta verme el cerebro cuando empieza a rular por FB el anuncio de Campofrío ya es tradición navideña.","twitter.com/Rocigaot/status/811256575398735874"
"20/12/2016 16:12:21","","811227748211585024","","ay, yo mogollón.","twitter.com/Rocigaot/status/811227748211585024"
"20/12/2016 16:09:51","2","811227118386479104","","es normal,lo hacen todos'. Ya lo era cuando fingíamos que iba a ir un ojeador de la Nasa a la guarde del tuyo","twitter.com/Rocigaot/status/811227118386479104"
"20/12/2016 16:08:48","1","811226852912201728","","que finjan creer que mi bebé es superdotado por aporrear las lucecicas de la tablet y no me digan 'eso (2)","twitter.com/Rocigaot/status/811226852912201728"
"20/12/2016 16:08:02","","811226661089923072","","a mí si en unos años me da la ventolera de ser madre pienso dar mucho el coñazo a mis amigas mamás, y exijo(1","twitter.com/Rocigaot/status/811226661089923072"
"20/12/2016 16:07:05","","811226420269764608","","y lo de hablar en 1ª persona del plural: 'ya comemos solitos. Ya sabemos pedir para hacer caca'.","twitter.com/Rocigaot/status/811226420269764608"
"20/12/2016 16:05:01","","811225900813533184","","otra como yo, que no tengo ni block de PacoFutura, ni block de Dalas ni na. XD","twitter.com/Rocigaot/status/811225900813533184"
"20/12/2016 15:48:06","1","811221644471599105","","no sé si opinarás lo mismo al ver mi proyecto henprendedor del Linkedin para niños XDDD","twitter.com/Rocigaot/status/811221644471599105"
"20/12/2016 15:47:09","1","811221404393861120","","que no me preocupe porque se lucren a mi costa, sino porque sería responsable intelectual del invento.","twitter.com/Rocigaot/status/811221404393861120"
"20/12/2016 15:45:44","","811221050390364160","","a que sí? hasta me inquieta soltarlo por aquí de coña, no sea que alguien pile la idea y la haga realidad.","twitter.com/Rocigaot/status/811221050390364160"
"20/12/2016 15:41:19","2","811219938035793920","1","ellos, no necesariamente en este orden. Lo digo de coña, pero lo peor es que creo que lo petaría.","twitter.com/Rocigaot/status/811219938035793920"
"20/12/2016 15:40:17","3","811219675774414848","1","ir haciéndoles currículum de cara al futuro doble grado Derecho+Ade en Inglaterra y para competir entre (3)","twitter.com/Rocigaot/status/811219675774414848"
"20/12/2016 15:39:34","3","811219496459444224","1","los padres pueden ir metiendo todas las extraescolares y proyectos extraescolares de sus retoños, para (2)","twitter.com/Rocigaot/status/811219496459444224"
"20/12/2016 15:39:07","4","811219384698077184","2","ya lo he dicho antes, pero si me diera por HEMPRENDER montaba una especie de Linkedin para niños. Donde(1)","twitter.com/Rocigaot/status/811219384698077184"
"20/12/2016 15:31:49","","811217544770187264","","sí, de las que hacen con los niños mientras tú estás durmiendo las mil resacas.","twitter.com/Rocigaot/status/811217544770187264"
"20/12/2016 15:29:04","","811216855872503808","","cuando tienes amigas mamás esas fotos te llegan al whatsapp el domingo a las 8.30, en plena resaca. XDDD","twitter.com/Rocigaot/status/811216855872503808"
"20/12/2016 15:26:05","3","811216104358117377","","en serio, hay críos que no tienen madre, tienen personal assistant.","twitter.com/Rocigaot/status/811216104358117377"
"20/12/2016 15:23:29","1","811215448490569728","","las otras mamás y renunciar a tu tiempo libre y hobbies para prepararle manualidades Montessori y demás rollos educativos.","twitter.com/Rocigaot/status/811215448490569728"
"20/12/2016 15:22:54","","811215302042222592","","y ya no te digo de ser mamá, que se presupone que eres la que tiene que llevarle la agenda, socializar por whatsapp con (1)","twitter.com/Rocigaot/status/811215302042222592"
"20/12/2016 11:47:10","","811161009851351040","","Urge que @hematocritico dedique una entrada del Hematocrítico de Arte al cuadro de Paco.pic.twitter.com/B93G3gl6Il","twitter.com/Rocigaot/status/811161009851351040"
"20/12/2016 11:46:07","4","811160748906991616","5","Cuando escoges imagen de perfil en Tinder para ligar con jóvenes casaderas de clase alta del S. XIXpic.twitter.com/g9yKd6sNXA","twitter.com/Rocigaot/status/811160748906991616"
"20/12/2016 11:41:56","","811159696363155457","","El cuadro de nuestro ex alcalde Paco Vázquez, también ex embajador en el Vaticano, para poner en el Ayuntamiento≤","twitter.com/Rocigaot/status/811159696363155457"
"20/12/2016 11:35:36","3","811158099633573888","3","Cuando te casas y tu tía abuela decide que el dinero es muy impersonal y mejor os regala algo para decorar la casa.pic.twitter.com/1fv6e6OYZ2","twitter.com/Rocigaot/status/811158099633573888"
"20/12/2016 11:30:35","5","811156840474181632","5","Nos estamos centrando en la vestimenta y obviando los años y kilos que se ha hecho quitar Paco en el cuadro. Ni una portada del Vogue.pic.twitter.com/IUXM2w8fTD","twitter.com/Rocigaot/status/811156840474181632"
"20/12/2016 1:36:58","1","811007450484719616","","Ni ese tengo. Si es que no soy nadie.","twitter.com/Rocigaot/status/811007450484719616"
"20/12/2016 1:30:04","1","811005712180645888","","yo ni ese! el único block clásico que tengo es el de Albondiguilla Junior, que yo sepa.","twitter.com/Rocigaot/status/811005712180645888"
"20/12/2016 1:11:16","2","811000980624044032","","¡Aficionados, se van a la montaña con cualquier trapillo que tienen por casa!","twitter.com/Rocigaot/status/811000980624044032"
"20/12/2016 1:08:54","1","811000388660985856","","claro, es que hay que ir bien equipada.","twitter.com/Rocigaot/status/811000388660985856"
"20/12/2016 1:05:31","4","810999534436249600","","Mañana me voy a la sección de montaña del Decathlon y copio este outfit enterito.https://twitter.com/MirEdeC/status/810851091667709952 …Yo siempre que subo a la nieve
Cómoda pero informal
y preparada para cualquier imprevisto pic.twitter.com/7Y7Xhgwikz","twitter.com/Rocigaot/status/810999534436249600"
"20/12/2016 0:48:48","2","810995329516634115","","gran idea emprendedora! XDDDD","twitter.com/Rocigaot/status/810995329516634115"
"20/12/2016 0:43:34","2","810994012245151744","","hostias, las pulseritas del no podéis, ya no me acordaba del invento aquel! XDDDD","twitter.com/Rocigaot/status/810994012245151744"
"20/12/2016 0:17:57","1","810987564538556416","","Soy una loser total!","twitter.com/Rocigaot/status/810987564538556416"
"20/12/2016 0:15:01","18","810986826143907840","2","Cuando eres la única pringada de tu TL que no tiene block de PacoFutura.pic.twitter.com/4xvqdK8TGN","twitter.com/Rocigaot/status/810986826143907840"
"19/12/2016 23:16:00","1","810971974960902145","","a mí tampoco. Joder, qué poco pintamos en twitter.","twitter.com/Rocigaot/status/810971974960902145"
"19/12/2016 23:07:28","2","810969825682059265","","@oneafter909_ eu non podo oír ou ler 'ciberespacio' sen tararear a de 'Te di mi corazón arroba love punto com'","twitter.com/Rocigaot/status/810969825682059265"
"19/12/2016 22:44:50","1","810964131947888645","","ni idea, yo con un camión el único que recuerdo es este. se me puede pasar alguno por alto.","twitter.com/Rocigaot/status/810964131947888645"
"19/12/2016 22:42:27","1","810963531298471936","","igual te suena del del desfile del 14 de julio en Niza, en mercadillo de Navidad no recuerdo ninguno.","twitter.com/Rocigaot/status/810963531298471936"
"19/12/2016 22:31:55","1","810960881152589824","","venga! te puede servir de entrenamiento! XD","twitter.com/Rocigaot/status/810960881152589824"
"19/12/2016 22:17:39","1","810957291608477696","","soy el espíritu de las antinavidades, repartiendo cinismo y cirrosis XD","twitter.com/Rocigaot/status/810957291608477696"
"19/12/2016 22:11:41","61","810955787929534474","59","Voy dejando ya el bingo navideño de beber edición 2016, antes de que ocurran más cataclismos. Ya sabéis como va el tema.pic.twitter.com/fF69uvmB0I","twitter.com/Rocigaot/status/810955787929534474"
"19/12/2016 21:59:02","","810952607128813569","","Pues no, cinco minutos han callado.","twitter.com/Rocigaot/status/810952607128813569"
"19/12/2016 21:56:45","1","810952030382649344","","Parece que los vecinos vuelven a sus broncas old style. Si siguen el esquema de siempre, ahora callarán un rato y en una hora retoman.","twitter.com/Rocigaot/status/810952030382649344"
"19/12/2016 21:47:21","4","810949665059377153","1","Great minds think alike XDhttps://twitter.com/Rocigaot/status/810943648003133440 …Está visto que para el mundo en general 2016 está siendo lo que fue 2007 para Britney.","twitter.com/Rocigaot/status/810949665059377153"
"19/12/2016 21:23:26","8","810943648003133440","8","Está visto que para el mundo en general 2016 está siendo lo que fue 2007 para Britney.","twitter.com/Rocigaot/status/810943648003133440"
"19/12/2016 21:10:45","","810940454166478848","","no me tiene block, soy una mindundi!","twitter.com/Rocigaot/status/810940454166478848"
"19/12/2016 20:04:41","","810923827467341824","","Y es por estas cositas que mi sueño adolescente de ser reportera internacional tenía pocas opciones de cumplirse.","twitter.com/Rocigaot/status/810923827467341824"
"19/12/2016 20:03:11","12","810923449178787841","2","Decidme que no soy la única paleta que cuando en los TT está Erdogan lee 'El Drogas' y por un  momento piensa que es algo de Barricada.","twitter.com/Rocigaot/status/810923449178787841"
"19/12/2016 18:09:59","1","810894962476875776","","yo lo sigo diciendo. Pero claro, yo soy vieja.","twitter.com/Rocigaot/status/810894962476875776"
"19/12/2016 18:04:27","2","810893570890760192","1","Pacofutura gonna pacofuture","twitter.com/Rocigaot/status/810893570890760192"
"19/12/2016 17:52:52","1","810890654331052032","","#sapicaoPaco","twitter.com/Rocigaot/status/810890654331052032"
"19/12/2016 17:48:54","2","810889656191647744","","Necesito un Celebrities de Pacofutura y otro de Ajram. Tuitstars con influencia, a ver si convencéis a Joaquín Reyes ahí.","twitter.com/Rocigaot/status/810889656191647744"
"19/12/2016 17:47:09","1","810889215709970432","","enjoyhttps://twitter.com/alitecarlito/status/810880682306273281 …¿Por que nadie me aviso de esto? pic.twitter.com/qVxtzJaPUP","twitter.com/Rocigaot/status/810889215709970432"
"19/12/2016 17:44:31","7","810888551957229569","5","¡Ha dicho Paco!pic.twitter.com/QxQeSkd19A","twitter.com/Rocigaot/status/810888551957229569"
"19/12/2016 17:43:25","1","810888277892984832","","no, por eso le llamo Pacofutura en vez de abreviar a Paco!","twitter.com/Rocigaot/status/810888277892984832"
"19/12/2016 17:42:04","8","810887935419645952","","Menos mal que me hacéis de cuñaders curators y me llegan las perlas escogidas de Pacofutura y similares sin tener que desmutear.","twitter.com/Rocigaot/status/810887935419645952"
"19/12/2016 17:35:57","","810886396588228609","","no lo dudo! XD","twitter.com/Rocigaot/status/810886396588228609"
"19/12/2016 17:34:48","4","810886107831353344","1","¿Cuántas de las personas que eran pandi cuando las muteé se habrán enemistado a muerte en este tiempo sin yo enterarme?","twitter.com/Rocigaot/status/810886107831353344"
"19/12/2016 17:27:40","1","810884315034882048","","pic.twitter.com/Rh1Y8xapzB","twitter.com/Rocigaot/status/810884315034882048"
"19/12/2016 15:52:14","1","810860297137360896","4","#Vamosamorirtodoshttps://twitter.com/adiplotti/status/810860111187103744 …¿Cómo que se cumplen quince años del estreno de La Comunidad del Anillo? Eso no puede ser.","twitter.com/Rocigaot/status/810860297137360896"
"19/12/2016 15:51:52","2","810860204216745984","","A mí me salió el Caballo porque yo soy muy de gulags.","twitter.com/Rocigaot/status/810860204216745984"
"19/12/2016 14:49:11","1","810844430408228864","1","(en el test y en la vida en general)","twitter.com/Rocigaot/status/810844430408228864"
"19/12/2016 14:48:56","2","810844365853773824","1","gulags+bechamel es la combinación mágica! :D","twitter.com/Rocigaot/status/810844365853773824"
"18/12/2016 23:47:28","1","810617507115630593","","no podía, que me quedaban lejos y no me fío de mi puntería. Si se hubieran plantado bajo mi ventana, todavía.","twitter.com/Rocigaot/status/810617507115630593"
"18/12/2016 23:23:00","2","810611347172061185","1","Un rato pasando frío en la ventana a ver si los que se estaban amenazando con hostiarse se hostiaban de una vez, y na. Publicidad engañosa.","twitter.com/Rocigaot/status/810611347172061185"
"18/12/2016 22:47:58","3","810602533785862147","1","'La burbuja de las momias'. Cuando momificábamos por encima de nuestras posibilidades. #CuartoMilenio","twitter.com/Rocigaot/status/810602533785862147"
"18/12/2016 22:40:07","1","810600557761228809","","quedo máis tranquila! E aínda molaba, unha momia chamada Francisquito!","twitter.com/Rocigaot/status/810600557761228809"
"18/12/2016 22:36:25","6","810599624939569153","1","Friker ha dicho 'Ramsés quinto' y he entendido 'Francisquito'. Igual debería irme a dormir pronto.","twitter.com/Rocigaot/status/810599624939569153"
"18/12/2016 22:32:32","1","810598646597173248","","estaba bebiendo y acaba de salirme el agua por la nariz XDDD","twitter.com/Rocigaot/status/810598646597173248"
"18/12/2016 22:28:50","2","810597718057951233","1","Acabo de poner a Friker y pinta bien la cosa.pic.twitter.com/jV6G3KsYVf","twitter.com/Rocigaot/status/810597718057951233"
"18/12/2016 15:04:37","7","810485924329091072","","Igual el dueño es como mi abuela, que finge lipotimias cuando no es el centro de atención,y el chucho ya pasa de chantaje emocional.https://twitter.com/MirthaRex/status/809763851197681664 …Un hombre finge un desmayo para grabar la reacción de su perro. 
pic.twitter.com/kXZphdsyn5","twitter.com/Rocigaot/status/810485924329091072"
"18/12/2016 13:46:45","3","810466328746270720","","The horror, the horror.https://twitter.com/PotiPotiInLove/status/810150906696187904 …Acabo de ver este horror, lo he buscado en google, y está el mismo publiartículo atroz en 2339 sitios. pic.twitter.com/niiPQiCN6c","twitter.com/Rocigaot/status/810466328746270720"
"18/12/2016 12:47:48","17","810451495363682304","5","Admitiréis que por pocas probabilidades que tengamos de forrarnos con la lotería,ya son más que las que hay de forrarnos con nuestro trabajo","twitter.com/Rocigaot/status/810451495363682304"
"17/12/2016 18:43:06","","810178522052497408","","Desde hace unos días no puedo enviar Netflix del móvil a la tv con Chromecast, ¿le pasa a alguien más? Con youtube o spotify no hay problema","twitter.com/Rocigaot/status/810178522052497408"
"17/12/2016 18:21:01","1","810172963819520001","","conste que lo de abdominales acolchaos no es original mío, me pegó la expresiónnun colega hace siglos.","twitter.com/Rocigaot/status/810172963819520001"
"17/12/2016 18:19:45","","810172644884705280","","La necesito! De dónde es?","twitter.com/Rocigaot/status/810172644884705280"
"17/12/2016 16:29:19","","810144854588133376","","seguramente! ","twitter.com/Rocigaot/status/810144854588133376"
"17/12/2016 15:21:07","","810127689248112640","","No afina mucho pero le pone ganas, pobre.","twitter.com/Rocigaot/status/810127689248112640"
"17/12/2016 15:20:31","","810127538483789824","","Mi vecino está dándolo todo con su acompañamiento vocal a, según Shazam, 'Ya no', de Manuel Carrasco. Yo pensé que era algo de Pijandro Sanz","twitter.com/Rocigaot/status/810127538483789824"
"17/12/2016 14:50:42","6","810120034861416448","","ahora está de moda el colecho, cómprate el Lego!","twitter.com/Rocigaot/status/810120034861416448"
"17/12/2016 14:23:46","1","810113256924839936","","también será que según quién te salga lo haces público o no ","twitter.com/Rocigaot/status/810113256924839936"
"17/12/2016 14:21:05","","810112582887608321","","el último o última no sé quien es, me estoy quedando atrás en tuiter!","twitter.com/Rocigaot/status/810112582887608321"
"17/12/2016 14:17:15","1","810111616100532225","","resultados al que no tengo mute o block.pic.twitter.com/YXa2YFdH2W","twitter.com/Rocigaot/status/810111616100532225"
"17/12/2016 14:15:46","","810111246502596608","","Voy a probar a ir repitiendo el test probando opciones a ver quién más sale, que sospecho que el Caballo es el único de posibles (...)","twitter.com/Rocigaot/status/810111246502596608"
"17/12/2016 14:12:52","1","810110516312100864","2","Soy @PotiPotiInLove! Pero con los abdominales más acolchaos https://quotev.com/quiz/8901714 ","twitter.com/Rocigaot/status/810110516312100864"
"16/12/2016 12:45:25","1","809726121411493889","","ay, yo tuve uno el año pasado y eran las risas","twitter.com/Rocigaot/status/809726121411493889"
"16/12/2016 9:23:15","1","809675244277551104","","'¡Se sienten, coño!' - Rector de la Univeridad Rey Juan Carlos.","twitter.com/Rocigaot/status/809675244277551104"
"16/12/2016 8:40:51","3","809664571917135872","","'Esto es amor, quien lo probó lo sabe'. - Rector de la Universidad Rey Juan Carlos.","twitter.com/Rocigaot/status/809664571917135872"
"16/12/2016 8:39:12","8","809664158434258944","4","'Nuestras vidas son los ríos que van a dar al mar, que es el morir' -Rector Universidad Rey Juan Carlos.","twitter.com/Rocigaot/status/809664158434258944"
"16/12/2016 1:15:59","2","809552615872888832","","'Empezaron emprendiendo en un arenero de gato' tiene aún más épica de superación que 'empezaron en un garaje'.","twitter.com/Rocigaot/status/809552615872888832"
"16/12/2016 1:08:07","10","809550636354301953","3","Minuto>segundo>milisegundo>lo que tarda tu amiga en volver con su ex cuando le confiesas que siempre te pareció gilipollas.","twitter.com/Rocigaot/status/809550636354301953"
"16/12/2016 1:07:13","1","809550411870928896","","yo suelo decidir que es hora de encender el radiador cuando me los noto apuntando a través del forro polar. xD","twitter.com/Rocigaot/status/809550411870928896"
"16/12/2016 1:01:26","1","809548954186743808","","ay, sí, este lo vi hace un rato y es precioso también. Gracias, señor, porque en mis años de cole de monjas no había youtube.","twitter.com/Rocigaot/status/809548954186743808"
"16/12/2016 1:00:25","1","809548698481020928","","yo garaje no tengo, pero podemos emprender en la plaza de parking de mi madre mientras está en el trabajo XD","twitter.com/Rocigaot/status/809548698481020928"
"16/12/2016 0:59:12","","809548395857772544","","Por culpa de @alitecarlito mañana voy a despertar de la anestesia cantando esto. (Que sé que había visto antes aunque no sé dónde)https://twitter.com/alitecarlito/status/809542985390100480 …Me recuerda Otis esto https://www.youtube.com/watch?v=Mjf02qDAS9I … y el concurso de villancicos de los colegios mayores de Pamplona es mejor que Jesucristo.","twitter.com/Rocigaot/status/809548395857772544"
"16/12/2016 0:55:58","","809547580522827776","","hostia, yo este ya lo había visto! Creo que había bloqueado el recuerdo para superar el shock postraumático.","twitter.com/Rocigaot/status/809547580522827776"
"16/12/2016 0:51:24","","809546429584637952","","hostia, llevaba un rato intentando recordar cómo se llamaba la canción original, que es de mi juventú.","twitter.com/Rocigaot/status/809546429584637952"
"16/12/2016 0:44:56","2","809544804728184833","","hay una idea emprendedora ahí. Cuartetos vocales para felicitar las buenas ejecuciones de sexo oral.","twitter.com/Rocigaot/status/809544804728184833"
"16/12/2016 0:42:56","1","809544298878423040","1","Es maravilloso todo.","twitter.com/Rocigaot/status/809544298878423040"
"16/12/2016 0:39:35","1","809543457513635840","","le mandas a la tuna al trabajo y que se lo explique con la música de Clavelitos y la bandurria.","twitter.com/Rocigaot/status/809543457513635840"
"16/12/2016 0:39:02","1","809543320758317056","","o si das con un fantasma que va diciendo que es un maestro comiendo coños y no distingue el clítoris de un pelo enquistao.","twitter.com/Rocigaot/status/809543320758317056"
"16/12/2016 0:29:07","1","809540823717122048","","pues lo tendría que buscar, pero algo tiene que haber. La otra opción es mandar a la tuna.","twitter.com/Rocigaot/status/809540823717122048"
"16/12/2016 0:27:19","2","809540368664588288","1","Mira que en tema fiestas de colegios y residencias de curas y monjas estoy curtida, y esto me ha dejado picuetísima.https://twitter.com/alitecarlito/status/809531566573649920 …Revisando el clásico 'La Navidad es algo especial' interpretado por los alumnos del colegio mayor año 2008 https://www.youtube.com/watch?v=lWfMMAZ_ndA …","twitter.com/Rocigaot/status/809540368664588288"
"16/12/2016 0:26:24","3","809540141060595713","","No hay término élfico, en lengua Ent o humana para describir este horror.","twitter.com/Rocigaot/status/809540141060595713"
"16/12/2016 0:09:07","1","809535792234299392","","Ya cuando ve que no hay más remedio pasa el pago a la tarjeta, pero con desgana, en plan 'sólo eres un parche'.","twitter.com/Rocigaot/status/809535792234299392"
"16/12/2016 0:07:13","","809535312858939392","","Eliminé la cuenta antigua hace más de un mes, metí la tarjeta de mi cuenta nueva (y luego la cuenta)y sigue intentando enviar pagos a la 1ª.","twitter.com/Rocigaot/status/809535312858939392"
"16/12/2016 0:06:11","7","809535050966593536","1","Madre mía, a Paypal le está costando más asimilar que cambié de cuenta bancaria que a Alba Carrillo asimilar lo de Feliciano.","twitter.com/Rocigaot/status/809535050966593536"
"15/12/2016 23:28:36","","809525593792507904","","es que se avisa antes de que íbais a mirar los dos, que vais a pillar! XDDD","twitter.com/Rocigaot/status/809525593792507904"
"15/12/2016 23:18:54","8","809523153730998272","","Mañana me hacen una cirugía ambulatoria y me han dicho que vaya duchada. Me inquieta pensar por qué tienen que especificarlo.","twitter.com/Rocigaot/status/809523153730998272"
"15/12/2016 22:32:41","1","809511520161923072","","de hecho, en el mismo capítulo de Friends, Monica enviaba el cuarteto a un ex ligue cabrón en plan venganza. XD","twitter.com/Rocigaot/status/809511520161923072"
"15/12/2016 22:28:32","","809510477495730176","","Ay, ahora lo estoy visualizando en mi cabeza y es una escena genial.","twitter.com/Rocigaot/status/809510477495730176"
"15/12/2016 22:08:42","","809505484420116480","","Sería algo así. Y también se lo mandaría al trabajo:https://www.youtube.com/watch?v=LNLvZNRNggs …","twitter.com/Rocigaot/status/809505484420116480"
"15/12/2016 21:53:18","6","809501610225307648","","la próxima vez que me lo hagan bien envío un cuarteto vocal, como Ross a Rachel cuando empezó a trabajar en Bloomingdale.","twitter.com/Rocigaot/status/809501610225307648"
"15/12/2016 20:41:54","1","809483643760635904","","pic.twitter.com/UmxDxrdKao","twitter.com/Rocigaot/status/809483643760635904"
