"date","fav","id","rt","text","url"
"15/12/2016 19:49:18","7","809470403580231685","","'Ay, me voy por esa caja del súper que sólo hay una señora y lleva pocas cosas'. Lo que pasó a continuación te sorprenderá.","twitter.com/Rocigaot/status/809470403580231685"
"15/12/2016 15:12:50","","809400831313321987","","Matching icons for you and your bae.pic.twitter.com/7Kac2ZpsPD","twitter.com/Rocigaot/status/809400831313321987"
"15/12/2016 1:43:02","2","809197038290305024","","oh, el clásico polvo de procastinación. Been there.","twitter.com/Rocigaot/status/809197038290305024"
"15/12/2016 0:08:33","1","809173259124146183","","de momento me llama menos que Netflix, pero mientras tengo el Premium, ya que va incluido, algo veré!","twitter.com/Rocigaot/status/809173259124146183"
"14/12/2016 23:59:23","","809170951518715908","","sí???","twitter.com/Rocigaot/status/809170951518715908"
"14/12/2016 23:10:30","1","809158650988265477","","el mejor Casamos de la temporada, búscalo si quieres en la web porque fue la rida. Aunque sin twitter en tiempo real no es igual","twitter.com/Rocigaot/status/809158650988265477"
"14/12/2016 23:07:57","1","809158007401676806","","llamando al novio por el nombre equivocado.","twitter.com/Rocigaot/status/809158007401676806"
"14/12/2016 23:07:29","1","809157890258960385","","la boda aún no llevaban ni un año juntos, y en las tomas falsas sale no sé qué pariente de ella que llevaba todo el tiempo(2)","twitter.com/Rocigaot/status/809157890258960385"
"14/12/2016 23:06:26","1","809157627141820416","","fue spoteósico, ella estaba preparando la boda con otro, lo dejó y se prometió con este en un par de semanas. El día de(1)","twitter.com/Rocigaot/status/809157627141820416"
"14/12/2016 22:58:37","1","809155660936052740","","porque no eran de aquí, que si no... aunque no superarán a los de Casamos que se conocieron en Mil Anuncios. ","twitter.com/Rocigaot/status/809155660936052740"
"14/12/2016 22:31:48","","809148909868216320","","'Supongo que va buscando algo normal y yo soy bastante normal y cubro sus expectativas'. Derroche de romanticismo en lo de First Dates.","twitter.com/Rocigaot/status/809148909868216320"
"14/12/2016 22:26:29","","809147575165157376","","si es que cómo se te ocurre.","twitter.com/Rocigaot/status/809147575165157376"
"14/12/2016 21:11:42","1","809128755193085952","","Yo le voto!","twitter.com/Rocigaot/status/809128755193085952"
"14/12/2016 19:57:44","4","809110140125413377","","Espe, cuando los políticos vais al Primark porque vais mal de pasta también podéis aparcar legalmente o pillar el metro, te comento.","twitter.com/Rocigaot/status/809110140125413377"
"14/12/2016 19:53:50","","809109159266422784","","aclaro que no digo que me parezca bien que en lo del paro sea así. Digo que es como está ahora mismo.","twitter.com/Rocigaot/status/809109159266422784"
"14/12/2016 16:38:07","2","809059903696474112","","es que hay gente que intenta ligar con argumentario de teleoperador. Con los seductores científicos canta mucho.","twitter.com/Rocigaot/status/809059903696474112"
"14/12/2016 11:35:09","119","808983661106393088","71","Que a veces parece que estar soltera es como estar cobrando el paro, que tienes que aceptar cualquier oferta que recibas por narices.","twitter.com/Rocigaot/status/808983661106393088"
"14/12/2016 11:33:53","237","808983343253561344","164","La respuesta a '¿por qué una mujer que está soltera rechaza salir conmigo?'  es 'porque prefiere seguir soltera a estar contigo'. Y ya.","twitter.com/Rocigaot/status/808983343253561344"
"13/12/2016 23:34:30","","808802303750848512","","yo sí, eso me lo pretendieron hacer la última vez que busqué piso para mí, en 2008.","twitter.com/Rocigaot/status/808802303750848512"
"13/12/2016 23:24:23","1","808799755790942210","","venga, abrimos un verkami para pillar financiación y nos ponemos a ello!","twitter.com/Rocigaot/status/808799755790942210"
"13/12/2016 22:57:29","3","808792985961893888","","'¿me puedo llevar este pintalabios de Kat Von D sin pagarlo si voy poniendo boca pato por la calle para darle visibilidad?'","twitter.com/Rocigaot/status/808792985961893888"
"13/12/2016 22:49:41","1","808791023119925248","","Esto parece Black Mirror meets La que se avecina.","twitter.com/Rocigaot/status/808791023119925248"
"13/12/2016 16:17:01","2","808692207154851840","","(tuit medio en castellano medio en gallego porque estaba whatsappeando a la vez y mi cerebro está licuado XDDD)","twitter.com/Rocigaot/status/808692207154851840"
"13/12/2016 16:16:25","1","808692055178379266","1","creo que voy a bautizar como 'Falacia ad Swiftum' o dos humoristas que cando lles sinalas a casposidade din 'é unha sátira'.","twitter.com/Rocigaot/status/808692055178379266"
"13/12/2016 16:12:22","1","808691035882881029","","pic.twitter.com/308Awpufmo","twitter.com/Rocigaot/status/808691035882881029"
"13/12/2016 15:57:41","","808687341187514368","","para mearse.","twitter.com/Rocigaot/status/808687341187514368"
"13/12/2016 15:50:12","1","808685456665743360","","¿no lo conocías?Hace vines de 'humor' basados en la idea de 'pobre yo que tengo que soportar a la novia para poder meter polla'","twitter.com/Rocigaot/status/808685456665743360"
"13/12/2016 15:37:21","","808682223855616001","","vergüenza de asumir que lo que hacéis es humor de mercadillo, y no vayáis de genios censurados cuando la gente señala la trampa.","twitter.com/Rocigaot/status/808682223855616001"
"13/12/2016 15:36:05","","808681906845970433","","Vais de creativos a base de reciclar (por no decir plagiar) bromas más viejas que el chiste del perro mistetas. Al menos tened la (..)","twitter.com/Rocigaot/status/808681906845970433"
"13/12/2016 15:31:32","2","808680761469628419","1","pero para que fuera 'más violaciones a hombres que a mujeres' tendríamos que estar todas comprando viagra por palés.","twitter.com/Rocigaot/status/808680761469628419"
"13/12/2016 15:30:49","","808680579554299908","1","se limitan a repetir las mismas típicas bromas que ya hacían Arévalo o las Matrimoniadas de José Luis Moreno, sin aportar nada nuevo.","twitter.com/Rocigaot/status/808680579554299908"
"13/12/2016 15:29:12","","808680173444927492","1","'la vigésima novela erótica para aprovechar el tirón de 50 sombras', podemos decir que gran parte de monologuistas y youtubers de humor(...)","twitter.com/Rocigaot/status/808680173444927492"
"13/12/2016 15:26:38","","808679525718622210","1","Del mismo modo que podemos decir 'este libro de fantasía es el enésimo refrito de Tolkien sin niguna idea nueva', o 'aquí tenemos(...)","twitter.com/Rocigaot/status/808679525718622210"
"13/12/2016 15:19:05","1","808677625845710848","1","ay, sí, ya lo vi. Aún no tengo muy claro cómo puedes obligar a alguien a penetrarte contra su voluntad. ¿Viagra en la sopa?","twitter.com/Rocigaot/status/808677625845710848"
"13/12/2016 15:16:10","1","808676892689756161","1","Y también a decir 'no me pienso autocensurar' cuando es 'voy a quedarme con la 1ªversión que escribo sin plantearme si es mejorable'.","twitter.com/Rocigaot/status/808676892689756161"
"13/12/2016 15:12:09","2","808675881749245954","2","Y de ahí lógicamente se pasa a 'como si es humor no se me puede criticar, no tengo que molestarme en crear un contenido medio pasable'.","twitter.com/Rocigaot/status/808675881749245954"
"13/12/2016 15:11:12","5","808675643386904576","3","Esto lo he dicho más veces, pero hay gente que tiene la idea de que 'si es humor, no se me puede criticar porque libertad de expresión'.","twitter.com/Rocigaot/status/808675643386904576"
"13/12/2016 15:10:13","8","808675393855164417","3","Cremades, el niñato del caraanchoa... ah, EL HUMOR.","twitter.com/Rocigaot/status/808675393855164417"
"13/12/2016 14:59:56","","808672806909186048","","Que si te pilla con la guardia baja puede que ni reacciones, pero te pilla en modo 'un día de furia' y los huevos estrellados son los suyos.","twitter.com/Rocigaot/status/808672806909186048"
"13/12/2016 14:55:27","1","808671681669726208","2","¿Sabéis la magufada esa de la limpieza de colon? Me pilla de mala hostia y me hace esto y se lleva una gratis con la manguera del autolavadohttps://twitter.com/UniversoSimpson/status/808394619495055360 …Recuerdo cuando Gran Bomba subió esta '''''PRANK''''' y la borró, pero yo la rescaté antes con mi cañita de pescar. pic.twitter.com/VOJZBNo2O8","twitter.com/Rocigaot/status/808671681669726208"
"13/12/2016 10:37:26","4","808606748013719552","","Uno que hace 'humor' y tiene millones de followers.","twitter.com/Rocigaot/status/808606748013719552"
"13/12/2016 10:20:21","5","808602450563362816","","Cuando se me quede pequeño el gulag y tenga que montar unos juegos del hambre pa hacer hueco, Cremades va de cabeza.","twitter.com/Rocigaot/status/808602450563362816"
"12/12/2016 22:56:02","1","808430235955949569","1","https://twitter.com/MisterJoseMaria/status/808411989194248192 …Versión definitiva #caraanchoas pic.twitter.com/jHEO8Uqq6Q","twitter.com/Rocigaot/status/808430235955949569"
"12/12/2016 15:07:36","5","808312347790077952","2","Igual hoy se dan los regalos de amigo invisible en el Congreso, a Soraya se le pasó y paró en Primark a por un pijama para salir del paso.","twitter.com/Rocigaot/status/808312347790077952"
"12/12/2016 14:59:59","5","808310433786527745","","Pues voy a tener que volver al Primark porque al sujetador que me compré la semana pasada ya se le ha salido un aro. Soraya,¿te traigo algo?","twitter.com/Rocigaot/status/808310433786527745"
"12/12/2016 14:56:11","1","808309474742173699","","¡Entonces, en la próxima temporada vuelve Pacino!pic.twitter.com/Sy3wmUj90J","twitter.com/Rocigaot/status/808309474742173699"
"12/12/2016 0:49:49","6","808096481873973248","1","'mejor ver->igual alquilas el tugurio si te doy pena poniendo ojos de gato de Shrek","twitter.com/Rocigaot/status/808096481873973248"
"12/12/2016 0:45:14","7","808095325982511104","1","'Hay proyecto de instalar ascensor'-> A lo mejor para 2027 nos ponemos a ello.","twitter.com/Rocigaot/status/808095325982511104"
"12/12/2016 0:39:55","11","808093988364419072","","Zona muy tranquila: urbanización a media hora en coche de cualquier otra forma de vida.","twitter.com/Rocigaot/status/808093988364419072"
"12/12/2016 0:34:23","8","808092596329398272","2","se exigen garantías de solvencia-> Con tu sangre firmarás un pacto dejando a tu primogénito en señal","twitter.com/Rocigaot/status/808092596329398272"
"12/12/2016 0:33:07","8","808092277713289216","","Comunidad muy tranquila: si invitas a amigos el vecino los amenaza con el trabuco del abuelo.","twitter.com/Rocigaot/status/808092277713289216"
"12/12/2016 0:31:50","4","808091957398568960","","Alquiler directo con propietario, sin intermediarios-> ¡Contrato de alquiler, dice el muy cachondo!","twitter.com/Rocigaot/status/808091957398568960"
"12/12/2016 0:28:54","9","808091218798346240","1","ideal para Erasmus: vivir aquí convalida hasta cinco vacunas en caso de viaje a África.","twitter.com/Rocigaot/status/808091218798346240"
"12/12/2016 0:26:19","6","808090565694914560","1","oportunidad  para vivir en el centro a buen precio: camastro y campinggas en el cuarto de calderas","twitter.com/Rocigaot/status/808090565694914560"
"12/12/2016 0:24:26","3","808090091365220353","","Urbanización nueva con todos los lujos: oirás los pedos del vecino a través del pladur, pero ¡eh, hay pista de pádel!","twitter.com/Rocigaot/status/808090091365220353"
"12/12/2016 0:21:20","10","808089312776622080","2","A 10 minutos del centro: En coche,de madrugada, sin tráfico, saltándote semáforos y límite de velocidad, a unos 20.","twitter.com/Rocigaot/status/808089312776622080"
"12/12/2016 0:15:20","16","808087803586289664","3","Ideal estudiantes:en esta cama murió la bisabuela en 1950.
Diseño tipo loft: puedes cocinar sentado en el wc","twitter.com/Rocigaot/status/808087803586289664"
"11/12/2016 21:01:53","2","808039121721692160","","ya te digo! mi amiga común con esa chica decía que molaba un montón ir de fiesta con ella, te sentías super segura! XD","twitter.com/Rocigaot/status/808039121721692160"
"11/12/2016 21:00:29","3","808038766044712960","","a un pesado que no nos dejaba en paz ni a la de tres. Fue un momento grandioso, hará 15 años y sigo siendo ultrafan.","twitter.com/Rocigaot/status/808038766044712960"
"11/12/2016 20:58:32","3","808038276443631617","","de hecho me estoy acordando de una vez que una amiga de mi compi de piso, que es super fuerte, tumbó de un empujón(1)","twitter.com/Rocigaot/status/808038276443631617"
"11/12/2016 20:57:50","4","808038102472212480","","sí, si fijo que hay gente que si lo hace una chica por acoso callejero lo vería exagerado.Yo en ambos casos soy pro-galleta XD","twitter.com/Rocigaot/status/808038102472212480"
"11/12/2016 20:54:38","2","808037296662605825","","de hecho creo que me ha molao porque es lo que yo querría hacer y no puedo por desventaja física evidente :P","twitter.com/Rocigaot/status/808037296662605825"
"11/12/2016 20:44:36","","808034769367957504","","mítico momento!","twitter.com/Rocigaot/status/808034769367957504"
"11/12/2016 20:36:01","","808032611717312514","","polos vídeos seus que están rulando por ahí, o que me sorprende é que non levara ningunha hostia antes.","twitter.com/Rocigaot/status/808032611717312514"
"11/12/2016 20:13:46","","808027010354348032","","pic.twitter.com/a4KbYPrlHn","twitter.com/Rocigaot/status/808027010354348032"
"11/12/2016 20:12:23","21","808026663808274432","4","Y la prepotencia del 'y a ver qué dice su jefe, que de esa empresa soy cliente'. Es pa darle las hostias de 2 en 2 hasta que salga impar.","twitter.com/Rocigaot/status/808026663808274432"
"11/12/2016 20:09:08","17","808025843020795904","1","Después de ver el vídeo entero de la hostia me da penita. Me da penita no poder darle yo también, quiero decir.","twitter.com/Rocigaot/status/808025843020795904"
"11/12/2016 19:56:21","2","808022627289796608","","eso sí, si ya montó dramita Dalas cuando le tiraron zumo, verás este con lo de la hostia el casito que va a buscar.","twitter.com/Rocigaot/status/808022627289796608"
"11/12/2016 19:46:46","5","808020215028207616","","Me he perdido lo del Youtuber hostiado, pero viendo la moda de molestar a extraños para reírse en Internet,lo raro es que no les pase más.","twitter.com/Rocigaot/status/808020215028207616"
"11/12/2016 14:47:23","1","807944875559817216","","estará de gira! ","twitter.com/Rocigaot/status/807944875559817216"
"11/12/2016 14:14:48","6","807936672587464705","","Tipo que estás cantando padodobles en mi calle con el teclado y los amplis en un carrito, me rindo y pago lo que sea, pero calla un rato.","twitter.com/Rocigaot/status/807936672587464705"
"10/12/2016 23:46:14","","807718090981208064","","mis dieses.","twitter.com/Rocigaot/status/807718090981208064"
"10/12/2016 23:27:46","2","807713445529485313","","ay, no me acordaba, es de hace tiempo y es la risa! XDDD","twitter.com/Rocigaot/status/807713445529485313"
"10/12/2016 22:31:56","3","807699392421568512","","Oye, pues ahora que llegan las navidades es un regalazo!(o autorregalazo)","twitter.com/Rocigaot/status/807699392421568512"
"10/12/2016 19:37:19","8","807655450837663744","3","He comprado lencería sexy.pic.twitter.com/5a0NP8l6fj","twitter.com/Rocigaot/status/807655450837663744"
"10/12/2016 16:44:34","","807611978000826368","","pic.twitter.com/ouTiCl27RT","twitter.com/Rocigaot/status/807611978000826368"
"10/12/2016 16:19:22","","807605635084931072","","y posgrado en la universidad de la calle!","twitter.com/Rocigaot/status/807605635084931072"
"10/12/2016 16:16:04","","807604804730191872","","sabía que te iba a encantar!","twitter.com/Rocigaot/status/807604804730191872"
"10/12/2016 16:15:24","2","807604634592411648","","Me llamaréis desconfiada, pero albergo algunas dudas de que sea un psicoterapeuta titulado.","twitter.com/Rocigaot/status/807604634592411648"
"10/12/2016 16:12:30","10","807603905169334272","5","Acabo de ver por la calle esta maravilla de cartel.pic.twitter.com/8RQUVlw7Vz","twitter.com/Rocigaot/status/807603905169334272"
"10/12/2016 15:06:35","2","807587316923568128","","y a veces de periodista no ganas mucho más que de asistenta. Pero puedes necesitar coche si a la hora de cierre ya no hay bus.","twitter.com/Rocigaot/status/807587316923568128"
"9/12/2016 18:40:41","","807278808877432834","","Joder, tuve una compañera de trabajo que tenía esto de tono personalizado del móvil para su novio, y mi mente había bloqueado el recuerdo.https://twitter.com/CorazonYopuka/status/806902888349974528 …Hola buenas vengo del pasado para recordar este temazo pic.twitter.com/416KnZqtq0","twitter.com/Rocigaot/status/807278808877432834"
"9/12/2016 18:19:09","1","807273392588070914","","Y la historia de buscar al médico afgano en plan Marco y Amedio parece una de esas señales de 'igual hay que contrastar esto una miaja'.","twitter.com/Rocigaot/status/807273392588070914"
"9/12/2016 18:15:34","","807272489567010816","","hablas vas viendo que la historia se te ha quedado en nada porque la persona te está contando una película, se la crea ella misma o no.","twitter.com/Rocigaot/status/807272489567010816"
"9/12/2016 18:14:13","","807272149643882496","","A veces de periodista te pasa, te llega una historia curiosa, hablas con la persona en cuestión porque igual tiene un répor, y según (...)","twitter.com/Rocigaot/status/807272149643882496"
"9/12/2016 18:11:49","","807271544313565184","","¿Nadie le pidió detalles de cómo encuentras a un fulano que no conoces, escondido en una cueva en un país cuyo idioma no hablas?","twitter.com/Rocigaot/status/807271544313565184"
"9/12/2016 18:09:06","1","807270861799587840","1","y nos pusimos a patear Afganistán y encontramos al científico que íbamos buscando escondido en una cueva', ¿a nadie le sonó pelín inventer?","twitter.com/Rocigaot/status/807270861799587840"
"9/12/2016 18:08:24","2","807270685617885184","1","Porque puedo entender que en un caso con una niña enferma bajes la guardia y te confíes, pero lo de 'cogí a mi hija al borde de la muerte(..","twitter.com/Rocigaot/status/807270685617885184"
"9/12/2016 18:07:06","5","807270359665872897","1","Lo que más me flipa del caso de Nadia es que no se plantearan que igual era bola con la historia del científico en la cueva afgana.","twitter.com/Rocigaot/status/807270359665872897"
"9/12/2016 17:05:15","2","807254794872225792","","pic.twitter.com/LcSPPaDJ2k","twitter.com/Rocigaot/status/807254794872225792"
"9/12/2016 17:02:51","","807254188715606016","","hai algunha esperanza de que sexa algo que tiñan en neveira para o día dos inocentes e se lles escapou antes de tempo?","twitter.com/Rocigaot/status/807254188715606016"
"9/12/2016 16:56:30","1","807252591872737280","","ay, pues voy a mirar ya, que por ese precio me compensa probar! :D","twitter.com/Rocigaot/status/807252591872737280"
"9/12/2016 16:55:14","","807252272493264896","","Gracias! A veces pensé cogerlo y me echó para atrás el precio, pero para ir acumulando sujes baratos que se ceden en ná...","twitter.com/Rocigaot/status/807252272493264896"
"9/12/2016 16:51:36","1","807251357187117056","","los típicos 'para ocasiones especiales' que se quedan muertos de risa porque al final ligas cuando vas con el básico blanco.","twitter.com/Rocigaot/status/807251357187117056"
"9/12/2016 16:50:37","1","807251111665139714","","que siempre acabo picando porque son muy monos y porque recién estrenados son los que mejor me quedan. Ahora sólo compro(1)","twitter.com/Rocigaot/status/807251111665139714"
"9/12/2016 16:47:55","","807250433488121856","1","Y ya que hablaba antes de sujetadores. ¿Alguien por aquí que corra y tenga una copa C-D me recomienda algo que sujete y no ceda al 3ºlavado?","twitter.com/Rocigaot/status/807250433488121856"
"9/12/2016 16:42:20","1","807249025288273920","","aunque eso me pasa también con los de Intimissimi y son más del doble de caros :(","twitter.com/Rocigaot/status/807249025288273920"
"9/12/2016 16:41:08","12","807248725353566208","1","y suele haber un 'no ligo porque no soy un malote' que es como el 'sé que no darán like porque no es un perro de raza' del FB.","twitter.com/Rocigaot/status/807248725353566208"
"9/12/2016 15:13:43","","807226726581465088","","pois xa me fixarei a próxima vez que me toque ir e che conto! Eso sí, o das tallas é loquísimo,teño como de 3-4tallas distintas","twitter.com/Rocigaot/status/807226726581465088"
"9/12/2016 15:04:12","1","807224328953753600","","sei que teñen pero non os probei,eu normalmente uso sen push up pero con foam, porque se non vou coas largas postas por doquier","twitter.com/Rocigaot/status/807224328953753600"
"9/12/2016 15:02:15","2","807223841382690816","","Lo bueno de Primark es que tiene mogollón de tallas de sujetador. Lo malo es que el tallaje es tan loco que puedes llevarlas todas a la vez.","twitter.com/Rocigaot/status/807223841382690816"
"9/12/2016 14:55:30","","807222142265937920","","una amiga cajera en un súper contaba que tenían que hacerse las sorprendidas si una rata salía del almacén y la veía un cliente","twitter.com/Rocigaot/status/807222142265937920"
"9/12/2016 13:13:27","4","807196457682038785","","sí, si supuestos malotes que son Ross con los pantalones de cuero conozco unos cuantos también ","twitter.com/Rocigaot/status/807196457682038785"
"9/12/2016 13:08:28","","807195205162176512","","no la he visto, pero ese tío me representa totalmente","twitter.com/Rocigaot/status/807195205162176512"
"9/12/2016 12:45:48","363","807189498803195904","243","Soy fan de la dicotomía 'buen tío vs malote' porque muchas veces resulta que el 'buen tío' es más cabrón, pero con ropa elegida por su madre","twitter.com/Rocigaot/status/807189498803195904"
"8/12/2016 13:05:21","2","806832032672337921","","eso es ser precavida. Ser optimista sería llevarte la caja de 12.","twitter.com/Rocigaot/status/806832032672337921"
"8/12/2016 1:16:02","2","806653527271555072","","son todo ventajas, llegas pedo y desde la cama puedes potar o hacerte una pizza precocinada según necesites.","twitter.com/Rocigaot/status/806653527271555072"
"8/12/2016 1:12:48","1","806652715766050816","2","pues claro que puedo dejar un depósito de garantía de 9000 euros por su sótano loft con la cama entre el microondas y el wc!","twitter.com/Rocigaot/status/806652715766050816"
"7/12/2016 12:38:47","","806462960252186624","","ay, el clásico pillarte por alguien, agregaros al FB y ver que comparte vídeos de Cremades y frases de coaching.","twitter.com/Rocigaot/status/806462960252186624"
"6/12/2016 21:46:12","10","806238333907202049","6","Lo bonico de Twitter es que cuando crees que ya no puedes encontrar a alguien más idiota, ¡tachááán!","twitter.com/Rocigaot/status/806238333907202049"
"5/12/2016 16:53:32","2","805802293492936705","","Me está llegando un olor a porro brutal y las únicas personas cerca son dos señoras mayores típicas de Juan Flórez con sus pieles y joyones.","twitter.com/Rocigaot/status/805802293492936705"
"5/12/2016 0:46:12","1","805558856982077440","","cualquier día dedican un debate a 'nos esterilizan con chemtrails' y el siguiente a a 'El Mundo Today publica noticias falsas'.","twitter.com/Rocigaot/status/805558856982077440"
"5/12/2016 0:42:25","2","805557904560558080","","Sabía que la foto que le robé a @Chinobi_Ninja el otro día la iba a aprovechar pronto por aquí.","twitter.com/Rocigaot/status/805557904560558080"
"5/12/2016 0:41:53","34","805557771374620673","28","Ay, que están en Cuarto Milenio diciendo que saben 'de qué cojean' las webs satíricas tipo The Onion y acusándolas de difundir bulos.pic.twitter.com/hNGIb7R6qZ","twitter.com/Rocigaot/status/805557771374620673"
"4/12/2016 21:20:41","1","805507134813274113","","pero podéis organizar allí bautismos de buceo!","twitter.com/Rocigaot/status/805507134813274113"
"4/12/2016 15:18:56","9","805416099961589760","","Cuando en tu TL hablan de flames que no ves y asumes que es que has muteado sabiamente.pic.twitter.com/Nd4hOzdovS","twitter.com/Rocigaot/status/805416099961589760"
"4/12/2016 15:12:53","","805414577940860929","2","Confesor GO, el curiouscat católico.","twitter.com/Rocigaot/status/805414577940860929"
"4/12/2016 14:22:16","6","805401837859962880","","Que, comento, y vale también en el 1.0: no tiene mérito ser 'abierto' y salir con gente diferente si ridiculizáis todo lo que le gusta.","twitter.com/Rocigaot/status/805401837859962880"
"4/12/2016 14:18:52","4","805400982385475584","","'te hablo porque soy una persona abierta a salir con gente diferente pero no me privaré de lanzar pullitas por las mierdas que te gustan'.","twitter.com/Rocigaot/status/805400982385475584"
"4/12/2016 14:17:44","1","805400697751609344","","Pero te expones a atraer a mucha gente que te entra con el test de true fan o despreciando sutilmente tus gustos, el clásico (...)","twitter.com/Rocigaot/status/805400697751609344"
"4/12/2016 14:13:59","2","805399753131433984","","También es cierto que queda menos sobrao enfocarlo desde el 'me gustan x cosas y tengo x ideas' que desde el 'quiero alguien así y así'(...)","twitter.com/Rocigaot/status/805399753131433984"
"4/12/2016 14:07:13","1","805398050797682688","","en cuanto me huele a 'nos estamos conociendo a ver si pegamos de novios' me da complejo de entrevista de trabajo y me agobio XD","twitter.com/Rocigaot/status/805398050797682688"
"4/12/2016 14:06:11","1","805397790734094336","","tipo somos compañeros de clase, o coincidimos por amigos comunes, y a medida que nos vamos tratando va surgiendo solo.(3)","twitter.com/Rocigaot/status/805397790734094336"
"4/12/2016 14:05:18","1","805397568268234752","","sobre la marcha vamos viendo que también encajamos para otras cosas, o conozco a alguien sin que haya intención sentimental(2)","twitter.com/Rocigaot/status/805397568268234752"
